uri,track,duration_ms,album,artist,played_at,danceability,energy,key,loudness,speechiness,acousticness,instrumentalness,liveness,valence,tempo,lyrics
spotify:track:5lRzWDEe7UuedU2QPsFg0K,The Funeral,322173,Everything All The Time,Band of Horses,2021-11-07T12:57:25.463Z,0.319,0.757,0,-6.117,0.0432,0.016,0.0,0.102,0.101,122.465,"I'm coming up only to hold you under
I'm coming up only to show you wrong
And to know you is hard, we wonder
To know you all wrong, we were

Ooh
Ooh

Really too late to call so we wait for
Morning to wake you is all we got
And to know me as hardly golden
Is to know me all wrong, they warn

At every occasion, I'll be ready for the funeral
At every occasion once more, it's called the funeral
At every occasion, oh, I'm ready for the funeral
At every occasion, oh, one billion day funeral

I'm coming up only to show you down for
And coming up only to show you're wrong
To the outside, the dead leaves lay on the lawn
For they don't have trees to hang upon

Ooh
Ooh

At every occasion, I'll be ready for the funeral
At every occasion once more, it's called the funeral
At every occasion, oh, I'm ready for the funeral
At every occasion, oh, one billion day funeral

I'm coming up only to show you down for
And coming up only to show you're wrong
To the outside, the dead leaves lay on the lawn
For they don't have trees to hang upon

Ooh
Ooh"
spotify:track:45S5WTQEGOB1VHr1Q4FuPl,Golden,208906,Fine Line,Harry Styles,2021-11-07T12:49:44.859Z,0.448,0.838,4,-5.257,0.0557,0.21,0.000131,0.131,0.254,139.863,"

[Intro]
Hey!

[Verse 1]
Golden, golden, golden as I open my eyes
Hold it, focus, hoping, take me back to the light
I know you were way too bright for me
I'm hopeless, broken, so you wait for me in the sky
Brown my skin just right
You're so golden

[Chorus]
You're so golden
I'm out of my head, and I know that you're scared
Because hearts get broken

[Verse 2]
I don't wanna be alone
I don't wanna be alone when it ends
Don't wanna let you know
I don't wanna be alone
But I can feel it take a hold (I can feel it take a hold)
I can feel you take control (I can feel you take control)
Of who I am, and all I've ever known
Lovin' you's the antidote
Golden

[Chorus]
You're so golden
I don't wanna be alone
You're so golden
You're so golden
I'm out of my head, and I know that you're scared
Because hearts get broken

[Bridge]
(Golden, golden, golden, golden)
(Golden, golden, golden, golden)
(Golden, golden, golden, golden)
(Golden, golden, golden, golden)
(Golden, golden, golden, golden)
(Golden, golden, golden, golden)
(Golden, golden, golden, golden)
I know that you're scared because I'm so open

[Chorus]
You're so golden
I don't wanna be alone
You're so golden
You're so golden
You're so golden
I'm out of my head, and I know that you're scared
Because hearts get broken

"
spotify:track:24dDPE4oHxj29O1RUgkMkE,EVERGREEN,167785,Nonsuch Park (sa),Scott Helman,2021-11-07T12:46:15.358Z,0.637,0.751,0,-5.818,0.0799,0.259,3.96e-05,0.0647,0.717,160.009,"Oh, oh, oh, oh, ooh

There's cups in the lake, and heat from the beam
Rising seas, and a world on fire
Sun shines, so we draw the blinds
Someone chuckles from the back of a fire, and now
Too late to go outside
There's money in a pocket, but it sure ain't mine
Some days I'm doing fine
Most I'm losing my mind

And I can't take it
This ever-changing, spinning world
But maybe I can make it
If we plant seeds in the dirt

I think I need a change of scene
I think I need to change my life
Thank god our love is evergreen
The only thing that never, the only thing that never
Says a word it doesn't mean
Makes me feel like I'm alive
Thank god our love is evergreen
The only thing that never, the only thing that never dies
Oh, oh, oh, oh, ooh
There's a flood in the south, and a kid so high
He can't remember how to ride his bike
Moon shines on a silver dime
But I picked it up, so I guess it's mine
Painted grass, and smog in the sky
But can I just kiss that teardrop in your eye?
Some days you're doing fine
Most you're losing your mind

I think I need a change of scene
I think I need to change my life
Thank god our love is evergreen
The only thing that never, the only thing that never
Says a word it doesn't mean
Makes me feel like I'm alive
Thank god our love is evergreen
The only thing that never, the only thing that never dies
Oh, oh, oh, oh, ooh

And I can't take it
This ever-changing, spinning world
But maybe I can make it
If we plant seeds in the dirtEmbedShare URLCopyEmbedCopy"
spotify:track:3tTjbUTjqHYBhrsGtF6YFA,Sad People Dancing,265080,Sad People Dancing,La Bouquet,2021-11-07T12:39:06.640Z,0.632,0.529,7,-8.83,0.0412,0.057,2.19e-05,0.289,0.485,117.516,"I want to feel, I want to feel
Better than I do right now
I want to feel so help me feel
Better than yesterday
'Cause I've been watching the planes roll in
And people embrace from time that they've spent apart
And I've been waiting for someone to come and save me
So won't you save me?

Oooh it's just like standing in the rain without you
It's just like watching a party from the other room
It's just like sad people dancing around the room
It's just like sad people dancing
It's just like sad people dancing

I can bring you back and help you feel
Better than you have before
Ooh trust me I know how this goes
I know what it's like to feel all alone
I don't want to go back to that
I know you don't either
Eat your heart out baby
Pour out your sweat with me
No one is watching
'Cause no one cares
Please stop thinking
Please just be here

Oooh it's just like standing in the rain without you
It's just like watching a party from the other room
It's just like sad people dancing around the room
It's just like sad people dancing
It's just like sad people dancing


Oooh it's just like standing in the rain without you
It's just like watching a party from the other room
It's just like sad people dancing around the room
It's just like sad people dancing around

Oooh it's just like sad people dancing around the room
It's just like sad people dancing
It's just like sad people dancing"
