uri,track,duration_ms,album,artist,played_at,danceability,energy,key,loudness,speechiness,acousticness,instrumentalness,liveness,valence,tempo,lyrics
spotify:track:4RvWPyQ5RL0ao9LPZeSouE,Everybody Wants To Rule The World,251488,Songs From The Big Chair (Super Deluxe Edition),Tears For Fears,2021-11-09T18:10:30.397Z,0.645,0.795,7,-12.095,0.0527,0.347,0.00389,0.104,0.535,112.067,"

[Verse 1]
Welcome to your life
There's no turning back
Even while we sleep
We will find you

[Chorus]
Acting on your best behaviour
Turn your back on Mother Nature
Everybody wants to rule the world

[Verse 2]
It's my own design
It's my own remorse
Help me to decide
Help me make the

[Chorus]
Most of freedom and of pleasure
Nothing ever lasts forever
Everybody wants to rule the world

[Bridge]
There's a room where the light won't find you
Holding hands while the walls come tumbling down
When they do, I'll be right behind you

[Chorus]
So glad we've almost made it
So sad they had to fade it
Everybody wants to rule the world

[Instrumental Interlude]

[Chorus]
I can't stand this indecision
Married with a lack of vision
Everybody wants to rule the—
Say that you'll never, never, never, never need it
One headline, why believe it?
Everybody wants to rule the world
All for freedom and for pleasure
Nothing ever lasts forever
Everybody wants to rule the world

"
spotify:track:2MLHyLy5z5l5YRp7momlgw,Island In The Sun,200306,Weezer (Green Album),Weezer,2021-11-09T18:09:44.279Z,0.654,0.81,4,-6.26,0.0288,0.00719,0.00251,0.165,0.661,114.623,"

[Intro]
Hip hip
Hip hip
Hip hip
Hip hip

[Verse 1]
When you're on a holiday
You can't find the words to say
All the things that come to you
And I wanna feel it too

[Chorus]
On an island in the sun
We'll be playing and having fun
And it makes me feel so fine
I can't control my brain

[Post-Chorus]
Hip hip
Hip hip

[Verse 2]
When you're on a golden sea
You don't need no memory
Just a place to call your own
As we drift into the zone

[Chorus]
On an island in the sun
We'll be playing and having fun
And it makes me feel so fine
I can't control my brain

[Bridge]
We'll run away together
We'll spend some time forever
We'll never feel bad anymore

[Post-Chorus]
Hip hip
Hip hip
Hip hip

[Guitar Solo]

[Chorus]
On an island in the sun
We'll be playing and having fun
And it makes me feel so fine
I can't control my brain

[Bridge]
We'll run away together
We'll spend some time forever
We'll never feel bad anymore

[Outro]
Hip hip
Hip hip (We'll never feel bad anymore)
Hip hip (No, no)
Hip hip
Hip hip (We'll never feel bad anymore)
Hip hip (No, no)
Hip hip (No, no)
Hip hip

"
spotify:track:34QoWDjjWjZB4cHnJfEOpV,Before We Drift Away,254378,Moral Panic,Nothing But Thieves,2021-11-07T14:31:27.954Z,0.51,0.422,9,-9.667,0.0287,0.333,0.0372,0.124,0.17,89.983,"I wonder where I float to
When I return to dust?
A sea to wash away the last of us
It's such a funny feeling
The world's at war again
But in this very moment
Oh, it couldn't matter less  (Oh, oh)
Immersed in deepest ocean
The waves all move as one
Then separate themselves under the sun

And as we sing this familiar song
I thought I'm gonna miss your love when it's gone
Will it flow into the river?
Or will it go to waste?
Before we drift away
Before we drift away

Somnus waits for no one
A clock without a facе
Will it feel like an arrest or our escapе?

And as we sing this familiar song
I thought I'm gonna miss your love when it's gone
Will it flow into the river?
Or will it go to waste?
Before we drift away
Before we drift away
I'm gonna hang on this forever
Hang on to this forever
Hang on to this forever
Forever

And as we sing this familiar song
I thought I'm gonna miss your love when it's gone
Will it flow into the river?
Or will it go to waste?
Before we drift away

I'm gonna hang on this forever
Hang on to this forever
Hang on to this forever

I don't wanna grow old7EmbedShare URLCopyEmbedCopy"
spotify:track:3WMnGDg6Wui7vwCXudhivB,Photograph,209000,Pictures of Mountains,Cody Fry,2021-11-07T14:30:55.329Z,0.36,0.232,1,-10.366,0.0339,0.947,7.76e-05,0.0837,0.305,111.594,"It's the evening light
Shining through the curtains
Time before the night
When everything is golden
You’re sitting on the chair
Wrapped inside a bedsheet
Playing with your hair
Watching people on high street

If I wished myself a superpower
I would make this moment last for hours
If I had my will
Time would just stand still
Wait for me until
I find some magic film
To take a photograph and live inside

Sun is going down
Your skin is like a painting
Light is perfect now
I can feel it changing
Kids are probably soon
Don't get me wrong I'm ready
I know what to do
When we’re no longer two
When us means more than me and you (Oh)

If I wished myself a superpower
I would make this moment last for hours
If I had my will
Time would just stand still
Wait for me until
I find some magic film
To take a photograph and live inside

I need some way to prove that this was real
A memory is not enough
I'm scared that I'll forget the way it feels to be young and in love

Let me stay right here
Just a moment longer
The picture is so clear
Please let this last forever"
spotify:track:50M7nY1oQuNHecs0ahWAtI,I Need My Girl,245240,Trouble Will Find Me,The National,2021-11-07T14:29:18.067Z,0.52,0.436,0,-11.508,0.0355,0.865,0.0651,0.123,0.114,126.053,"

[Chorus]
I am good, I am grounded
Davy says that I look taller
But I can't get my head around it
I keep feeling smaller and smaller
I need my girl
I need my girl

[Verse 1]
Remember when you lost your shit and
Drove the car into the garden?
You got out and said ""I'm sorry""
To the vines and no one saw it
I need my girl
I need my girl

[Pre-Chorus]
I'm under the gun again
I know I was a 45-percenter then
I know I was a lot of things

[Chorus]
But I am good, I am grounded
Davy says that I look taller
But I can't get my head around it
I keep feeling smaller and smaller
I need my girl
I need my girl

[Verse 2]
There's some things that I should never
Laugh about in front of family
I tried to call you from the party
It's full of punks and cannonballers
I need my girl
I need my girl

[Pre-Chorus]
I'm under the gun again
I know I was a 45-percenter then
I know I was a lot of things

[Chorus]
But I am good, I am grounded
Davy says that I look taller
I can't get my head around it
I keep feeling smaller and smaller
I keep feeling smaller and smaller
I keep feeling smaller and smaller

"
spotify:track:5BK0uqwY9DNfZ630STAEaq,gold rush,185320,evermore,Taylor Swift,2021-11-07T14:29:12.537Z,0.512,0.462,9,-10.491,0.0408,0.83,0.166,0.121,0.353,112.05,"

[Intro]
Gleaming, twinkling
Eyes like sinking ships on waters
So inviting, I almost jump in

[Chorus]
But I don't like a gold rush, gold rush
I don't like anticipatin' my face in a red flush
I don't like that anyone would die to feel your touch
Everybody wants you
Everybody wonders what it would be like to love you
Walk past, quick brush
I don't like slow motion, double vision in rose blush
I don't like that falling feels like flying 'til the bone crush
Everybody wants you
But I don't like a gold rush

[Verse 1]
What must it be like to grow up that beautiful?
With your hair falling into place like dominoes
I see me padding across your wooden floors
With my Eagles t-shirt hanging from the door

[Refrain]
At dinner parties, I call you out on your contrarian shit
And the coastal town we wandered 'round had nеver seen a love as pure as it
And thеn it fades into the gray of my day-old tea
'Cause it could never be

[Chorus]
'Cause I don't like a gold rush, gold rush
I don't like anticipatin' my face in a red flush
I don't like that anyone would die to feel your touch
Everybody wants you
Everybody wonders what it would be like to love you
Walk past, quick brush
I don't like slow motion, double vision in rose blush
I don't like that falling feels like flying 'til the bone crush
Everybody wants you
But I don't like a gold rush

[Verse 2]
What must it be like to grow up that beautiful?
With your hair falling into place like dominoes
My mind turns your life into folklore
I can't dare to dream about you anymore

[Refrain]
At dinner parties I won't call you out on your contrarian shit
And the coastal town we never found will never see a love as pure as it
'Cause it fades into the gray of my day-old tea
'Cause it will never be

[Outro]
Gleaming, twinkling
Eyes like sinking ships on waters
So inviting, I almost jump in

"
spotify:track:5BK0uqwY9DNfZ630STAEaq,gold rush,185320,evermore,Taylor Swift,2021-11-07T14:26:10.071Z,0.512,0.462,9,-10.491,0.0408,0.83,0.166,0.121,0.353,112.05,"

[Intro]
Gleaming, twinkling
Eyes like sinking ships on waters
So inviting, I almost jump in

[Chorus]
But I don't like a gold rush, gold rush
I don't like anticipatin' my face in a red flush
I don't like that anyone would die to feel your touch
Everybody wants you
Everybody wonders what it would be like to love you
Walk past, quick brush
I don't like slow motion, double vision in rose blush
I don't like that falling feels like flying 'til the bone crush
Everybody wants you
But I don't like a gold rush

[Verse 1]
What must it be like to grow up that beautiful?
With your hair falling into place like dominoes
I see me padding across your wooden floors
With my Eagles t-shirt hanging from the door

[Refrain]
At dinner parties, I call you out on your contrarian shit
And the coastal town we wandered 'round had nеver seen a love as pure as it
And thеn it fades into the gray of my day-old tea
'Cause it could never be

[Chorus]
'Cause I don't like a gold rush, gold rush
I don't like anticipatin' my face in a red flush
I don't like that anyone would die to feel your touch
Everybody wants you
Everybody wonders what it would be like to love you
Walk past, quick brush
I don't like slow motion, double vision in rose blush
I don't like that falling feels like flying 'til the bone crush
Everybody wants you
But I don't like a gold rush

[Verse 2]
What must it be like to grow up that beautiful?
With your hair falling into place like dominoes
My mind turns your life into folklore
I can't dare to dream about you anymore

[Refrain]
At dinner parties I won't call you out on your contrarian shit
And the coastal town we never found will never see a love as pure as it
'Cause it fades into the gray of my day-old tea
'Cause it will never be

[Outro]
Gleaming, twinkling
Eyes like sinking ships on waters
So inviting, I almost jump in

"
spotify:track:4R2kfaDFhslZEMJqAFNpdd,cardigan,239560,folklore,Taylor Swift,2021-11-07T14:25:16.967Z,0.613,0.581,0,-8.588,0.0424,0.537,0.000345,0.25,0.551,130.033,"Vintage tee, brand new phone
High heels on cobblestones
When you are young, they assume you know nothing
Sequin smile, black lipstick
Sensual politics
When you are young, they assume you know nothing

But I knew you
Dancin' in your Levi's
Drunk under a streetlight, I
I knew you
Hand under my sweatshirt
Baby, kiss it better, I

And when I felt like I was an old cardigan
Under someone's bed
You put me on and said I was your favorite

A friend to all is a friend to none
Chase two girls, lose the one
When you are young, they assume you know nothing

But I knew you
Playing hide-and-seek and
Giving me your weekends, I
I knew you
Your heartbeat on the High Line
Once in twenty lifetimes, I

And when I felt like I was an old cardigan
Under someone's bed
You put me on and said I was your favorite

To kiss in cars and downtown bars
Was all we needed
You drew stars around my scars
But now I'm bleedin'

'Cause I knew you
Steppin' on the last train
Marked me like a bloodstain, I
I knew you
Tried to change the ending
Peter losing Wendy, I
I knew you
Leavin' like a father
Running like water, I
And when you are young, they assume you know nothing

But I knew you'd linger like a tattoo kiss
I knew you'd haunt all of my what-ifs
The smell of smoke would hang around this long
'Cause I knew everything when I was young
I knew I'd curse you for the longest time
Chasin' shadows in the grocery line
I knew you'd miss me once the thrill expired
And you'd be standin' in my front porch light
And I knew you'd come back to me
You'd come back to me
And you'd come back to me
And you'd come back

And when I felt like I was an old cardigan
Under someone's bed
You put me on and said I was your favorite"
spotify:track:4QlzkaRHtU8gAdwqjWmO8n,Friday I'm In Love,215160,Wish,The Cure,2021-11-07T14:23:34.813Z,0.526,0.763,0,-12.663,0.0341,0.00126,6.75e-05,0.359,0.514,136.205,"I don't care if Monday's blue
Tuesday's grey and Wednesday too
Thursday I don't care about you
It's Friday, I'm in love
Monday you can fall apart
Tuesday, Wednesday, break my heart
Oh, Thursday doesn't even start
It's Friday, I'm in love

Saturday, wait
And Sunday always comes too late
But Friday, never hesitate

I don't care if Monday's black
Tuesday, Wednesday heart attack
Thursday never looking back
It's Friday, I'm in love
Monday you can hold your head
Tuesday, Wednesday stay in bed
Or Thursday watch the walls instead
It's Friday, I'm in love

Saturday, wait
And Sunday always comes too late
But Friday, never hesitate
Dressed up to the eyes
It's a wonderful surprise
To see your shoes and your spirits rise
Throwing out your frown
And just smiling at the sound
And as sleek as a shriek
Spinning round and round
Always take a big bite
It's such a gorgeous sight
To see you eat in the middle of the night
You can never get enough
Enough of this stuff
It's Friday I'm in love

I don't care if Monday's blue
Tuesday's grey and Wednesday too
Thursday I don't care about you
It's Friday, I'm in love
Monday you can fall apart
Tuesday, Wednesday break my heart
Thursday doesn't even start
It's Friday, I'm in love38EmbedShare URLCopyEmbedCopy"
spotify:track:5VGlqQANWDKJFl0MBG3sg2,Use Somebody,230760,Only By The Night,Kings of Leon,2021-11-07T14:23:15.038Z,0.276,0.715,0,-5.356,0.0432,0.00552,0.000417,0.201,0.173,137.028,"I've been roamin' around, always lookin' down at all I see
Painted faces fill the places I can't reach
You know that I could use somebody
You know that I could use somebody
Someone like you and all you know and how you speak
Countless lovers under cover of the street
You know that I could use somebody
You know that I could use somebody

Someone like you

Off in the night, while you live it up I'm off to sleep
Wagin' wars to shape the poet and the beat
I hope it's gonna make you notice
I hope it's gonna make you notice

Someone like me
Someone like me
Someone like me
Somebody

I'm ready now
I'm ready now
I'm ready now
I'm ready now
I'm ready now
I'm ready now
I'm ready now

Someone like you
Somebody
Someone like you
Somebody
Someone like you
Somebody

I've been roamin' around, always lookin' down at all I see50EmbedShare URLCopyEmbedCopy"
spotify:track:1foMv2HQwfQ2vntFf9HFeG,Rhinestone Eyes,200173,Plastic Beach,Gorillaz,2021-11-07T14:20:06.856Z,0.676,0.703,8,-5.815,0.0302,0.0869,0.000687,0.0463,0.852,92.761,"

[Verse 1]
I'm a scary gargoyle on a tower
That you made with plastic power
Your rhinestone eyes are like factories far away
Where the paralytic dreams that we all seem to keep
Drive on engines till they weep
With future pixels in factories far away
So call the mainland from the beach
Your heart is now washed up in bleach
The waves are rising for this time of year
And nobody knows what to do with the heat
Under sunshine pylons, we'll meet
While rain is falling like rhinestones from the sky

[Chorus]
(Uh)
(Mmmmm)

[Verse 2]
I can't see you now my heart is frozen
All the bowses and the growses
Have been abstinated in my soul
I prayed on the immovable
Yet clinging to the atoms of rock
Seasons see adjustment signs of change
I can't see now, she said, ""Taxi""
Now that light is all I can take
This dawn brings strange loyalties and skies
I'm a scary gargoyle on a tower
That you made with plastic power
Your rhinestone eyes are like factories far away

[Chorus]
(Here we go again)
That's electric
(Uh)
That's electric

[Verse 3]
Helicopters fly over the beach
Same time every day, same routine
A clear target in the summer when skies are blue
It's part of the noise when winter comes
It reverberates in my lungs
Nature's corrupted in factories far away

[Chorus]
(Here we go again)
That's electric
Your love's like rhinestones falling from the sky (uh)
That's electric
With future pixels in factories far away
(Here we go again)
That's electric
Your love's like rhinestones falling from the sky (uh)
That's electric
With future pixels in factories far away
(Here we go again)

"
spotify:track:0sElHCOGB2n8Nlo6GOtWnq,It's My Party,142333,20th Century Masters: The Millennium Collection: Best Of Lesley Gore,Lesley Gore,2021-11-07T14:17:37.327Z,0.683,0.71,9,-7.445,0.114,0.403,0.0,0.086,0.931,128.181,"

[Chorus]
It's my party, and I'll cry if I want to
Cry if I want to, cry if I want to
You would cry too if it happened to you

[Verse 1]
Nobody knows where my Johnny has gone (Johnny has gone)
But Judy left the same time
Why was he holding her hand
When he's supposed to be mine?

[Chorus]
It's my party, and I'll cry if I want to
Cry if I want to, cry if I want to
You would cry too if it happened to you

[Verse 2]
Play all my records, keep dancing all night (Dancing all night)
But leave me alone for a while
'Til Johnny's dancing with me
I've got no reason to smile

[Chorus]
It's my party, and I'll cry if I want to
Cry if I want to, cry if I want to
You would cry too if it happened to you

[Verse 3]
Judy and Johnny just walked through the door (Walked through the door)
Like a queen with her king
Oh, what a birthday surprise
Judy's wearin' his ring

[Chorus]
It's my party, and I'll cry if I want to
Cry if I want to, cry if I want to
You would cry too if it happened to you

[Outro]
Oh-oh, it's my party, and I'll cry if I want to
Cry if I want to, cry if I want to
You would cry too if it happened to you
It's my party, and I'll cry if I want to

"
spotify:track:1sTsuZTdANkiFd7T34H3nb,Human,245373,Day & Age (Bonus Tracks),The Killers,2021-11-07T14:15:07.625Z,0.557,0.8,10,-8.477,0.0601,0.00132,0.0012,0.0906,0.582,135.47,"

[Verse 1]
I did my best to notice
When the call came down the line
Up to the platform of surrender
I was brought, but I was kind
And sometimes I get nervous
When I see an open door
Close your eyes, clear your heart

[Pre-Chorus 1]
Cut the cord

[Chorus]
Are we human
Or are we dancer?
My sign is vital
My hands are cold
And I'm on my knees
Looking for the answer
Are we human
Or are we dancer?

[Verse 2]
Pay my respects to grace and virtue
Send my condolences to good
Give my regards to soul and romance
They always did the best they could
And so long to devotion
You taught me everything I know
Wave goodbye, wish me well

[Pre-Chorus 2]
You've got to let me go

[Chorus]
Are we human
Or are we dancer?
My sign is vital
My hands are cold
And I'm on my knees
Looking for the answer
Are we human
Or are we dancer?

[Bridge]
Will your system be alright
When you dream of home tonight?
There is no message we're receiving
Let me know, is your heart still beating?

[Chorus]
Are we human
Or are we dancer?
My sign is vital
My hands are cold
And I'm on my knees
Looking for the answer

[Pre-Chorus 3]
You've got to let me know

[Chorus]
Are we human
Or are we dancer?
My sign is vital
My hands are cold
And I'm on my knees
Looking for the answer
Are we human
Or are we dancer?

[Outro]
Are we human
Or are we dancer?
Are we human
Or are we dancer?

"
spotify:track:5e6sklOXEsNqSrEPDR1T3Z,Karaoke,200000,Thundering Hopes,Hazlett,2021-11-07T14:14:40.042Z,0.544,0.467,6,-10.583,0.0414,0.572,0.00074,0.0819,0.264,96.187,"

[Verse 1]
Close to your curfew
So we'll go sing karaoke
Charming and a fool
The way you serenade the room
Her sister's got no ID
She won't let me be Springsteen
Boy, your friends are stars
So we'll go sing karaoke

[Chorus]
Tuck you under
My wing and try to take you home
Start to wonder
If we can make it on our own

[Verse 2]
Stand up on the bar
Is that the sound of a rooster?
Turned sour in the car
You're sick and I just hold your hair
Riding coattails for free
Never was part of the dream
Stand up on the bar
Show me the sound of a rooster

[Chorus]
Tuck you under
My wing and try to take you home
Start to wonder
If we can make it on our own

"
spotify:track:5lRzWDEe7UuedU2QPsFg0K,The Funeral,322173,Everything All The Time,Band of Horses,2021-11-07T14:14:18.065Z,0.319,0.757,0,-6.117,0.0432,0.016,0.0,0.102,0.101,122.465,"I'm coming up only to hold you under
I'm coming up only to show you wrong
And to know you is hard, we wonder
To know you all wrong, we were

Ooh
Ooh

Really too late to call so we wait for
Morning to wake you is all we got
And to know me as hardly golden
Is to know me all wrong, they warn

At every occasion, I'll be ready for the funeral
At every occasion once more, it's called the funeral
At every occasion, oh, I'm ready for the funeral
At every occasion, oh, one billion day funeral

I'm coming up only to show you down for
And coming up only to show you're wrong
To the outside, the dead leaves lay on the lawn
For they don't have trees to hang upon
Ooh
Ooh

At every occasion, I'll be ready for the funeral
At every occasion once more, it's called the funeral
At every occasion, oh, I'm ready for the funeral
At every occasion, oh, one billion day funeral

I'm coming up only to show you down for
And coming up only to show you're wrong
To the outside, the dead leaves lay on the lawn
For they don't have trees to hang upon

Ooh
Ooh64EmbedShare URLCopyEmbedCopy"
spotify:track:0DuWDLjriRPjDRoPgaCslY,Love In The Dark,285935,25,Adele,2021-11-07T14:14:04.162Z,0.495,0.323,9,-6.901,0.0275,0.536,0.0,0.109,0.14,109.731,"Take your eyes off of me so I can leave
I'm far too ashamed to do it with you watching me
This is never ending, we have been here before
But I can't stay this time 'cause I don't love you anymore

Please stay where you are, don't come any closer
Don't try to change my mind, I'm being cruel to be kind

I can't love you in the dark
It feels like we're oceans apart
There is so much space between us
Baby, we're already defeated
Ah-yeah-yeah-yeah-yeah-yeah-yeah-yeah everything changed me

You have given me something that I can't live without
You mustn't underestimate that when you are in doubt
But I don't want to carry on like everything is fine
The longer we ignore it all the more that we will fight

Please don't fall apart, I can't face your breaking heart
I'm trying to be brave, stop asking me to stay

I can't love you in the dark
It feels like we're oceans apart
There is so much space between us
Baby, we're already defeated
Ah-yeah-yeah-yeah-yeah-yeah-yeah-yeah everything changed me

We're not the only ones
I don't regret a thing
Every word I've said
You know I'll always mean
It is the world to me
That you are in my life
But I want to live and not just survive


That's why I can't love you in the dark
It feels like we're oceans apart
There is so much space between us
Baby, we're already defeated
'Cause ah-yeah-yeah-yeah-yeah-yeah everything changed me
And I-I-I-I-I don't think you can save me"
spotify:track:3iJya7m7trpGv570Ske30n,I Hear a Symphony,185176,Flying,Cody Fry,2021-11-07T14:13:27.651Z,0.207,0.243,10,-8.181,0.0306,0.925,0.0342,0.118,0.394,171.648,"

[Verse 1]
I used to hear a simple song
That was until you came along
Now in its place is something new
I hear it when I look at you

[Verse 2]
With simple songs, I wanted more
Perfection is so quick to bore
You are my beautiful, by far
Our flaws are who we really are

[Verse 3]
I used to hear a simple song
That was until you came along
You took my broken melody
And now, I hear a symphony

[Outro]
And now, I hear
A symphony

"
spotify:track:4QzfJdvkSwafaiFc1kDZ5W,Silence,227398,Silence,Boston the Girl,2021-11-07T14:12:55.914Z,0.309,0.454,3,-8.6,0.0282,0.715,1.61e-05,0.113,0.108,82.513,"Verse 1:
Silence is a good old friend
She’s been with me ever since I could care
She’s never let me down before
Silence
Pre-chorus:
When I talk, she listens
When I leave, it makes no difference
Chorus:
She’s being loud, wish she’d settle down
Oh, she’s the only one who ever sticks around
I hate the sound of her voice when she says
I'm the one who keeps turning her down
Her down, her down, her down
Verse 2:
She holds me
Tells me, “You're on your own”
I believe her
She's never been wrong before
Pre-chorus:
When I talk, she listens
When I leave, it makes no difference
Chorus:
She’s being loud, wish she’d settle down
Oh, she’s the only one who ever sticks around
I hate the sound of her voice when she says
I'm the one who keeps turning her down
Her down, her down, her down
Bridge:
I would love to get a few words in
She’s so quiet, I’ll just go back again
She said nothing, I knew that meant
She’s going to leave
Chorus:
She’s being loud, wish she’d settle down
Oh, she’s the only one who ever sticks around
I hate the sound of her voice when she says
I'm the one who keeps turning her down
Her down, her down, her down"
