artist,album,track,track_id,danceability,energy,key,loudness,speechiness,acousticness,instrumentalness,liveness,valence,tempo,duration_ms,time_signature,mood,lyrics
XXXTENTACION,"XXXTENTACION Presents: Members Only, Vol. 3",Off the Wall!,0GRmh4ZlobfhvDE9L4CbOs,0.834,0.374,1,-10.173,0.333,0.123,0.0,0.134,0.545,140.001,203494,4,Angry,"{'title': 'XXXTENTACION – Off the Wall! Lyrics', 'lyrics': '[Intro: Corey Taylor & Ski Mask the Slump God]\nDid you never give a damn in the first place?\nMaybe it\'s time you had the tables turned (Cigarettes, hahaha)\n\'Cause in the interest of all involved, I got the problem solved\nAnd the verdict is guilty (Off the pink)\nMan nearly kill- (Off the drink)\nAyy, ayy, ayy, ooh, huh\nAyy, ayy, ayy, ayy, ayy, ayy, ayy, ayy, ayy, ayy\n\n[Chorus: Ski Mask The Slump God]\nI feel like Nick Cannon (Nick), huh\n\'Cause I\'m wildin\' out (\'Cause I\'m wildin\'), huh\nI don\'t got on Vans (I don\'t got \'em)\nBut bitch, I\'m off the wall (I don\'t, I don\'t, I don\'t, I don\'t)\nHuh, feel like Nick Cannon (Feel like Nick), huh\n\'Cause I\'m wildin\' out (\'Cause I\'m, huh), huh\nI don\'t got on Vans, but bitch, I\'m off the wall (Wall, wall, water)\nI said like insect (Ew), I be buggin\' motherfucker (Ow)\nFuck on your mommy, my flow be sick\nLike that bitch gotta vomit, to vomit, to vomit (Gotta, gotta, gotta, gotta, gotta, gotta, gotta, gotta, gotta, gotta)\nI\'m hot like a comet\nInsect, I be buggin\' motherfucker (Insect, ayy)\nFuck on your mommy (Uh-huh, ayy)\nMy flow be sick like that bitch gotta vomit, to vomit, to vomit (Yuh, sick, ayy)\nI\'m hot like a comet (Ayy)\n[Verse 1: Ski Mask The Slump God]\nWhen I di-di-di-di-di-dick that bitch\nAnd she see Jesus on some rapture shit\nThrow my balls at her Pokémon, Ash Ketchum shit\n\'Cause I\'m fly like a newborn baby wombat wing, ha, ha\nMe and this mic is your Mortal Kombat team\nI want some head, I\'m thinkin\' how zombies think\nBeaming a pistol it look like hadouken\nLike mayday, mayday, mayday, mayday\nTell these pussy rappers that it\'s time to vacay\nRob yo\' lady, told her put her hands up high in the air\nLike she \'bout to hit the Nae Nae\nThey say I\'m cr-cr-cr-cr-cray, cray\nCan\'t control the nigga like we shootin\' from the AK\nBut they keep me \'round cause, I’m a walking, breathing payday\nHot, but I swag, still nigga got the Ray Bays\nGet away, get away, get away, get away\nBetter do you or do way way, fade away\nYou sippin\' Haterade, I\'m sippin\' Gatorade\nWith the lean in it and I call it a fade-orade\nAyy, I\'m so toxic, frog, hop up on my dick\nI think I\'m a pilot, \'cause she in my cockpit\nPlumber, uh, pipe it, get face like I Skyped it\nDid her A$AP like Rocky\nRockin\' in my motherfuckin\', rockin\' rockin\' in my motherfuckin\'\n[Chorus: Ski Mask The Slump God & XXXTENTACION]\nI feel like Nick Cannon (Nick), huh\n\'Cause I\'m wildin\' out (\'Cause I\'m wildin\'), huh\nI don\'t got on Vans (I don\'t got \'em)\nBut bitch, I\'m off the wall (I don\'t, I don\'t, I don\'t, I don\'t)\nHuh, feel like Nick Cannon (Feel like Nick), huh\n\'Cause I\'m wildin\' out (\'Cause I\'m, huh), huh\nI don\'t got on Vans, but bitch, I\'m off the wall (Wall, wall, water)\nI said like insect (Ew), I be buggin\' motherfucker (Ow)\nFuck on your mommy\nMy flow be sick like that bitch gotta vomit, to vomit, to vomit (Gotta, gotta, gotta, gotta, gotta, gotta, gotta, gotta, gotta, gotta)\nI\'m hot like a comet\nInsect, I be buggin\' motherfucker (Insect)\nFuck on your mommy (Uh-huh)\nMy flow be sick like that bitch gotta vomit, to vomit, to vomit (Ayy, yuh, huh)\nI\'m hot like a comet (Ayy, ayy)\n\n[Verse 2: XXXTENTACION]\nWhen I fi-fi-fi-fi-fi-fi-fist that bitch (Huh)\nI\'ma make that booty jiggle like some kick back, bitch (Huh)\nShe gon\' rub my Dragon Balls, let her make one wish (Huh)\nWhat is that? She just wanna take the young dagger dick\nAyy-ayy, ayy-ayy (Huh?), ayy-ayy, ayy-ayy (Huh?)\nShe off the Molly, she wanna take seven dick (Ayy)\nBody to body, it\'s MC dagger, bitch (Ayy)\nThink that I\'m Illuminati because I got money, bitch (Like)\nLike Ray J, Ray J, Ray J, Ray J (Huh)\nBitch, I hit it first, on my weenie, hit the nae-nae (Huh)\nComing in hot like a missile, pussy, hey bae (Huh)\nFalcon punch that nigga, make \'em up, up, and away, ayy (Ayy)\nWatch this, uppercut, Super Smash Melee (Ayy-ayy)\nI just made her spin on my dick like a Beyblade (Ooh)\nI\'m green like a spinach, I don\'t know you, then it\'s pay, ayy (Ooh)\nHummanah hummana, back fist, out my way, ayy (Ayy)\nNo Chris Brown (Oh), fuck her, make her look at me now (Wet)\nWhen I\'m in the pussy, say ""Ow!""\nYou got no etiquette, just beginnin\' like Genesis\nCan you give me a rapper that I\'m not better than, mmph? (Ayy)\nRevenge jeans, I think that I might OD\nOn sauce, I don\'t rock Supreme\nSuck my dick, Squidward\'s clarinet\nBrought to life like I’m Evanescence\nWanna wake, w-w-wake, w-w-wake, okay, like\nBig black (Black), dick in your mama mouth\nPull it back, push her whole wig back (Wig)\nTic, tac, your breath really P-U\nYo, you really need a Tic-Tac (Stank)\nBig pump, Cobain, Cobain\nLeave a pussy nigga with no brain, okay (Blaow)\nWeenie Hut Jr. looking boy, tell him ""Ole""\nI\'ma pull that pistol, make \'em Mr. Noodle, ayy\n[Chorus: Ski Mask The Slump God]\nI feel like Nick Cannon (Nick), huh\n\'Cause I\'m wildin\' out (\'Cause I\'m wildin\'), huh\nI don\'t got on Vans (I don\'t got \'em)\nBut bitch, I\'m off the wall (I don\'t, I don\'t, I don\'t, I don\'t)\nHuh, feel like Nick Cannon (Feel like Nick), huh\n\'Cause I\'m wildin\' out (\'Cause I\'m, huh), huh\nI don\'t got on Vans, but bitch, I\'m off the wall (Wall, wall, water)\nI said like insect (Ew), I be buggin\' motherfucker (Ow)\nFuck on your mommy\nMy flow be sick like that bitch gotta vomit, to vomit, to vomit (Gotta, gotta, gotta, gotta, gotta, gotta, gotta, gotta, gotta, gotta)\nI\'m hot like a comet\nInsect, I be buggin\' motherfucker (Insect)\nFuck on your mommy (Uh-huh)\nMy flow be sick like that bitch gotta vomit, to vomit, to vomit\nI\'m hot like a comet (Sick, sick, sick, ayy)'}"
Death Grips,Guillotine - Single,Guillotine,3IrcvqIf3ZiBhf3xdsctRX,0.561,0.64,11,-5.042,0.287,0.0678,0.000387,0.148,0.196,78.464,223364,4,Angry,"{'title': 'Death Grips – Guillotine Lyrics', 'lyrics': ""[Chorus]\nIt goes, it goes, it goes, it goes\nIt goes, it goes, it goes, it goes\nGuillotine, yuh\n\n[Verse 1]\nSit in the dark and ponder how\nI'm fit to make the bottom fall through the floor\nAnd they all fall down, yuh\n(It goes, it goes, it goes, it goes, it goes, it goes yuh)\nOut of the shadows barrage of witch tongue\nCobra spit over apocalyptic cult killer cauldron smoke\nStomp music seriously, yuh\n(It goes, it goes, it goes, it goes, it goes, it goes)\nCan't stop the groove licks jaws clear off them locks relentless raw movement\nFit to knock you from here to that g-spot body rock connected\nTo everything you want, ever did want, we got it why not come get it\nStick your head in that hole and watch me drop this cold guillotine death sentence, yuh\nYuh\n\n[Chorus]\nIt goes, it goes, it goes, it goes\nIt goes, it goes, it goes, it goes\nGuillotine, yuh\n\n[Verse 2]\nHidden art, between and beneath, every fragmented, figure of speech\nTongue in reverse, whenever the beat\nCauses my jaws to call out, out, out, out, yuh\nThe screens flashing red, can't see shit but heads\nSpinning exorcist like planets out of orbit off the edge\nOff mine axis whipping through doors to far more than all that’s ever been said, yuh\nTie the chord, kick the chair and you're dead, yuh\nYuh\n\n[Chorus]\nIt goes, it goes, it goes, it goes\nIt goes, it goes, it goes, it goes\nGuillotine, yuh\nGuillotine, yuh\n\n[Verse 3]\nHead of a trick in a bucket, body of a trick in a bag\nAnd thrown in the fire like fuck it, gotta burn it before it goes bad\nOne too many times been disgusted by the stench of rot is such a drag, yuh\nGet broke by the street like blood stained glass, yuh\nChoke on these nuts till the very last, yuh\n(It goes, it goes, it goes, it goes)\nSerial number, killing machine, the illest of means\nTo an end built on the filthy sound you're experiencing, yuh\nYuh\n\n[Chorus]\nIt goes, it goes, it goes, it goes\nIt goes, it goes, it goes, it goes\nGuillotine, yuh\nGuillotine, yuh\n\n[Verse 4]\nTinted windows, bulletproof\nThe slip knot fixing rope to noose\nTo the grave stone grinder of cold steel\nThe passion that blinds me so I feel, yuh!\nCan't let go, no it flows through our veins\nBlows through our tunnels and rattles our chains\nAnd they all fall down, yuh\n\n[Bridge]\nYuh\nYuh\nYuh\nYuh\nYuh\nYuh\nYuh\nYuh\n\n[Outro]\nYuh, yuh, yuh, yuh\nYuh, yuh, yuh, yuh\nYuh, yuh, yuh, yuh\nYuh, yuh, yuh, yuh\nYuh, yuh, yuh, yuh""}"
Polo G,Heartless (feat. Mustard),Heartless (feat. Mustard),028JxheELfIvvY4zBXuMjw,0.776,0.64,7,-8.058,0.183,0.15,0.0,0.0983,0.326,160.038,201627,4,Angry,"{'title': 'Polo G – Heartless Lyrics', 'lyrics': '[Intro: YG]\n(Mustard on the beat, ho)\n\n[Chorus: Polo G]\nMy youngins heartless, so they ain\'t playin\' no games\nWe really want\u2005\'em\u2005dead, he got\u2005hit up close range\nHe fucked up\u2005in the head, he wanna see some more brains\nOn that corner, I couldn\'t stay up out that dope game\nMy cousin got indicted dealin\' cocaine\nShe an Instagram addict, she want more fame\nI used to starve, now I\'m blowing up like propane\nTold my inner self, ""I promise you I won\'t change""\n\n[Verse 1: Polo G]\nWe make it hot up on your block, we let that heat blow\nCatch an opp, we dump the clip, it\'s time to reload\nPut a scope on the AR just like a peephole\nThink he a bully, we got choppers for the Deebo\nSeven-figure nigga, tryna maximize them three O\'s\nBefore the bag, I was fucking all the freak hoes\nBallin\' hard, young legend out the Chi, bitch, I\'m like D-Rose\n""Cap, how you make it out this shit?"" I got the cheat code\nWay more than life than just the hood, I\'m tryna reach goals\nMaxine my heart, since you\'ve been gone, I miss your sweet soul, ayy\nNever tell a statement, we won\'t leak those\nBetter not go talkin\' to them people, better keep closed\n\n[Chorus: Polo G]\nMy youngins heartless, so they ain\'t playin\' no games\nWe really want \'em dead, he got hit up close range\nHe fucked up in the head, he wanna see some more brains\nOn that corner, I couldn\'t stay up out that dope game\nMy cousin got indicted dealin\' cocaine\nShe an Instagram addict, she want more fame\nI used to starve, now I\'m blowing up like propane\nTold my inner self, ""I promise you I won\'t change""\n\n[Verse 2: Polo G]\nWe hold a grudge and we want blood, we can\'t look past the issue\nPlay with us and you gon\' die, nigga, it\'s kinda simple\nShow no mercy, we gon\' kill whoever ridin\' with you\nCatch you on the other side, then we gon\' have to get you\nCondolences to your family, they gon\' have to miss you\nLil Joe on go and he gon\' spark, that\'s if I pass the signal\nMy right-hand mans, he got his name \'cause he gon\' blast the pistol\nEarned our stripes, we gon\' blow if a nigga play foul, you would think we had a whistle\nLil Capalot, G-O-A-T, yeah, that\'s that guy\'s initials\nHappiness and depression, I\'m stuck inside the middle\nI fell in love with dollar signs, won\'t let my mind forget you\nFuck it off, we spend it all on fast cars and shinin\' crystals\n\n[Chorus: Polo G]\nMy youngins heartless, so they ain\'t playin\' no games\nWe really want \'em dead, he got hit up close range\nHe fucked up in the head, he wanna see some more brains\nOn that corner, I couldn\'t stay up out that dope game\nMy cousin got indicted dealin\' cocaine\nShe an Instagram addict, she want more fame\nI used to starve, now I\'m blowing up like propane\nTold my inner self, ""I promise you I won\'t change""'}"
TOKYO’S REVENGE,GOODMORNINGTOKYO!,GOODMORNINGTOKYO!,0Q2n5yzl2XRqYbV77tZNYp,0.907,0.539,4,-7.782,0.36,0.0408,0.0,0.253,0.664,124.918,150115,4,Angry,"{'title': ""TOKYO'S REVENGE – GOODMORNINGTOKYO! Lyrics"", 'lyrics': ""[Intro: TOKYO'S REVENGE & Joey Trap]\nHaha, ayy (My dick is still hard), yeah\nOoh, uh, bitch, huh, um, uh, yeah (Yeah, uh, uh, pay for me)\nHuh, okay, uh, yeah, uh, okay, uh, yeah (444, 444 hours, bitch)\nHuh (I need to see a doctor), bitch, look, look (Red lean look like Clifford)\n\n[Chorus]\nNigga don't like me, kill me right now, uh\nOtherwise, nigga, pipe down, uh (Bitch, bitch)\nY'all niggas rap too loud, nigga (Y'all niggas rap too loud, yeah)\nShh, what's that sound? Uh (What's that sound? Yeah)\nThat's me sneaking in your house with the choppa (Brrt)\nI'ma put that bitch in your mouth (Doo-doo-doo, doo-doo-doo)\nGood morning (Wha?), my name is Tokyo (What's up?)\nJust like a window (Yeah), I'm here to air it out\nIf a nigga don't like me, kill me right now, uh (Yeah, uh, ooh-woo)\nOtherwise, nigga, pipe down, uh (Yeah, what?)\nY'all niggas rap too loud, nigga (Um, be quiet, be quiet)\nShh, what's that sound? Uh (Yeah, bitch)\nThat's me sneaking in your house with the choppa (Brrt, brrt)\nI'ma put that bitch in your mouth (Doo-doo-doo, doo-doo-doo)\nGood morning, my name is Tokyo (Good morning, good morning)\nJust like a window, I'm here to air it out (Hi, hello), bitch\n\n[Verse]\nHe wanted beef in the parking lot, uh\nMy niggas dogs and we bark a lot, uh\nAutobot choppas they spark a lot\nI'll beat your ass, I don't care if it's dark or not, uh (Yeah)\nLook, I can't see the bullshit like Ray Charles, uh (Yeah, yeah)\nY'all niggas **** like James Charles, uh\nRan a train on your sister like a freight car, uh (Haha, yeah)\nYeah, and the dick same size as my AR, uh\nPetco playing with the kitty, my nigga, I mean for really, my nigga\nI mean the choppa hold a hundred-fifty bullets, my nigga\nIf you wan' pull up, my nigga\nThen we can do it, my nigga, I mean ah-ooh, huh\nThat nigga pull up, he thought we gon' fistfight\nLil' did he know I keep the strap like a dizzike (Haha, yeah)\nSuicide door on my whip, slit my wrist like\nThat's lil' Tokyo, dirty with the dick right (Uh)\nI need that ice, I need that ice, bitch, I need the crystals\nI need to put some diamonds on my pistol\nThat bitch wan' suck my dick, but I won't kiss her, uh\nBlew up like missile, huh, yeah, I blew up like a missile, huh\nShe blew my dick just like a whistle, huh (Yeah, yeah)\nMy diamonds prettier than glitter, uh (Yeah, yeah)\n\n[Chorus]\nNigga don't like me, kill me right now, uh\nOtherwise, nigga, pipe down, uh\nY'all niggas rap too loud, nigga (Y'all niggas rap too loud, yeah)\nShh, what's that sound? Uh (What's that sound? Yeah)\nThat's me sneaking in your house with the choppa (Brrt)\nI'ma put that bitch in your mouth (Doo-doo-doo, doo-doo-doo)\nGood morning (Wha?), my name is Tokyo (What's up?)\nJust like a window (Yeah), I'm here to air it out\nIf a nigga don't like me, kill me right now, uh (Yeah, uh, ooh-woo)\nOtherwise, nigga, pipe down, uh (Yeah, what?)\nY'all niggas rap too loud, nigga (Um, be quiet, be quiet)\nShh, what's that sound? Uh (Yeah, bitch)\nThat's me sneaking in your house with the choppa (Brrt, brrt)\nI'ma put that bitch in your mouth (Doo-doo-doo, doo-doo-doo)\nGood morning, my name is Tokyo (Good morning, good morning)\nJust like a window, I'm here to air it out (Hi, hello), bitch\n\n[Outro]\nHahaha, also I offer excellent toe sucking services\nLadies, hit my line, Kyoto's revenge on Instagram and Twitter\nHa, um, I'm also selling dick, forty dollars a inch\nSnapchat premium, Amazon\nYou can download my dick off Google Drive, uh\nIt's up for auction on eBay\nI got a dick-by-the-inch bargain sale, going on, on Craigslist if you're interested, haha""}"
A Boogie Wit da Hoodie,Hoodie SZN,Demons and Angels (feat. Juice WRLD),3L19besdNQzd342qL78xqm,0.81,0.55,2,-7.46,0.17,0.0114,5.69e-06,0.107,0.183,76.503,214593,4,Angry,"{'title': 'A Boogie wit da Hoodie – Demons and Angels Lyrics', 'lyrics': ""[Intro: Juice WRLD]\nHuh, woke up in a new car\nChopper on my hip, it shoot a movie like a porn star, uh\nI might fuck a porn star, uh\nWoke up in Mercedes, yeah, let's ride up in a foreign car\nI just told Richie we rich\n\n[Chorus: Juice WRLD]\nDon't get on my bad side, I'm dangerous\nDemons and angels hang with us\nTreat it like a phone, baby, hang it up, uh\nThrow your side up, go 'head, bang it up\nDon't fuck with me, no, I'm dangerous, uh\nI'm from where they hang 'em, oh\nThrow your side up, go 'head, bang it up\nThrow your side up, go 'head, bang it up\n\n[Verse 1: A Boogie wit da Hoodie]\nDon't gangbang when this shit get dangerous\nI'm from the West Side, know not to play with us, yeah\nIf you thinkin' that it's sweet, it's not okay with us\nRight now I'm in the A, we got the K with us (Bang)\nAll my chains heavy, and they bright as fuck\nShe only give me head 'cause she don't like to fuck\nSo much Balmain on, I feel like I'm a biker boy\nI been missin' you but you don't call my line no more\nAnd I swear I get all up in my feelings when you're not around, yeah\nI get in my feelings when you're not around, yeah\nI get in my feelings when you're not around me\nI think I'm addicted to this lifestyle, I swear\nI hope you don't just want me for my lifestyle, I swear\nDon't you only fuck me for my lifestyle, I swear\nI've been tryna show you for a long time, I care\nBut you came around just at the right time, I get\nJealous when you try to come around all my friends\nType of shit that make me wanna fuck with your friends\nMake you wanna break the fucking door off my Benz, yeah\n\n[Chorus: Juice WRLD]\nDon't get on my bad side, I'm dangerous\nDemons and angels hang with us\nTreat it like a phone, baby, hang it up, uh\nThrow your side up, go 'head, bang it up\nDon't fuck with me, no, I'm dangerous, uh\nI'm from where they hang 'em, oh\nThrow your side up, go 'head, bang it up\nThrow your side up, go 'head, bang it up\n\n[Verse 2: Juice WRLD &  A Boogie wit da Hoodie]\nAyy, you heard of me? (Ayy, heard of me, yeah)\nFuck a Perc-10, need a 30 (I need a 30)\nAnd my FN 'cause they lurking\nAnd a Smith & Wesson's with the broski, no worries\nAll these other niggas bitch niggas, they get disfigured\nBallin', yeah, I swish, nigga, I'ma swish, nigga\nOwn lane, never switch, nigga, never switch, nigga\nTryna fuck the world, they can suck a dick, nigga (Real shit)\nFuck telling stories, I'ma make one\nThis is real life shit, niggas make one\nI don't care about none of y'all\nNeed to go and get your money up (Ya dig?)\n\n[Chorus: Juice WRLD]\nDon't get on my bad side, I'm dangerous\nDemons and angels hang with us\nTreat it like a phone, baby, hang it up, uh\nThrow your side up, go 'head, bang it up\nDon't fuck with me, no, I'm dangerous, uh\nI'm from where they hang 'em, oh\nThrow your side up, go 'head, bang it up\nThrow your side up, go 'head, bang it up""}"
Lil Tjay,F.N,F.N,0UPBidRYcgJ2mjZlk08V8x,0.562,0.502,6,-10.269,0.255,0.323,0.0,0.0757,0.322,120.104,224000,1,Angry,"{'title': 'Lil Tjay – F.N Lyrics', 'lyrics': '[Intro]\n(Fuck niggas, I don\'t trust niggas\nIf\u200a you bust triggers and you tell, you a fuck nigga)\nIf\u200a you tell, you a fuck nigga\n(How you tell on the gang? If you mention my name\nBoy, I promise I\'ma kill you, better duck, nigga\nWhat’s\u200a up with you? I grew up with you\nUsed\u200a to fuck with you, now I\'m wishing that a bus hit you\nI used to fuck with you, now I\'m wishing that a bus hit you)\n(Fuck\u200a niggas, I don\'t trust niggas\nIf you bust triggers and you tell, you a fuck nigga)\nFuck nigga\nNah, Lil Tjay (Fuck nigga), yeah, yeah\n(Now\u200a I\'m wishing that a bus hit you)\nYeah, yeah, yeah (Skrrt, skrrt, yeah)\n\n[Refrain]\nGrrr, pow, I\'ma skip town, see my wrist drown\nEverybody wanna fuck with me for benefits now\nMan, I wish my nigga Smelly could\'ve seen me lit now\nSit down, maybe roll up, blow a spliff down\nTime go by, niggas change so much\nWhy the fuck these niggas looking at my chain so much?\nThey just mad \'cause I departed from the game so much\nOne false move and the gang gon\' bust\n[Verse 1]\nCartier glasses, 20/20, got a clear view\nYou a man, I don\'t fear you\nAct up, we gon\' mask up, boy, I dare you\nBrody catch a body, I\'ma leave you in the rearview\nCould have did it to me, lil\' nigga, you were scared to\nYou a bluff and you not who you appear to\nYou\'d be starstruck if you see a nigga near you\nAnd your bitch wanna fuck, I don\'t care to\nCareful, if I say links, plan\'s canceled\nI can have your shorty in my bed doing dance moves\nFuck that, let\'s get right back to the real shit\nIn the field shit, niggas really used to drill shit\nMama stressed out, whole lot she gotta deal with\nSwear every real nigga gon\' feel this\nSmokin\' on drugs \'cause there\'s too much to deal with\nSB strapped up in the field with it\n\n[Chorus]\nFuck niggas, I don\'t trust niggas\nIf you bust triggers and you tell, you a fuck nigga\nHow you tell on the gang? If you mention my name\nBoy, I promise I\'ma kill you, better duck, nigga\nWhat\'s up with you? I grew up with you\nUsed to fuck with you, now I\'m wishing that a bus hit you\nI used to fuck with you, now I\'m wishing that a bus hit you\nFuck niggas, I don\'t trust niggas\nIf you bust triggers and you tell, you a fuck nigga\nHow you tell on the gang? If you mention my name\nBoy, I promise I\'ma kill you, better duck, nigga\nWhat\'s up with you? I grew up with you\nUsed to fuck with you, now I\'m wishing that a bus hit you\nI used to fuck with you, now I\'m wishing that a bus hit you\n[Verse 2]\nMy mama know about the pain, thought I\'d never change\nBut looking back, for the fame, I felt the same\nI was stuck up in the streets, but I had a brain\nI ain\'t have no money, we was looking for a nigga chain\nAnd shit, all I ever wanted was to have a name\nHad a lot of shit to lose, not enough to gain\nAnd that fuck nigga changed, went against the grain\nFound out my homie went fed, almost went insane\nStrictly business, you ain\'t with it, you get parked, nigga\nI don\'t know you, you wasn\'t with me from the start, nigga\nI remember catching stains in the park, nigga\nMe and Bubba tryna catch an opp after dark, nigga\nMy mama told me, ""Wisen up, be a smart nigga""\nSo all my niggas on go like a kart, nigga\nSmelly drive mean a bullet to your heart, nigga\nI don\'t really wanna speak facts, see the chart, nigga\n\n[Refrain]\nGrrr, pow, I\'ma skip town, see my wrist drown\nEverybody wanna fuck with me for benefits now\nMan, I wish my nigga Smelly could\'ve seen me lit now\nSit down, maybe roll up, blow a spliff down\nTime go by, niggas change so much\nWhy the fuck these niggas looking at my chain so much?\nThey just mad \'cause I departed from the game so much\nOne false move and the gang gon\' bust\n[Chorus]\nFuck niggas, I don\'t trust niggas\nIf you bust triggers and you tell, you a fuck nigga\nHow you tell on the gang? If you mention my name\nBoy, I promise I\'ma kill you, better duck, nigga\nWhat\'s up with you? I grew up with you\nUsed to fuck with you, now I\'m wishing that a bus hit you\nI used to fuck with you, now I\'m wishing that a bus hit you\nFuck niggas, I don\'t trust niggas\nIf you bust triggers and you tell, you a fuck nigga\nHow you tell on the gang? If you mention my name\nBoy, I promise I\'ma kill you, better duck, nigga\nWhat\'s up with you? I grew up with you\nUsed to fuck with you, now I\'m wishing that a bus hit you\nI used to fuck with you, and now I\'m wishing that a bus hit you\n\n[Outro]\nLil Tjay\nYeah, yeah, yeah\nOh'}"
Kodak Black,No Flockin',No Flockin',34oWbFBfGEElvgO0a5c9V4,0.943,0.595,5,-8.372,0.191,0.0673,0.0,0.0839,0.815,117.532,165291,4,Angry,"{'title': ""Kodak Black – No Flockin' Lyrics"", 'lyrics': ""[Intro]\nDamn, that's so sad\nKKK, KKK\n\n[Verse]\nYoung nigga, I got old cash, spazzin' on they ass\nI got Prada on my ho ass, got my last one mad\nPop a nigga like a damn tag, shoppin' on they ass\nI just bought a new old Jag, yeah, it's so fast\nSmokin' flocka, you a jackass, all I smoke is gas\nDon't you ask me where the pole at, where yo' clothes at?\nI ain't talkin' 'bout my niggas, dammit, but y'all trippin', too\nIs it you? Damn, my nigga, what the hell got into you?\nProject Baby, y'all was skippin' in the hallway, I was skippin' school\nOn my Ps and Qs, on them jiggas, call me jiggaboo\nBleedin' concrete, bet you niggas won't come 'cross the street\nPardon me, I don't talk to you so don't you talk to me\nI ain't dissin' on nobody, B, I'm vibin' on the beat\nHonestly, I'm just tryna be, I just gotta be\nTryin' to get over on anything, they tellin' lies to me\nI spent five on my pinky ring, she love my diamond ring\nAnyway, I'm married to the game, she said her vows to me\nI ain't gettin' on my knees, bae, you bow down to me\nYou go down for me, you lay down and do the time for me\nSorry, boo, yeah, I lied to you, but don't you lie to me\nIt's Lil Kodak, the finesse kid, boy, who hot as me?\nTold the doctor I'm a healthy kid, I smoke broccoli\nI will run around your whole board like Monopoly\nOl' boy, you's a broke boy, flocka's got you beat\nChocolate, call me Reese's, can't catch me without the piece\nC'est la vie, I'm ten toes down, you fallin' off your feet\nI will trick yo ass for a treat, call it Halloween\nYeah, that money's what I play fo', call it lottery\nGoddamn, you's a clown to me, you's a clown to me\nYou can't smoke no Black & Milds with me, get in the car with me\nYou a funny guy, don't you even joke around with me\nHow could it be? Get from 'round a G, you grounded from me\nI'm a freeband junkie, you a junkie\nYou gettin' skinny, I'm gettin' chunky, gettin' money\nWant some food? Boy, you hungry, I want them hundreds\nHundreds""}"
