artist,album,track,track_id,danceability,energy,key,loudness,speechiness,acousticness,instrumentalness,liveness,valence,tempo,duration_ms,time_signature,mood,lyrics
Kelly Clarkson,Breakaway,Since U Been Gone,3xrn9i8zhNZsTtcoWgQEAd,0.662,0.741,0,-5.406,0.0334,0.00165,0.0303,0.114,0.404,131.0,188960,4,Angry,"{'title': 'Kelly Clarkson – Since U Been Gone Lyrics', 'lyrics': '[Verse 1]\nHere\'s the thing, we started out friends\nIt was cool, but it was all pretend\nYeah, yeah, since you been gone\nYou dedicated, you took the time\nWasn\'t long till I called you mine\nYeah, yeah, since you been gone\n\n[Pre-Chorus 1]\nAnd all you\'d ever hear me say\nIs how I pictured me with you\nThat\'s all you\'d ever hear me say\n\n[Chorus]\nBut since you been gone\nI can breathe for the first time\nI\'m so moving on, yeah, yeah\nThanks to you, now I get what I want\nSince you been gone\n\n[Verse 2]\nHow can I put it? You put me on\nI even fell for that stupid love song\nYeah, yeah, since you been gone\n\n[Pre-Chorus 2]\nHow come I\'d never hear you say\n""I just wanna be with you"" (Be with you)\nI guess you never felt that way\n[Chorus]\nBut since you been gone\nI can breathe for the first time\nI\'m so moving on, yeah, yeah\nThanks to you, now I get, I get what I want\nSince you been gone\n\n[Bridge]\nYou had your chance, you blew it\nOut of sight, out of mind\nShut your mouth, I just can\'t take it\nAgain and again and again and again\n\n[Chorus 2]\nSince you been gone (Since you been gone)\nI can breathe for the first time\nI\'m so moving on, yeah, yeah\nThanks to you (Thanks to you)\nNow I get, I get what I want\nI can breathe for the first time\nI\'m so moving on, yeah, yeah\nThanks to you (Thanks to you)\nNow I get (I get)\nYou should know (You should know)\nThat I get, I get what I want\n[Outro]\nSince you been gone\nSince you been gone\nSince you been gone'}"
P!nk,Greatest Hits...So Far!!!,So What,7bprRkhvOXWmWpqOrEWbXu,0.531,0.864,11,-2.978,0.0433,0.000105,2.05e-06,0.346,0.402,126.02,214520,4,Angry,"{'title': 'P!nk – So What Lyrics', 'lyrics': ""[Intro]\nNa na na na na na na, na na na na na na\nNa na na na na na na, na na na na na na\n\n[Verse 1]\nI guess I just lost my husband, I don't know where he went\nSo I'm gonna drink my money, I'm not gonna pay his rent (Nope!)\nI got a brand new attitude and I'm gonna wear it tonight\nI wanna get in trouble, I wanna start a fight\nNa na na na na na na, I wanna start a fight\nNa na na na na na na, I wanna start a fight\n\n[Chorus]\nSo, so what? I'm still a rockstar\nI got my rock moves and I don't need you\nAnd guess what? I'm havin' more fun\nAnd now that we're done\nI'm gonna show you tonight\nI'm alright\nI'm just fine and you're a tool\nSo, so what? I am a rockstar\nI got my rock moves and I don't want you tonight\n\n[Verse 2]\n(Uh, check my flow, uh)\nThe waiter just took my table\nAnd gave it to Jessica Simps (Shit!)\nI guess I'll go sit with drum boy\nAt least he'll know how to hit (Oops!)\nWhat if this song's on the radio?\nThen somebody's gonna die\nI'm gonna get in trouble\nMy ex will start a fight\nNa na na na na na na, he's gonna start a fight (Huh!)\nNa na na na na na na, we're all gonna get in a fight!\n[Chorus]\nSo, so what? I'm still a rockstar\nI got my rock moves and I don't need you\nAnd guess what? I'm havin' more fun\nAnd now that we're done\nI'm gonna show you tonight\nI'm alright (I'm alright)\nI'm just fine and you're a tool\nSo, so what? I am a rockstar\nI got my rock moves and I don't want you tonight\n\n[Bridge]\nYou weren't there, you never were\nYou want it all, but that's not fair\nI gave you life, I gave my all\nYou weren't there, you let me fall\n\n[Chorus]\nSo, so what? I'm still a rockstar\nI got my rock moves and I don't need you\nAnd guess what? I'm havin' more fun\nAnd now that we're done (We're done)\nI'm gonna show you tonight\nI'm alright (I'm alright)\nI'm just fine (I'm just fine) and you're a tool\nSo, so what? I am a rockstar (Oh)\nI got my rock moves and I don't want you tonight\n(I don't want you tonight)\n[Chorus 2]\nNo, no, no, no\nI don't want you tonight\nYou weren't there\nI'm gonna show you tonight (I'm gonna show you tonight)\nI'm alright (I'm alright)\nI'm just fine and you're a tool\nSo, so what? I am a rockstar\nI got my rock moves and I don't want you tonight\n(I don't want you tonight!)\n\n[Outro]\nWoohoo!\nBa da da da da da""}"
Christina Aguilera,Stripped,Fighter,7nXq1vaZiz7PdbfojpPjW5,0.435,0.92,4,-1.357,0.201,0.235,0.000353,0.552,0.45,188.899,245960,4,Angry,"{'title': 'Christina Aguilera – Fighter Lyrics', 'lyrics': ""[Intro]\nAfter all you put me through\nYou'd think I'd despise you\nBut in the end, I wanna thank you\n'Cause you made me that much stronger\n\n[Verse 1]\nWell, I thought I knew you\nThinkin' that you were true\nGuess I, I couldn't trust, called your bluff\nTime is up 'cause I've had enough\nYou were there by my side\nAlways down for the ride\nBut your joy ride just came down in flames\n'Cause your greed sold me out in shame, mhm\n\n[Pre-Chorus]\nAfter all of the stealing and cheating\nYou probably think that I hold resentment for you\nBut uh-uh, oh no, you're wrong\n'Cause if it wasn't for all that you tried to do\nI wouldn't know just how capable\nI am to pull through\nSo I wanna say thank you, 'cause it\n\n[Chorus]\nMakes me that much stronger\nMakes me work a little bit harder\nMakes me that much wiser\nSo thanks for making me a fighter\nMade me learn a little bit faster\nMade my skin a little bit thicker\nMakes me that much smarter\nSo thanks for making me a fighter\nOh, oh, oh, oh, oh-oh-oh, yeah, yeah, ohh\n\n[Verse 2]\nNever saw it coming\nAll of your backstabbing\nJust so you could cash in on a good thing\nBefore I realized your game, aha\nI heard you're goin' 'round\nPlayin' the victim now\nBut don't even begin feeling I'm the one to blame\n'Cause you dug your own grave\n\n[Pre-Chorus]\nAfter all of the fights and the lies\nGuess you're wanting to hold me\nBut that won't work anymore (No more, a-ha, it's over)\n'Cause if it wasn't for all of your torture\nI wouldn't know how to be this way now and never back down\nSo I wanna say thank you, 'cause it\n\n[Chorus]\nMakes me that much stronger\nMakes me work a little bit harder\nIt makes me that much wiser\nSo thanks for making me a fighter\nMade me learn a little bit faster\nMade my skin a little bit thicker\nMakes me that much smarter\nSo thanks for making me a fighter\n\n[Bridge]\nHow could this man I thought I knew\nTurn out to be unjust, so cruel?\nCould only see the good in you\nPretended not to see the truth\nYou tried to hide your lies, disguise yourself\nThrough living in denial\nBut in the end you'll see, you won't stop me\nI am a fighter and I (I'm a fighter)\nI ain't gon' stop (I ain't gonna stop)\nThere is no turning back\nI've had enough\n\n[Chorus]\nMakes me that much stronger\nMakes me work a little bit harder (Yeah)\nIt makes me that much wiser (Oh yeah)\nSo thanks for making me a fighter\nMade me learn a little bit faster (Yeah)\nMade my skin a little bit thicker (Yeah, yeah, yeah)\nMakes me that much smarter (Yeah)\nSo thanks for making me a fighter (Fighter)\n\n[Interlude]\nYou thought I would forget but I, I remembered (Ooh-ooh-ooh)\n'Cause I remembered (Ooh-ooh-ooh)\nI remembered\nYou thought I would forget (Ooh-ooh)\nI remembered (Ooh-ooh)\n'Cause I remembered (Ooh)\nI remembered\n\n[Chorus]\nMakes me that much stronger (Ooh-ooh)\nMakes me work a little bit harder (Ooh-ooh)\nIt makes me that much wiser\nSo thanks for making me a fighter\nMade me learn a little bit faster\nMade my skin a little bit thicker\nMakes me that much smarter\nSo thanks for making me a fighter""}"
Fifth Harmony,Reflection (Deluxe),BO$$,1COvXs6jaykXC73h9OSBVM,0.813,0.872,9,-5.224,0.107,0.00621,0.0,0.0498,0.736,103.016,171413,4,Angry,"{'title': 'Fifth Harmony – BO$$ Lyrics', 'lyrics': ""[Intro]\nWoah! Woah!\n\n[Verse 1: Normani]\nEvery day is payday\nSwipe my card, then I do the Nae Nae\nYou're talking to a lady\nI want a Kanye-ye, not a Ray J\nSo that's a no-no\nI'm a Maybach and you's a Volvo\nThis convo beat like Dre-e\nI already know whatcha tryna say\n\n[Pre-Chorus: Lauren & Camila]\nYou say that you a baller and I see you tryna holla\nBut that ain't how I was brought up, next\nWorking for the money 'cause that's what my mama taught me\nSo your ass better show me some respect\n\n[Chorus: All & Normani]\nBo$$, Michelle Obama\nPurse all heavy, getting Oprah dollars\nBo$$, Michelle Obama\nPurse all heavy, getting Oprah dollars\nBo$$, Michelle Obama\nPurse all heavy, getting Oprah dollars\nBo$$, Michelle Obama\nPurse all heavy, getting Oprah dollars\n\n[Verse 2: Normani]\nC-O-N-F-I-D-E-N-T, that's me, I'm confident\nDon't want yo compliments, use common sense\nI'm on my Michelle Obama (Shhh)\nShut your mouth\nBoy, I think you know who run this house\nI ain't thirsting for no bae\n'Cause I already know whatcha tryna say\n\n[Pre-Chorus: Lauren & Camila]\nYou say that you a baller and I see you tryna holla\nBut that ain't how I was brought up, next\nWorking for the money 'cause that's what my mama taught me\nSo your ass better show me some respect\n\n[Chorus: All & Normani]\nBo$$, Michelle Obama\nPurse all heavy, getting Oprah dollars (Woah, oh)\nBo$$, Michelle Obama\nPurse all heavy, getting Oprah dollars (Woah, oh)\nBo$$, Michelle Obama\nPurse all heavy, getting Oprah dollars (Woo-hoo)\nBo$$, Michelle Obama\nPurse all heavy, getting Oprah dollars\n\n[Bridge: Ally + Lauren & Camila]\nI pledge allegiance to my independent girls in here, ooh baby\nSo if you're with us, come on let me hear you say, yeah, yeah, yeah\nUh-huh, hey, hey, uh-huh, hey, hey\nDa-da-da-da-da-da-da, I see you\n\n[Pre-Chorus: Lauren & Camila & (Camila)]\nYou say that you a baller and I see you tryna holla\nBut that ain't how I was brought up, next (No-o-o-o)\nWorking for the money 'cause that's what my mama taught me\nSo your ass better show me some respect\n\n[Chorus: All & Normani]\nBo$$, Michelle Obama\nPurse all heavy, getting Oprah dollars\nBo$$, Michelle Obama\nPurse all heavy, getting Oprah dollars\nBo$$, Michelle Obama\nPurse all heavy, getting Oprah dollars\nBo$$, Michelle Obama\nPurse all heavy, getting Oprah dollars\n\n[Outro: Ally]\n(Hey, hey, hey, hey)\nWoohoo!\nOh""}"
Destiny's Child,Survivor,Survivor,2Mpj1Ul5OFPyyP4wB62Rvi,0.514,0.911,1,-2.027,0.41,0.0559,0.0,0.775,0.619,161.109,254027,4,Angry,"{'title': ""Destiny's Child – Survivor Lyrics"", 'lyrics': ""[Verse 1: Beyoncé]\nNow that you're out of my life I'm so much better\nYou thought that I'd be weak without you, but I'm stronger\nYou thought that I'd be broke without you, but I'm richer\nYou thought that I'd be sad without you, I laugh harder\nThought I wouldn't grow without you, now I'm wiser\nThought that I'd be helpless without you, but I'm smarter\nYou thought that I'd be stressed without you, but I'm chillin'\nYou thought I wouldn't sell without you, sold nine million\n\n[Chorus]\nI'm a survivor (What?)\nI'm not gon' give up (What?)\nI'm not gon' stop (What?)\nI'm gon' work harder (What?)\nI'm a survivor (What?)\nI'm gonna make it (What?)\nI will survive (What?)\nKeep on survivin' (What?)\nI'm a survivor (What?)\nI'm not gon' give up (What?)\nI'm not gon' stop (What?)\nI'm gon' work harder (What?)\nI'm a survivor (What?)\nI'm gonna make it (What?)\nI will survive (What?)\nKeep on survivin' (What?)\n\n[Verse 2: Beyoncé]\nThought I couldn't breathe without you, I'm inhalin'\nYou thought I couldn't see without you, perfect vision\nYou thought I couldn't last without you, but I'm lastin'\nYou thought that I would die without you, but I'm livin'\nThought that I would fail without you, but I'm on top\nThought it would be over by now, but it won't stop\nThought that I would self-destruct, but I'm still here\nEven in my years to come, I'm still gon' be here\n\n[Chorus]\nI'm a survivor (What?)\nI'm not gon' give up (What? Yeah)\nI'm not gon' stop (What?)\nI'm gon' work harder (What? Yeah)\nI'm a survivor (What?)\nI'm gonna make it (What? Yeah)\nI will survive (What?)\nKeep on survivin' (What? Keep on survivin', yeah)\nI'm a survivor (What?)\nI'm not gon' give up (What? Yeah)\nI'm not gon' stop (What? I'm not)\nI'm gon' work harder (What? I'm gon' work harder, yeah)\nI'm a survivor (What?)\nI'm gonna make it (What?)\nI will survive (What? I will survive, yeah)\nKeep on survivin' (What?)\n\n[Bridge 1: Kelly Rowland, Michelle Williams, Both]\nWishin' you the best\nPray that you are blessed\nBring much success, no stress, and lots of happiness\nI'm better than that\nI'm not gon' blast you on the radio\nI'm better than that\nI'm not gon' lie on you and your family, yo\nI'm better than that\nI'm not gon' hate on you in the magazines\nI'm better than that\nI'm not gon' compromise my Christianity\nI'm better than that\nYou know I'm not gon' diss you on the internet\n'Cause my mama taught me better than that\n\n[Chorus]\nI'm a survivor (What?)\nI'm not gon' give up (What?)\nI'm not gon' stop (What? Hey)\nI'm gon' work harder (What?)\nI'm a survivor (What? I'm a survivor)\nI'm gonna make it (What?)\nI will survive (What?)\nKeep on survivin' (What?)\nI'm a survivor (What?)\nI'm not gon' give up (What?)\nI'm not gon' stop (What?)\nI'm gon' work harder (What?)\nI'm a survivor (What? I'm a survivor, yeah)\nI'm gonna make it (What?)\nI will survive (What?)\nKeep on survivin' (What?)\n\n[Bridge 2: Michelle Williams]\nOh (Oh), oh (Oh), oh (Oh), oh (Oh)\nOh-oh (Oh-oh), oh-oh (Oh-oh), oh-oh (Oh-oh), oh-oh (Oh-oh)\nAfter all of the darkness and sadness\nSoon comes happiness\nIf I surround myself with positive things\nI'll gain prosperity\n\n[Chorus]\nI'm a survivor (What?)\nI'm not gon' give up (What?)\nI'm not gon' stop (What?)\nI'm gon' work harder (What?)\nI'm a survivor (What?)\nI'm gonna make it (What?)\nI will survive (What?)\nKeep on survivin' (What?)\nI'm a survivor (What?)\nI'm not gon' give up (What? Yeah)\nI'm not gon' stop (What?)\nI'm gon' work harder (What? Nothin' could stop me now)\nI'm a survivor (What?)\nI'm gonna make it (What?)\nI will survive (What?)\nKeep on survivin' (What? Yeah)\nI'm a survivor (What?)\nI'm not gon' give up (What?)\nI'm not gon' stop (What?)\nI'm gon' work harder (What?)\nI'm a survivor (What?)\nI'm gonna make it (What?)\nI will survive (What?)\nKeep on survivin' (What?)\nI'm a survivor (What?)\nI'm not gon' give up (What?)\nI'm not gon' stop (What?)\nI'm gon' work harder (What?)\nI'm a survivor (What?)\nI'm gonna make it (What?)\nI will survive (What?)\nKeep on survivin' (What?)\n\n[Outro: Michelle Williams]\nI will survive being fine (La-la-la)\nI will survive being sexy (La-la-la)\nI will survive being bootylicious""}"
Various Artists,EDM - Electronic Dance Music,I Love It (feat. Charli XCX) - Tiesto Remix,70ceGVMRB9zIHt4NX07Dgi,0.532,0.94,8,-4.372,0.155,0.000933,0.789,0.481,0.397,128.005,310718,4,Angry,"{'title': ""Icona Pop – I Love It (Tiësto's Club Life Remix) Lyrics"", 'lyrics': ""I don't care\nI don't care\n\nI got this feelin' on this summer day when you were gone\nI crashed my car into the bridge, I watched, I let it burn\nI threw your shit into a bag and pushed it down the stairs\nI crashed my car into the bridge\n\nI don't care, I love it\nI don't care, I love it\nI don't care, I love it\nI don't care, I love it\nI don't care\nI don't care\nI love it\nLove it\nLove it\n\nI got this feelin' on this summer day when you were gone\nI crashed my car into the bridge, I watched, I let it burn\nI threw your shit into a bag and pushed it down the stairs\nI crashed my car into the bridge\n\nI don't care, I love it\nI don't care, I love it\nI don't care, I love it\nI don't care, I love it\nI don't care\nI don't care\nI love it\nLove it\nLove it""}"
Selena Gomez,Revival (Deluxe),Same Old Love,6ZANrVuAMp2rpjhfbOuJly,0.672,0.593,11,-4.01,0.0304,0.0223,0.0,0.214,0.438,98.02,229080,4,Angry,"{'title': 'Song Ranking Page 2015 |', 'lyrics': 'SUPER ROUGH TOP 50 LIST IN CATEGORIES BASED ON VOTES + CURATION:\n\nSee second draft here.\n1-51. 10 (Rap) - Kendrick Lamar - ""King Kunta""\n2. 12 (Pop) - Jamie xx - ""I Know There\'s Gonna Be (Good Times)""\n3. 13 (Rap/Pop) - Kanye West  - ""Only One""\n4. 8 - (Rock) Sufjan Stevens - ""Fourth Of July""\n5. 9 - (Rap) Kendrick Lamar - ""The Blacker the Berry""\n6-106. 7 - (Rap) Kendrick Lamar - ""u""\n7. 3 - (Pop) Jamie xx - ""Loud Places""\n8. 3 - (R&B) D\'Angelo - ""Really Love""\n9. 10 - (Pop) The Weeknd - ""The Hills""\n10. 10 - (Rap/Pop) Drake - ""Hotline Bling""\n11-1511. 6 - (Rap) Donnie Trumpet & The Social Experiment - ""Sunday Candy""\n12. 5 - (Pop/R&B) Alessia Cara - ""Here""\n13. 4 - (Rock) Sufjan Stevens - ""Blue Bucket of Gold""\n14. 4 - (R&B) Miguel - ""Coffee""\n15. 5 - (Rap) Lupe Fiasco - ""Prisoner 1 & 2""\n16-2016. 3 - (Rap) Travi$ Scott - ""Maria I\'m Drunk""\n17. 3 - (Pop) Florence + The Machine - ""Delilah""\n18. 2 - (Pop) Susanne Sundfor - ""Delirious""\n19. 2 - (Pop) Natalie Prass - ""My Baby Don\'t Understand Me""\n20. 2 - (Pop) Justin Bieber - ""Sorry""\n21-2521. (Rap) 1 - Post Malone - ""White Iverson""\n22. (Pop) 1 - Melanie Martinez - ""Pity Party""\n23. (Pop) Grimes - ""Kill V. Maim""\n24. (Rap) 7 - Jay Rock - ""Gumbo""\n25. (Rap) 4 - Joey Bada$$ - ""Paper Trail$""\n26-3026. (Rap) 5 - Drake - ""Back to Back""\n27. (Rap) 4 - A$AP Rocky - ""Canal St.""\n28. (Rock) 4 - Beach House - ""Space Song""\n29. (Rock) 3 - Tame Impala - ""New Person, Same Old Mistakes""\n30. (Electronic) 3 - Major Lazer - “Lean On“\n31-3531. (Rap) 3 - Future - ""March Madness""\n32. (Rap) 3 - Drake - ""Know Yourself""\n33. (Pop) 3 - Courtney Barnett - ""Pedestrian At Best""\n34. (Electronic) 2 - Snakehips - ""All My Friends""\n35. (Pop) 2 - Rihanna - ""Bitch Better Have My Money""\n36-4036. (Pop) 2 - Justin Bieber - ""What Do You Mean?""\n37. (Pop) 1 - Lana Del Rey - ""Terrence Loves You""\n38. (Rap) 8 - Travi$ Scott - ""Antidote""\n39. (Pop) 3 - Panda Bear - ""Mr Noah""\n40. (Rap) 5 - Vince Staples - ""Norf Norf""\n41-4541. (Rap) 3 - Drake & Future - ""Diamonds Dancing""\n42. (Country) 2 - Rihanna - ""Four Five Seconds""\n43. (Pop) 2 - Joanna Newsom - ""Sapokanikan""\n44. (Pop) 2 - Carly Rae Jepsen - ""Run Away with Me""\n45. (Pop) 1 - Troye Sivan – ""Wild""\n46-5046. (Pop) 1 - San Fermin - ""Emily""\n47. (Rap) 1 - Pusha T - ""Untouchable""\n48. (Grime) Skepta - ""Shutdown""\n49. (Rap) 4 - Lupe Fiasco - ""Mural""\n50. (Pop) 5 - Adele - ""Hello""\n\n********\n\n51. (Pop/Rap) 3 - Selena Gomez - ""Good For You""\n52. (Pop) 3 - Halsey - ""Colors""\n53. (Rap) 2 - Tyler, the Creator - ""Fucking Young""\n54. (Pop) 2 - Towkio - ""Heaven Only Knows""\n55. (Rap) 2 - Meek Mill - ""R.I.C.O.""\n56. (Rock) 2 - Beach House - ""Levitation""\n57. (Rap) 2 - A$AP Rocky - ""Lord Pretty Flacko Jodye II""\n58. (Rap)  1 - Dr. Dre - ""Darkside/Gone""\nNeed more discussion8 - A$AP Rocky - ""L$D""\n6 - Big Sean - ""Blessings""\n5 - The Weeknd - ""Tell Your Friends""\n5 - The Weeknd - ""Can\'t Feel My Face""\n5 - Kendrick Lamar - ""Alright""\n5 - Kanye West - ""All Day""\n4 - Kanye West - ""Wolves""\n4 - Fetty Wap - ""Trap Queen""\n3 - Wolf Alice - ""You\'re A Germ""\n3 - Tame Impala - ""Eventually""\n3 - Father John Misty - ""The Night Joshua Tillman Came To Our Apartment""\n2 - The 1975 - ""Love Me""\n2 - Sleater-Kinney - ""New Wave""\n2 - PARTYNEXTDOOR - ""Things and Such (Kehlani\'s Freestyle)""\n2 - Halsey - ""Drive""\n2 - Earl Sweatshirt - ""Solace""\n2 - Courtney Barnett –\xa0“Kim\'s Caravan“\n2 - Clarence Clarity - ""Those Who Can\'t, Cheat""\n2 - Blur -""There Are Too Many Of Us""\n1 - One Direction - ""Infinity""\n1 - Viet Cong - ""Death""\n1 - Vic Mensa - ""U Mad?""\n1 - Tame Impala - ""Let It Happen""\n1 - Susanne Sundfør - ""Memorial""\n1 - Pierce The Veil - ""The Divine Zero""\n1 - Nate Ruess - “AhHa“\n1 - Lupe Fiasco – ""Adoration of the Magi""\n1 - Jack Ü - ""Where Are Ü Now""\n1 - Frank Turner - ""The Next Storm""\n1 - Django Django - ""First Light""\n1 - Big Grams - ""Fell In The Sun""\nGrimes - ""California""\n1 - Baio –\xa0""Endless Rhythm""\nJustin Bieber - ""Love Yourself""\nNot listed6 - Kendrick Lamar - ""How Much A Dollar Cost""\n5 - Kendrick Lamar - ""Wesley\'s Theory""\n5 - Action Bronson - ""Baby Blue""\n4 - Young Thug - ""Check""\n4 - Lil Wayne - ""Glory""\n4 - Future - ""Thought It Was A Drought""\n4 - Drake - ""Jungle""\n3 - Mick Jenkins - ""P\'s & Q\'s""\n3 - Mick Jenkins - """"Alchemy""\n3 - Mac Miller - ""Brand Name""\n3 - Kendrick Lamar - ""These Walls""\n3 - Kendrick Lamar - ""Mortal Man""\n3 - Jay Rock - ""Vice City""\n3 - Jay Rock - ""Necessary""\n3 - Isaiah Rashad - ""Nelly""\n3 - Future - ""Where Ya At""\n2 - Young Thug - ""Raw""\n2 - Yelawolf - ""American You""\n2 - Vince Staples - “Like It Is“\n2 - Travi$ Scott - ""3500""\n2 - The Weeknd - ""Angel""\n2 - The Weeknd - ""Acquainted""\n2 - The Neighbourhood - ""R.I.P. 2 My Youth""\n2 - The Game - ""El Chapo""\n2 - The Game - ""100""\n2 - Kendrick Lamar - ""Untitled""\n2 - Jay Rock - ""Money Trees Deuce""\n2 - iLoveMakonnen - ""Down 4 So Long (Remix)""\n2 - Future - ""Just Like Bruddas""\n2 - Dr. Dre - ""Animals""\n2 - Carly Rae Jepsen - ""I Really Like You""\n2 - Big Sean - ""One Man Can Change The World""\n2 - Alessia Cara - ""Four Pink Walls""\n2 - A$AP Rocky - ""M\'$""\n1 - Yuma X - ""Swimming Pool""\n1 - Young Thug - ""With That""\n1 - Young Thug - ""Halftime""\n1 - Walk the Moon - ""Shut Up and Dance""\n1 - Wafia - ""Heartburn""\n1 - Troye Sivan – ""Talk Me Down""\n1 - Troye Sivan – ""Fools""\n1 - Travi$ Scott - ""90210""\n1 - The Weeknd - ""Earned It""\n1 - The National - ""Sunshine On My Back""\n1 - Taylor Swift - ""Wildest Dreams""\n1 - Taylor Swift - ""Style""\n1 - Taylor Swift - ""Shake It Off""\n1 - Taylor Swift - ""Blank Space""\n1 - Sia - ""Alive""\n1 - Selena Gomez - ""Same Old Love""\n1 - San Fermin - ""Jackrabbit""\n1 - Rihanna - ""American Oxygen""\n1 - Phoebe Ryan - ""Dead""\n1 - One Direction - ""Perfect""\n1 - OMI - ""Cheerleader (Felix Jaehn Remix)""\n1 - Naughty Boy ""Runnin\' (Lose It All)""\n1 - Meg Myers - ""I Really Want You To Hate Me""\n1 - Meek Mill - ""Lord Knows""\n1 - Macklemore & Ryan Lewis– ""Downtown""\n1 - Lupe Fiasco - “Chopper“\n1 - Lupe Fiasco - ""Body of Work""\n1 - Joey Badass - ""Hazeus View""\n1 - Joey Bada$$ – ""On & On""\n1 - Jay Rock - ""Easy Bake""\n1 - Heaven Only Knows - “Towkio“\n1 - Halsey - ""New Americana""\n1 - G-Eazy - ""Random""\n1 - G-Eazy - ""Me, Myself & I""\n1 - Future - ""Trap Niggas""\n1 - Florence + The Machine – ""Shake It Out""\n1 - Florence + The Machine - ""Long & Lost""\n1 - FKA Twigs - ""Glass & Patron""\n1 - Fetty Wap - ""My Way""\n1 - Fetty Wap - ""My Way Remix""\n1 - Fall Out Boy - ""Uma Thurman""\n1 - Fall Out Boy - ""Centuries""\n1 - Ellie Goulding - ""Love Me Like You Do""\n1 - Ed Sheeran - ""Thinking Out Loud""\n1 - Drudkh - ""To the Epoch of Unbowed Poets""\n1 - Drake and Future - “Change Locations“\n1 - Drake & Future - ""Jumpman""\n1 - Drake - ""6pm in New York""\n1 - Disclosure - ""Magnets""\n1 - Courtney Barnett – “Aqua Profunda!“\n1 - Courtney Barnett – ""Small Poppies""\n1 - Chris Brown & Tyga - ""Ayo""\n1 - Chris Brown - ""Zero""\n1 - Carrion Flowers - ""Chelsea Wolfe""\n1 - Carly Rae Jepsen – ""Warm Blood""\n1 - Calvin Harris & The Disciples - ""How Deep Is Your Love""\n1 - Bryson Tiller - ""Sorry Not Sorry""\n1 - Bruno Mars - “Uptown Funk“\n1 - Björk –""Stonemilker""\n1 - Banks - ""Better""\n1 - Bad Meets Evil - ""All I Think About""\n1 - Anna B. Savage –\xa0III\n1 - A$AP Rocky - “Excuse Me“\n1 - 50 Cent - ""Get Low""\nILoveMakonnen - ""Forever""'}"
