artist,album,track,track_id,danceability,energy,key,loudness,speechiness,acousticness,instrumentalness,liveness,valence,tempo,duration_ms,time_signature,mood,lyrics
Nelly Furtado,Loose,Say It Right,5AtFypwxB2ShXSxNj12dEd,0.871,0.869,1,-6.308,0.139,0.0409,0.00111,0.053,0.834,116.95,223080,4,Angry,"{'title': 'Nelly Furtado – Say It Right Lyrics', 'lyrics': ""[Intro: Timbaland]\nFrk-frk-down\nHey\nYou don't mean nothin' at all to me\nHey, hey\n\n[Verse 1: Nelly Furtado]\nIn the day, in the night\nSay it right, say it all\nYou either got it, or you don't\nYou either stand, or you fall\nWhen your will is broken\nWhen it slips from your hand\nWhen there's no time for jokin'\nThere's a hole in the plan\n\n[Chorus: Nelly Furtado & (Timbaland)]\nOh, you don't mean nothing at all to me (Hey, oh, oh, hey)\nNo, you don't mean nothing at all to me (Hey, oh, oh, hey)\nBut you got what it takes to set me free (Hey, oh, oh, hey)\nOh, you could mean everything to me (Hey, oh, oh, hey)\n\n[Verse 2: Nelly Furtado]\nI can't say (Say) that I'm not (Not)\nLost (Lost) and at fault (Fault)\nI can't say (Say) that I don't (Don't)\nLove the light (Love) and the dark\nI can't say that I don't (Don't)\nKnow that I am alive\nAnd all of what I feel (Feel)\nI could show (Show you) you tonight, you tonight\n\n[Chorus: Nelly Furtado & (Timbaland)]\nOh, you don't mean nothing at all to me (Hey, oh, oh, hey)\nNo, you don't mean nothing at all to me (Hey, oh, oh, hey)\nBut you got what it takes to set me free (Hey, oh, oh, hey)\nOh, you could mean everything to me (Hey, oh, oh, hey)\n\n[Verse 3: Nelly Furtado]\nFrom my hands I could give you\nSomething that I made\nFrom my mouth, I could sing you another brick that I laid\nFrom my body (From my body), I could show you (I could show you)\nA place (A place) God knows (That only God knows)\nYou should know the space is holy (Ah-ah-ah-ah)\nDo you really wanna go?\n(Three, four)\n\n[Outro: Timbaland]\nHey, hey, hey\nYou don't mean nothin' at all to me\nHey, hey\nHey, hey, hey\nYou don't mean nothin' at all to me\nHey, hey""}"
Nelly Furtado,Loose,Maneater,1M9uq2yCiOhsO6BFozo2OE,0.792,0.77,6,-4.811,0.0392,0.0318,0.000194,0.122,0.732,132.793,258840,4,Angry,"{'title': 'Nelly Furtado – Maneater Lyrics', 'lyrics': ""[Intro: Timbaland]\nTake it back, take it back, take it back\nOh oh oh ah oh\nOh ah oh oh oh ah\n\n[Verse 1: Nelly Furtado & (Timbaland)]\nEverybody look at me, me (Oh)\nI walk in the door, you start screaming (Oh)\nCome on, everybody, what you here for? (Oh)\nMove your body around like a nympho (Oh)\nEverybody get your necks to crack around (Oh)\nAll you crazy people, come on, jump around (Oh)\nI wanna see you all on your knees, knees (Oh)\nYou either wanna be with me, or be me\n(Come on, now)\n\n[Chorus: Nelly Furtado]\nManeater, make you work hard\nMake you spend hard, make you want all of her love\nShe's a maneater, make you buy cars\nMake you cut cards, make you fall real hard in love\nShe's a maneater, make you work hard\nMake you spend hard, make you want all of her love\nShe's a maneater, make you buy cars\nMake you cut cards, wish you never ever met her at all\n\n[Verse 2: Nelly Furtado & (Timbaland)]\nAnd when she walks, she walks with passion (Oh)\nWhen she talks, she talks like she can handle it (Oh)\nWhen she asks for somethin', boy, she means it (Oh)\nEven if you never ever seen it (Oh)\nEverybody get your necks to crack around (Oh)\nAll you crazy people, come on, jump around (Oh)\nYou doin' anything to keep her by your side (Oh)\nBecause, she said she love you, love you long time\n(Come on, now)\n\n[Chorus: Nelly Furtado]\nManeater, make you work hard\nMake you spend hard, make you want all of her love\nShe's a maneater, make you buy cars\nMake you cut cards, make you fall real hard in love\nShe's a maneater, make you work hard\nMake you spend hard, make you want all of her love\nShe's a maneater, make you buy cars\nMake you cut cards, wish you never ever met her at all\n\n[Bridge: Nelly Furtado & (Timbaland)]\n(Oh)\nAh-ah-ah-ah oh (Oh)\nAh-ah-ah-ah oh (Oh)\nAh-ah-ah-ah oh (Oh)\nAh-ah-ah-ah yeah\n(Come on, now)\n\n[Chorus: Nelly Furtado]\nManeater, make you work hard\nMake you spend hard, make you want all of her love\nShe's a maneater, make you buy cars\nMake you cut cards, make you fall real hard in love\nShe's a maneater, make you work hard\nMake you spend hard, make you want all of her love\nShe's a maneater, make you buy cars\nMake you cut cards, wish you never ever met her at all\n\n[Outro: Nelly Furtado & (Timbaland)]\nNo, never ever met her at all (What you sayin' girl?)\nYou wish you never ever met her at all (What you sayin' girl?)\nYou wish you never ever met her at all (What you sayin' girl?)\nYou wish you never ever met her at all (Come on!)\nYou wish you never ever met her at all (What you sayin' girl?)\nYou wish you never ever met her at all (What you sayin' girl?)\nYou wish you never ever met her at all (What you sayin' girl?)\nYou wish you never ever met her at all (Break!)\n(I been around the world I ain't never meet a girl like this)\nShe's a maneater, a maneater\n(I been around the world I ain't never meet a girl like this)\nShe's a maneater, a maneater\n(I been around the world I ain't never meet a girl like this)\nShe's a maneater, a maneater\n(I been around the world I ain't never meet a girl like this)\nLike this, like this, like this, like this""}"
Rihanna,Good Girl Gone Bad: Reloaded,Breakin' Dishes,46aZJc0z1HHHSFxaIRxYSP,0.801,0.674,8,-4.185,0.0311,0.000282,0.000139,0.0914,0.875,125.009,200573,4,Angry,"{'title': ""Rihanna – Breakin' Dishes Lyrics"", 'lyrics': ""[Intro]\nI don't know who you think I am\nI don't know who you think I am\nI don't know who you think I am\nI don't know who you think I am\n\n[Verse 1]\nHe been gone (Gone) since 3:30 (3:30)\nBeen coming home lately at 3:30 (3:30)\nI'm super cool, I've been a fool\nBut now I'm hot, and baby, you gon' get it\nNow I ain't tripping, I ain't twisted\nI ain't demented, well, just a lil' bit\nI'm kickin' asses, I'm taking names\nI'm on flame, don't come home, babe\n\n[Chorus]\nI'm breakin' dishes up in here, all night (Uh-huh)\nI ain't gon' stop until I see police lights (Uh-huh)\nI'ma fight a man tonight, I'ma fight a man tonight\nI'ma fight a man, a man, a man\nA man, a man, a man, oh\n\n[Verse 2]\nI'm still waiting, come through the door\nI'm killing time, you know, bleaching your clothes\nI'm roasting marshmallows on the fire\nAnd what I'm burning is your attire\nI'm getting restless, I'm getting tested\nAnd I can't believe he's always out every night and never checks in\nIs he cheating? Man, I don't know\nI'm looking 'round for something else to throw\n[Chorus]\nI'm breakin' dishes up in here, all night (Uh-huh)\nI ain't gon' stop until I see police lights (Uh-huh)\nI'ma fight a man tonight, I'ma fight a man tonight\nI'ma fight a man, a man, a man\nA man, a man, a man, oh\n\n[Bridge]\nI don't know who you think I am (I am, I am, I am, I am)\n(I don't know who you think I am)\nBut I really don't give a damn right now\nIf you don't come, I'ma huff and puff and blow this, blow this, oh\nBlow this, blow this, I'ma blow this, blow this, oh\nBlow this, blow this, I'ma blow this, blow this, oh\nBlow this house, house down\nDishes, breakin' dishes, breakin' dishes\n\n[Chorus]\nI'm breakin' dishes up in here, all night (Uh-huh)\nI ain't gon' stop until I see police lights (Uh-huh)\nI'ma fight a man tonight, I'ma fight a man tonight\nI'ma fight a man, a man, a man\nA man, a man, a man\nA man, a man, a man\n\n[Outro]\nBreakin', breakin', breakin', breakin' (Dishes, dishes, dishes)\nBreakin', breakin', breakin', breakin' (Dishes, dishes, dishes)\nBreakin', breakin', breakin', breakin' (Dishes, dishes, dishes)\nBreakin', breakin', breakin', breakin' (Dishes, dishes, dishes)""}"
Rihanna,Loud,Man Down,454h9zAIuTe1eJyw9iTnj4,0.479,0.906,0,-4.03,0.188,0.0406,0.0,0.051,0.536,155.887,266987,4,Angry,"{'title': 'FV – Odd Mammal Lyrics', 'lyrics': ""[Verse 1]\nNice track, let me spit about chains\nI lit a flame, like I'm smoking crack, spit about pain\nNext up I gota say hat everybody's spitting the same\n(Except for me) I am rapping about different things\nAnd in a different language\nGot a tricky advantage\nNever panic, 'cause I've been blessed wih a different brain\nI gotta claim that I don't care\nMiddle-finger the fame\nSimple and plain - if the Queen's a whore\nThen King is to blame (Rrah)\nSpit about, how I start revolutions\nI spit about indifference causing massive confusion\nI spit about being villigent with rapid solutions\nGo to a funeral and laugh as I blast my music\nLike:\n\n[Chorus]\nRrrram, pam-pam-pam\nRrrram pama-para\nJust like Rihanna got a man down sayonara\nLike:\nRrrram pam-pam-pam\nRrrram pa-raro\nHappines is a warm gun shooting cold ammo\n[Verse 2]\nFab like a Fab Four or Cannavaro\nI'm kinda dope, crip-walking like Captain Sparrow\nHit the motherfucking bullseye wih wrong arrow\nMy dick skeleton hard, I'm cumming bone marrow (Woof)\nThat last line, that was so shallow\nMy mind's narrow like the towers of an old pharaoh\n(The Pyramids) think about it, I'm an odd mammal\nWorrying about my lungs while I smoke Camels\nI'm like, Aloe Blacc, I need a dollar\nReincarnaition of Salvador Dali, avida DollarS\nFuck that, I wanna be Apollo\nSo tell Zeus I am coming for his spot\nAnd his pretty daughters\nWherever I go, the city follows\nThe pretty models try to flee but the heels\nMake'em fall on their skinny bottoms\nSeeing the world via Biggie's goggles\nHate me or love me\nGot the Heart of the City boggled\n\n[Outro]\nLove, love me do...""}"
Dua Lipa,Dua Lipa (Deluxe),IDGAF,76cy1WJvNGJTj78UqeA5zr,0.836,0.544,7,-5.975,0.0943,0.0403,0.0,0.0824,0.51,97.028,217947,4,Angry,"{'title': 'Dua Lipa – IDGAF Lyrics', 'lyrics': ""[Verse 1]\nYou call me all friendly\nTellin' me how much you miss me\nThat's funny, I guess you've heard my songs\nWell, I'm too busy for your business\nGo find a girl who wants to listen\n'Cause if you think I was born yesterday, you have got me wrong\n\n[Pre-Chorus]\nSo I cut you off\nI don't need your love\n'Cause I already cried enough\nI've been done\nI've been movin' on since we said goodbye\nI cut you off\nI don't need your love\nSo you can try all you want\nYour time is up, I'll tell you why\n\n[Chorus]\nYou say you're sorry, but it's too late now\nSo save it, get gone, shut up\n'Cause if you think I care about you now\nWell, boy, I don't give a fuck\n\n[Verse 2]\nI remember that weekend\nWhen my best friend caught you creepin'\nYou blamed it all on the alcohol\nSo, I made my decision\n'Cause you made your bed, sleep in it\nPlay the victim and switch your position\nI'm through, I'm done\n[Pre-Chorus]\nSo I cut you off\nI don't need your love\n'Cause I already cried enough\nI've been done\nI've been movin' on since we said goodbye\nI cut you off\nI don't need your love\nSo you can try all you want\nYour time is up, I'll tell you why\n\n[Chorus]\nYou say you're sorry, but it's too late now\nSo save it, get gone, shut up\n'Cause if you think I care about you now\nWell, boy, I don't give a fuck\n\n[Post-Chorus]\nI see you tryna get to me\nI see you beggin' on your knees\nBoy, I don't give a fuck\nSo stop tryna get to me\nTch, get up off your knees\n'Cause, boy, I don't give a fuck\n\n[Bridge]\nAbout you\nNo, I don't give a damn\nYou keep reminiscin' on when you were my man\nBut I'm over you\nNow you're all in the past\nYou talk all that sweet talk, but I ain't comin' back\n[Breakdown]\nCut you off\nI don't need your love\nSo you can try all you want\nYour time is up, I'll tell you why\nI'll tell you why\n\n[Chorus]\nYou say you're sorry, but it's too late now\nSo save it, get gone, shut up\n(Too late now)\n'Cause if you think I care about you now\nWell, boy, I don't give a fuck\n(Boy, I don't give a)\n\n[Post-Chorus]\nI see you tryna get to me\nI see you beggin' on your knees\nBoy, I don't give a fuck\nSo stop tryna get to me (get to me)\nTch, get up off your knees\n'Cause, boy, I don't give a fuck""}"
Ariana Grande,Sweetener,God is a woman,5OCJzvD7sykQEKHH7qAC3C,0.602,0.658,1,-5.934,0.0558,0.0233,6e-05,0.237,0.268,145.031,197547,4,Angry,"{'title': 'Ariana Grande – \u200bGod is a woman Lyrics', 'lyrics': ""[Chorus]\nYou, you love it how I move you\nYou love it how I touch you, my one\nWhen all is said and done\nYou'll believe God is a woman\nAnd I, I feel it after midnight\nA feelin' that you can't fight, my one\nIt lingers when we're done\nYou'll believe God is a woman\n\n[Verse 1]\nI don't wanna waste no time, yeah\nYou ain't got a one-track mind, yeah\nHave it any way you like, yeah\nAnd I can tell that you know I know how I want it\nAin't nobody else can relate\nBoy, I like that you ain't afraid\nBaby, lay me down and let's pray\nI'm tellin' you the way I like it, how I want it\n\n[Pre-Chorus]\n(Yeah) And I can be all the things you told me not to be\n(Yeah) When you try to come for me, I keep on flourishing\n(Yeah) And he see the universe when I'm the company\nIt's all in me\n[Chorus]\nYou, you love it how I move you\nYou love it how I touch you, my one\nWhen all is said and done\nYou'll believe God is a woman\nAnd I, I feel it after midnight\nA feelin' that you can't fight, my one\nIt lingers when we're done\nYou'll believe God is a woman\n\n[Verse 2]\n(Yeah)\nI tell you all the things you should know\nSo baby, take my hands, save your soul\nWe can make it last, take it slow, hmm\nAnd I can tell that you know I know how I want it, yeah\nBut you're different from the rest\nAnd boy, if you confess, you might get blessed\nSee if you deserve what comes next\nI'm tellin' you the way I like it, how I want it\n\n[Pre-Chorus]\n(Yeah) And I can be all the things you told me not to be\n(Yeah) When you try to come for me, I keep on flourishing\n(Yeah) And he see the universe when I'm the company\nIt's all in me\n[Chorus]\nYou, you love it how I move you\nYou love it how I touch you, my one\nWhen all is said and done\nYou'll believe God is a woman\nAnd I, I feel it after midnight\nA feelin' that you can't fight, my one\nIt lingers when we're done\nYou'll believe God is a woman\n\n[Outro]\nYeah, yeah\n(God is a woman)\nYeah, yeah\n(God is a woman, yeah)\nMy one\n(One)\nWhen all is said and done\nYou'll believe God is a woman\nYou'll believe God\n(God is a woman)\nOh, yeah\n(God is a woman, yeah)\n(One)\nIt lingers when we're done\nYou'll believe God is a woman""}"
blackbear,digital druglord,do re mi,2MX30RliaxJDgmQ3C3rrJX,0.745,0.605,8,-6.333,0.0492,0.00474,9.28e-06,0.136,0.164,110.979,212027,3,Angry,"{'title': '\u200bblackbear – \u200bdo re mi Lyrics', 'lyrics': ""[Intro]\nDo, re, mi, fa, so\nYeah, yeah, yeah, oh\nDo, re, mi, fa, so\nYeah, yeah, yeah\n\n[Verse 1]\nYeah, if I could go back to that day we met\nI probably would just stay in bed\nYou run your mouth all over town\nAnd this one goes out to the sound\nOf breaking glass on my Range Rover\nPay me back or bitch, it's over\nAll the presents I would send\nFuck my friends behind my shoulder\nNext time I'ma stay asleep\nI pray the Lord my soul to keep, oh\n\n[Pre-Chorus]\nAnd you got me thinking lately\nBitch, you crazy\nAnd nothing's ever good enough\nI wrote a little song for ya\nIt go like\n\n[Chorus]\nDo, re, mi, fa, so fuckin' done with you, girl\nSo fuckin' done with all the games you play\nI ain't no Tic-tac-toe\nSend the X and O's on another note\nI'm do, re, mi, fa, so fuckin' done with you, girl\nSo send the X and O's on another note, I'm ghost\n(Ghost, ghost, ghost)\n(Yeah, yeah, yeah, oh)\n[Verse 2]\nIf I could go back to the day we met\nI probably would've stayed in bed\nYou wake up every day\nAnd make me feel like I'm incompetent\nDesigner shoes and Xanax tabs\nCompliments your make-up bag\nYou never had to buy yourself a drink\n'Cause everybody want to tap that ass sometime\n\n[Pre-Chorus]\nAnd you got me thinking lately\nBitch, you crazy\nAnd nothing's ever good enough\nI wrote a little song for ya\nIt go like\n\n[Chorus]\nDo, re, mi, fa, so fuckin' done with you, girl\nSo fuckin' done with all the games you play\nI ain't no Tic-tac-toe\nSend the X and O's on another note\nI'm do, re, mi, fa, so fuckin' done with you, girl\nSo send the X and O's on another note, I'm ghost\n(Ghost, ghost, ghost)\n(Yeah, yeah, yeah, oh)\n[Bridge]\n(And you got me thinking lately, yeah)\n(Bitch, you crazy)\n(And nothing's ever good enough)\nI wrote a little song for you, it go like\n\n[Chorus]\nDo, re, mi, fa, so fuckin' done with you, girl\nSo fuckin' done with all the games you play\nI ain't no Tic-tac-toe\nSend the X and O's on another note\nI'm do, re, mi, fa, so fuckin' done with you, girl\nSo send the X and O's on another note, I'm ghost\n(Ghost, ghost, ghost)\n(Yeah, yeah, yeah)\n\n[Outro]\nSo send the X and O's on another note, I'm ghost\nDo, re, mi, fa, so\n(Yeah, yeah, yeah)\nSo send the X and O's on another note, I'm ghost\n(Ghost, ghost, ghost)""}"
Carly Rae Jepsen,Kiss (Deluxe),Tonight I’m Getting Over You,471JtpRQ0oox9OoZcbB8OO,0.72,0.776,10,-5.331,0.043,0.00549,0.000298,0.365,0.135,125.96,219213,4,Angry,"{'title': ""Carly Rae Jepsen – Tonight I'm Getting Over You Lyr"", 'lyrics': ""[Verse 1]\nI wanna smash your fears\nAnd get drunken off your tears\nDon't you share your smile with anyone else but me\nI wanna touch your heart\nI wanna crush it in my hands\nMake you plead and cry, as you give up all the lies\n\n[Refrain]\nWe're not lovers, but more than friends\nPut a flame to every single word you ever said\nNo more crying to get me through\nI'll keep dancing 'til the morning with somebody new\nTonight, I'm getting over you\n\n[Chorus]\nTonight, I'm getting over you\nTonight, I'm getting over you\nTonight, I'm getting over you\nOver you, over you\n\n[Verse 2]\nStuck in a real bad dream\nAnd man, it feels so new to me\nShould be in your arms, but I'm beggin' at your feet\nIt's been a real hard night, and I just hold my pillow tight\nIt won't love me back, no, it's not you and I\n\n[Refrain]\nWe're not lovers, but more than friends\nPut a flame to every single word you ever said\nNo more crying to get me through (Get me through)\nI'll keep dancing 'til the morning with somebody new\nTonight, I'm getting over you\n\n[Chorus]\nTonight, I'm getting over you\nTonight, I'm getting over you\nTonight, I'm getting over you\nOver you, over you\nTonight, I'm getting over you\nTonight, I'm getting over you (Tonight)\nTonight, I'm getting over you\nOver you, over you\n\n[Refrain]\nWe're not lovers, but more than friends\n(Tonight, I'm getting over you, tonight, I'm getting over you)\nPut a flame to every single word you ever said\n(Tonight, I'm getting over you, tonight, I'm getting over you)\nNo more crying to get me through\nI'll keep dancing 'til the morning with somebody new\nTonight, I'm getting over you""}"
Ariana Grande,My Everything (Deluxe),Break Free,12KUFSHFgT0XCoiSlvdQi4,0.687,0.702,7,-5.324,0.0455,0.0064,4.35e-05,0.204,0.284,129.956,214840,4,Angry,"{'title': 'Ariana Grande – Break Free Lyrics', 'lyrics': ""[Click here to read how Zedd and Ariana Grande got together to make “Break Free”]\n\n[Verse 1]\nIf you want it, take it\nI should've said it before\nTried to hide it, fake it\nI can't pretend anymore\n\n[Pre-Chorus]\nI only wanna die alive\nNever by the hands of a broken heart\nI don't wanna hear you lie tonight\nNow that I've become who I really am\n\n[Chorus]\nThis is the part when I say I don't want ya\nI'm stronger than I've been before\nThis is the part when I break free\n'Cause I can't resist it no more\nThis is the part when I say I don't want ya\nI'm stronger than I've been before\nThis is the part when I break free\n'Cause I can't resist it no more\n\n[Verse 2]\nYou were better, deeper\nI was under your spell, yeah\nLike a deadly fever, yeah, babe\nOn the highway to hell, yeah\n[Pre-Chorus]\nI only wanna die alive\nNever by the hands of a broken heart\nI don't wanna hear you lie tonight\nNow that I've become who I really am\n\n[Chorus]\nThis is the part when I say I don't want ya\nI'm stronger than I've been before\nThis is the part when I break free\n'Cause I can't resist it no more\nThis is the part when I say I don't want ya\nI'm stronger than I've been before\nThis is the part when I break free\n'Cause I can't resist it no more\n\n[Bridge]\nNo more, baby\nOoh-ooh-ooh\nThought of your body, I came alive\nIt was lethal, it was fatal\nIn my dreams, it felt so right\nBut I woke up every time\nOoh, baby\n\n[Chorus]\nThis is the part when I say I don't want ya\nI'm stronger than I've been before (Ooh-ooh-ooh-ooh)\nThis is the part when I break free\n'Cause I can't resist it no more\nThis is (This is) the part when I say I don't want ya\nI'm stronger than I've been before\nThis is the part when I break free\n'Cause I can't resist it no more""}"
