artist,album,track,track_id,danceability,energy,key,loudness,speechiness,acousticness,instrumentalness,liveness,valence,tempo,duration_ms,time_signature,mood,lyrics
No Doubt,The Singles Collection,Just A Girl,6mfkHv00I6jhHIn7EWHJ2N,0.635,0.937,2,-2.86,0.0452,0.0741,7.29e-05,0.134,0.779,108.003,205947,4,Angry,"{'title': 'Flash Giordani – Slippery Slope Lyrics', 'lyrics': '[Intro]\nGoddamit it\n[?] way too much money\nOh well\n[?]\n\n[Verse 1]\nVicodin up in my system, I’m so blissful, ain’t no doubt about it\nHighed up, slowed down, it’s just me girl no ways around it\nVisine hides me from judgement I’m facing [?]\n(Goddamn)\nLaying low, red and blue, plotting [?]\nI’m in this waterland, dodging skags\nNew whip with the leather seats\nNew bitch down to pleasure me, she popping pills\nI wonder if she’ll remember me\nI took a dream without the dollar, focusing on profit\nPeople come and go and I ain’t boutta stop them\nFuck a backup plan, I’m narrowing down my options\nWorking even harder ever since I dropped you\nI was high on [?], finna puke\nWhere were you when I really need you most?\nYou seem to bear mood swings\nWhen the chips was down I still found a way to cope\nAll black, with the [?]\nThat’s a steering wheel, I make her bust it open\nShe gon’ run up game, but bitch I’m playing poker\nSee you love to finesse, but you can’t play this joker, hoe\n[Chorus]\nI fell in love with you, that was first sight\n(That was first sight)\nBut I knew you were trouble from the first night\nCause fucking with you\nIs such a slippery slope\n(Ou woah, ou woah)\nShe’s the reason seasons change, and I just can’t let go\n(Goddamn)\nBut honestly I hope we fade away like all the smoke\nBecause hoe fucking with you\nIs such a slippery slope\n(Ou woah)\n\n[Verse 2]\nBut fuck that bitch I’m on, I might do patron\nMiss the weed, I’m in my zone\nMoney old like Morgan Freeman\n[?] Polo my cologne\nI can’t break no sweats about you\nI’ve been down and seen way worse\nGetting you away from me, is like breaking free the Based God curse\nDamn, I ain’t tryna hurt your little heart\nI just knew that fucking you was a problem from the start\nKeep it cool, then baby maybe one day, the tides will change\nBut till then the boy gone\nSilk shirts smell like pound cake, I’ve been blowing [?]\nMoving on my own\nWent and copped the fucking ski jacket\nCause with you it’s like I’m finna hit the slopes\n(Goddamn)\n[Chorus 2]\nI fell in love with you, that was first sight\n(That was first sight)\nBut I knew you were trouble from the first night\nCause fucking with you\nIs such a slippery slope\n(Ou woah, ou woah, ou woah)\n\n[Outro]\nYea, yea, yea, yea, yea\nFucking with you\nSuch a slippery slope\n(Ou woah, ou woah)'}"
Beyoncé,BEYONCÉ [Platinum Edition],***Flawless (feat. Chimamanda Ngozi Adichie),7tefUew2RUuSAqHyegMoY1,0.476,0.688,1,-7.799,0.245,0.0953,0.000645,0.438,0.352,140.553,250960,4,Angry,"{'title': 'Beyoncé – ***Flawless Lyrics', 'lyrics': '[Intro: Star Search excerpt]\n""Your challengers are a young group from Houston\nWelcome Beyoncé, Lativia, Nina, Nicky, Kelly and Ashley\nThe hip-hop-rappin\' Girls\' TYME!""\n\n[Part 1: Bow Down]\n\n[Chorus]\nI\'m out that H-Town, comin\'— comin\' down\nI\'m comin\' down, drippin\' candy on the ground\nH—H-Town—Town, I\'m comin\' down\nComin\' down, drippin\' candy on the ground\n\n[Verse 1: Beyoncé & Jay-Z]\nI know when you were little girls\nYou dreamt of being in my world\nDon\'t forget it, don\'t forget it\nRespect that, bow down, bitches (Crown)\nI took some time to live my life\nBut don\'t think I\'m just his little wife\nDon\'t get it twisted, get it twisted\nThis my shit, bow down, bitches\n\n[Bridge: Beyoncé & Jay-Z]\nBow down, bitches— Bow— Bow down, bitches (Crown)\nBow down, bitches— Bow— Bow down, bitches (Crown)\nH-Town vicious, H—H-Town vicious\nI\'m so crown— crown— bow down, bitches!\n[Chorus]\nI\'m out that H-Town, comin\'— comin\' down\nI\'m comin\' down, drippin\' candy on the ground\nH—H-Town—Town, I\'m comin\' down\nCom—Com—Comin\' down, drippin\' candy on the ground\n\n[Part 2: ***Flawless]\n\n[Intro: Chimamanda Ngozi Adichie]\nWe teach girls to shrink themselves, to make themselves smaller\nWe say to girls: ""You can have ambition, but not too much\nYou should aim to be successful, but not too successful\nOtherwise, you will threaten the man""\nBecause I am female, I am expected to aspire to marriage\nI am expected to make my life choices always keeping in mind that marriage is the most important (C—Candy on the ground)\nNow, marriage can be a source of joy and love and mutual support (Dum-dah-de-da)\nBut why do we teach girls to aspire to marriage and we don\'t teach boys the same? (Do-da-da, do-do, do-do-do-da)\nWe raise girls to see each other as competitors\nNot for jobs or for accomplishments, which I think can be a good thing (Com—Com—Comin\' down, drippin\' candy on the ground)\nBut for the attention of men\nWe teach girls that they cannot be sexual beings in the way that boys are (Dum-dah-de-da)\nFeminist: A person who believes in the social, political, and economic equality of the sexes (Do-da-da, do-do, do-do-do-da)\n\n[Chorus: Beyonce]\nYou wake up, flawless, post up, flawless\nRiding \'round in it, flawless, flossin\' on that, flawless\nThis diamond, flawless, my diamond, flawless\nThis rock, flawless, my Roc, flawless\nI woke up like this, I woke up like this\nWe flawless, ladies, tell \'em\nI woke up like this, I woke up like this\nWe flawless, ladies, tell \'em\nSay, ""I look so good tonight"" (Right— Right— Right—)\nGoddamn, Goddamn\nSay, ""I look so good tonight"" (Right— Right— Right—)\nGoddamn, Goddamn, Goddamn!\n[Bridge: Beyoncé]\nMy mama taught me good home training\nMy daddy taught me how to love my haters\nMy sister told me I should speak my mind\nMy man make me feel so Goddamn fine, I\'m flawless!\n\n[Chorus: Beyonce]\nYou wake up, flawless, post up, flawless\nRiding \'round in it, flawless, flossin\' on that, flawless\nThis diamond, flawless, my diamond, flawless\nThis rock, flawless, my Roc, flawless\nI woke up like this, I woke up like this\nWe flawless, ladies, tell \'em\nI woke up like this, I woke up like this\nWe flawless, ladies, tell \'em\nSay, ""I look so good tonight"" (Right— Right— Right—)\nGoddamn, Goddamn\nSay, ""I look so good tonight"" (Right— Right— Right—)\nGoddamn, Goddamn, Goddamn!\n\n[Outro: Star Search excerpt]\n""The judges give champion Skeleton Crew 4 stars, a perfect score\nThe challenger, Girls\' TYME, receives... 3 stars\nSkeleton Crew, champions once again\nCongratulations, we\'ll see you next week""'}"
P!nk,Funhouse: The Tour Edition,So What,19qn6oU2t0E72ENA0aWNsX,0.535,0.888,11,-3.1,0.0446,0.000304,2.17e-06,0.324,0.451,126.011,215160,4,Angry,"{'title': 'Operación Triunfo 2017 – What About Us Lyrics', 'lyrics': ""[Verso 1]\nWe are search lights, we can see in the dark\nWe are rockets, pointing up at the stars\n\n[Estribillo]\nWhat about us?\nWhat about all the times you said you had the answers?\nWhat about us?\nWhat about all the broken happy ever afters?\nWhat about us?\nWhat about all the plans that ended in disaster?\nWhat about love?\nWhat about trust?\nWhat about us?\n\n[Puente]\nSticks and stones\nThey may break these bones but then\nI'll be ready\nAre you ready?\nIt's the start of us\nWe cannot come on\nAre you ready?\nI'll be ready\nI don't want control\nI want to let go\n(Are you ready?\nI'll be ready)\n'Cause now is time to\nLet them know\n(Are you ready?)\n[Estribillo]\nWhat about us?\nWhat about all the times you said you had the answers?\nSo what about us?\nWhat about all the broken happy ever afters?\nWhat about us?\nWhat about all the plans that ended in disaster?\nWhat about love?\nWhat about trust?\nWhat about us?\n\n[Final]\nWhat about us?\nWhat about us?\nWhat about us?\nWhat about us?\nWhat about us?\nWhat about us?""}"
Demi Lovato,Confident (Deluxe Edition),Confident,0Mn3amMRMoabaoTf1Publ4,0.594,0.749,3,-6.251,0.0677,0.00188,0.000139,0.0869,0.344,130.064,205746,4,Angry,"{'title': 'Demi Lovato – Confident Lyrics', 'lyrics': ""[Intro]\nAre you ready?\nHa\n\n[Verse 1]\nIt's time for me to take it\nI'm the boss right now\nNot gonna fake it\nNot when you go down\n'Cause this is my game, and you better come to play\nI used to hold my freak back, now I'm letting go\nI make my own choice\nBitch, I run this show\nSo leave the lights on\nNo, you can't make me behave\n\n[Pre-Chorus]\n(Oh-oh-oh)\nSo, you say I'm complicated\nThat I must be out my mind\nBut you've had me underrated-rated-rated\n\n[Chorus]\n(Uh-huh) What's wrong with being, what's wrong with being\nWhat's wrong with being confident?\n(Uh-huh) What's wrong with being, what's wrong with being\nWhat's wrong with being confident?\n(Uh-huh)\n\n[Verse 2]\nIt's time to get the chains out\nIs your tongue tied up?\n'Cause this is my ground and I'm dangerous\nAnd you can get off\nBut it's all 'bout me tonight (tonight, ha)\n\n[Pre-Chorus]\n(Oh-oh-oh)\nSo, you say I'm complicated\nThat I must be out my mind\nBut you've had me underrated-rated-rated\n\n[Chorus]\n(Uh-huh) What's wrong with being, what's wrong with being\nWhat's wrong with being confident?\n(Uh-huh, yeah) What's wrong with being (yeah), what's wrong with being (yeah)\nWhat's wrong with being confident?\n(Uh-huh) What's wrong with being, what's wrong with being\nWhat's wrong with being confident?\n(Uh-huh) What's wrong with being, what's wrong with being\nWhat's wrong with being confident?\n(Uh-huh)\n\n[Interlude]\nUh-huh\nHey!\nLa la, yeah\n\n[Breakdown]\nSo, you say I'm complicated\nBut you've had me underrated\nYeah, yeah\n\n[Chorus]\n(Uh-huh) What's wrong with being, what's wrong with being (what's wrong with being)\nWhat's wrong with being confident?\n(Uh-huh, yeah) What's wrong with being (yeah), what's wrong with being (yeah)\nWhat's wrong with being confident?\n(Uh-huh) What's wrong with being, what's wrong with being\nWhat's wrong with being confident?\n(Uh-huh) What's wrong with being, what's wrong with being\nWhat's wrong with being confident?\n(Uh-huh)""}"
Nancy Sinatra,Boots,These Boots Are Made For Walkin',2nwCO1PqpvyoFIvq3Vrj8N,0.74,0.392,9,-11.996,0.0824,0.483,1.11e-06,0.0965,0.387,82.742,166008,4,Angry,"{'title': ""Nancy Sinatra – These Boots Are Made for Walkin' Lyr"", 'lyrics': ""[Verse 1]\nYou keep saying you got something for me\nSomething you call love, but confess\nYou've been messing where you shouldn't have been messing\nAnd now someone else is getting all your best\n\n[Chorus]\nThese boots are made for walking\nAnd that's just what they'll do\nOne of these days these boots\nAre gonna walk all over you\nYeah\n\n[Verse 2]\nYou keep lying when you ought to be truthing\nYou keep losing when you ought to not bet\nYou keep saming when you ought to be changing\nNow what's right is right, but you ain't been right yet\n\n[Chorus]\nThese boots are made for walking\nAnd that's just what they'll do\nOne of these days these boots\nAre gonna walk all over you\n\n[Verse 3]\nYou keep playing where you shouldn't be playing\nAnd you keep thinking that you'll never get burnt, hah\nWell, I've just found me a brand new box of matches, yeah\nAnd what he knows, you ain't had time to learn\n[Chorus]\nThese boots are made for walking\nAnd that's just what they'll do\nOne of these days these boots\nAre gonna walk all over you\n\n[Outro]\nAre you ready, boots?\nStart walking""}"
Demi Lovato,Demi,Really Don't Care,5vTPxzm4h2bY9rYyVrGEU5,0.706,0.728,7,-3.602,0.0852,0.123,0.0,0.185,0.851,121.017,201600,4,Angry,NaN
Lily Allen,"It's Not Me, It's You",Fuck You,5st5644IlBmKiiRE73UsoZ,0.775,0.904,1,-4.08,0.0437,0.0271,0.000303,0.06,0.84,130.009,219893,4,Angry,"{'title': 'Lily Allen – Fuck You Lyrics', 'lyrics': ""[Verse 1]\nLook inside, look inside your tiny mind\nThen look a bit harder\n'Cause we're so uninspired, so sick and tired\nOf all the hatred you harbour\nSo you say it's not okay to be gay\nWell, I think you're just evil\nYou're just some racist who can't tie my laces\nYour point of view is medieval\n\n[Chorus]\nFuck you (Fuck you), fuck you very, very much\n'Cause we hate what you do\nAnd we hate your whole crew\nSo please, don't stay in touch (Da-da-da-da-da-da-da)\nFuck you (Fuck you), fuck you very, very much\n'Cause your words don't translate\nAnd it's getting quite late\nSo please, don't stay in touch\n\n[Verse 2]\nDo you get, do you get a little kick out of being small minded?\nYou want to be like your father, it's approval you're after\nWell, that's not how you find it\nDo you, do you really enjoy living a life that's so hateful?\n'Cause there's a hole where your soul should be\nYou're losing control of it\nAnd it's really distasteful\n\n[Chorus]\nFuck you (Fuck you), fuck you very, very much\n'Cause we hate what you do\nAnd we hate your whole crew\nSo please, don't stay in touch (Da-da-da-da-da-da-da)\nFuck you (Fuck you), fuck you very, very much\n'Cause your words don't translate\nAnd it's getting quite late\nSo please, don't stay in touch\n\n[Bridge]\nFuck you, fuck you, fuck you\nFuck you, fuck you, fuck you\nFuck you\n\n[Verse 3]\nYou say you think we need to go to war\nWell, you're already in one\n'Cause it's people like you that need to get slew\nNo one wants your opinion\n\n[Chorus]\nFuck you (Fuck you), fuck you very, very much\n'Cause we hate what you do\nAnd we hate your whole crew\nSo please, don't stay in touch (Da-da-da-da-da-da-da)\nFuck you (Fuck you), fuck you very, very much\n'Cause your words don't translate\nAnd it's getting quite late\nSo please, don't stay in touch\n\n[Outro]\nFuck you, fuck you, fuck you\nFuck you, fuck you, fuck you\nFuck you, fuck you, fuck you\n(Da-da-da-da-da-da-da)\nFuck you, fuck you, fuck you\nFuck you, fuck you, fuck you\nFuck you, fuck you, fuck you""}"
Beyoncé,B'Day Deluxe Edition,Irreplaceable,6RX5iL93VZ5fKmyvNXvF1r,0.447,0.694,7,-4.637,0.382,0.0293,5.46e-06,0.167,0.509,175.868,227853,4,Angry,NaN
Sleater-Kinney,The Woods,Jumpers,089EHpvcaDJeRxMkCol2oB,0.373,0.966,11,-1.502,0.0606,0.0139,2.49e-05,0.113,0.15,145.56,264920,4,Angry,"{'title': 'Sleater-Kinney – Jumpers Lyrics', 'lyrics': ""[Verse 1]\nI spend the afternoon in cars\nI sit in traffic jams for hours\nDon't push me, I am not OK\n\nThe sky is blue most every day\nThe lemons grow like tumors, they—\nAre tiny suns infused with sour\n\n[Chorus]\nLonely as a cloud\nIn the Golden State\nThe coldest winter that I ever saw\nWas the summer that I spent\n\n[Verse 2]\nThe only substance is the fog\nAnd it hides all that has gone wrong\nCan't see a thing inside the maze\n\nThere is a bridge adored and famed\nThe Golden spine of engineering\nWhose back is heavy with my weight\n\n[Chorus]\nLonely as a cloud\nIn the Golden State\nThe coldest winter that I ever saw\nWas the summer that I spent\n\n[Bridge]\nBe still this old heart\nBe still this old skin\nDrink your last drink\nSin your last sin\n\nSing your last song\nAbout the beginning\nSing it out loud\nSo the people can hear, let's go\n\nBe still this sad day\nBe still this sad year\nHope your last hope\nFear your last fear\n\nYou're not the only one\nYou're not the only one\nYou're not the only one\nYou're not the only one, let's go\n\n[Verse 3]\nMy falling shape will draw a line\nBetween the blue of sea and sky\nI'm not a bird, I'm not a plane\n\nI took a taxi to the Gate\nI will not go to school again\nFour seconds was the longest wait\n\n[Outro]\nFour seconds was the longest wait\nFour seconds was the longest wait\nFour seconds was the longest wait\nFour seconds was the longest""}"
David Bowie,The Rise and Fall of Ziggy Stardust and the Spiders from Mars (2012 Remaster),Suffragette City - 2012 Remaster,3YZa4IzxK2UtEKTvdTgsi8,0.455,0.883,2,-9.159,0.0384,0.368,0.0,0.277,0.782,142.638,208413,4,Angry,"{'title': 'David Bowie – Suffragette City Lyrics', 'lyrics': ""[Verse 1]\n(Hey man) Oh, leave me alone, you know\n(Hey man) Oh, Henry, get off the phone, I gotta\n(Hey man) I gotta straighten my face\nThis mellow thighed chick just put my spine out of place\n(Hey man) My schooldays insane\n(Hey man) My work's down the drain\n(Hey man) Well, she's a total blam-blam\nShe said she had to squeeze it but she, and then she\n\n[Chorus]\nOh, don't lean on me, man, 'cause you can't afford the ticket\nBack from Suffragette City\nOh, don't lean on me, man, 'cause you ain't got time to check it\nYou know my Suffragette City\nIs outta sight\nShe's all right\n\n[Verse 2]\n(Hey, man) Oh, Henry, don't be unkind, go away\n(Hey, man) I can't take you this time, no way\n(Hey, man) Dear droogie, don't crash here\nThere's only room for one and here she comes, here she comes\n\n[Chorus]\nOh, don't lean on me, man, 'cause you can't afford the ticket\nBack from Suffragette City\nOh, don't lean on me, man, 'cause you ain't got time to check it\nYou know my Suffragette City\nIs outta sight\nShe's all right\nOh, hit me\n\n[Chorus]\nOh, don't lean on me, man, 'cause you can't afford the ticket\nBack from Suffragette City\nOh, don't lean on me, man, 'cause you ain't got time to check it\nYou know my Suffragette City\nDon't lean on me, man, 'cause you can't afford the ticket\nBack from Suffragette City\nAnd don't lean on me, man, 'cause you ain't got time to check it\nYou know my Suffragette City\nIs outta sight\nWhoa, she's all right\n\n[Outro]\nA Suffragette City\nA Suffragette City\nI'm back on Suffragette City\nI'm back on Suffragette City\nWhoa, Suffragette city\nOoh, Suffragette City\nOoh-how, Suffragette City\nOoh-how, Suffragette City\nOoh-how, Suffragette\nOh, wham, bam, thank you, Ma'am!\nA Suffragette City\nA Suffragette City\nQuite all right\nA Suffragette City\nToo fine\nA Suffragette City\nOoh, a Suffragette City\nOh, my Suffragette City\nOh, my Suffragette City\nOh, Suffragette\nSuffragette!""}"
P!nk,Raise Your Glass,Raise Your Glass,12lZTPlXwUtrQuhEty6098,0.7,0.695,7,-4.973,0.0897,0.00629,0.0,0.0319,0.633,122.028,203333,4,Angry,"{'title': 'P!nk – Raise Your Glass Lyrics', 'lyrics': ""[Verse 1]\nRight, right, turn off the lights\nWe're gonna lose our minds tonight\nWhat's the dealio?\nI love when it's all too much\n5 A.M. turn the radio up\nWhere's the rock 'n roll?\n\n[Pre-Chorus]\nParty crasher, panty snatcher\nCall me up if you a gangsta\nDon't be fancy, just get dancy\nWhy so serious?\n\n[Chorus]\nSo raise your glass if you are wrong\nIn all the right ways, all my underdogs\nWe will never be, never be anything but loud\nAnd nitty-gritty, dirty, little freaks\nWon't you come on and, come on and raise your glass?\nJust come on and, come on and raise your glass\n\n[Verse 2]\nSlam, slam, oh, hot damn\nWhat part of party don't you understand?\nWish you'd just freak out (Freak out already)\nCan't stop, coming in hot\nI should be locked up right on the spot\nIt's so on right now (It's so fuckin' on right now)\n[Pre-Chorus]\nParty crasher, panty snatcher\nCall me up if you a gangsta\nDon't be fancy, just get dancy\nWhy so serious?\n\n[Chorus]\nSo raise your glass if you are wrong\nIn all the right ways, all my underdogs\nWe will never be, never be anything but loud\nAnd nitty-gritty, dirty, little freaks\nWon't you come on and, come on and raise your glass?\nJust come on and, come on and raise your glass\nWon't you come on and, come on and raise your glass?\nJust come on and, come on and raise your glass\n\n[Bridge]\nOh shit! My glass is empty\nThat sucks!\nSo if you're too school for cool (I mean)\nAnd you're treated like a fool (Treated like a fool)\nYou can choose to let it go\nWe can always, we can always party on our own\nSo raise your (Ah, fuck)\n\n[Chorus]\nSo raise your glass if you are wrong\nIn all the right ways, all my underdogs\nWe will never be, never be anything but loud\nAnd nitty-gritty, dirty, little freaks (So raise your glass)\nSo raise your glass if you are wrong\nIn all the right ways, all my underdogs\nWe will never be, never be anything but loud\nAnd nitty-gritty, dirty, little freaks\nWon't you come on and, come on and raise your glass?\nJust come on and, come on and raise your glass\nWon't you come on and, come on and raise your glass? (For me)\nJust come on and, come on and raise your glass\nFor me""}"
Miley Cyrus,Can't Be Tamed,Can't Be Tamed,47cvLbenIcT3GDqFL6duZ0,0.63,0.91,11,-2.919,0.144,0.0287,0.0,0.196,0.743,116.98,168213,4,Angry,"{'title': ""Miley Cyrus – Can't Be Tamed Lyrics"", 'lyrics': ""[Intro]\nRock Mafia\n\n[Verse 1]\nFor those who don't know me, I can get a bit crazy\nHave to get my way, yep\n24 hours a day, 'cause I'm hot like that\nEvery guy, everywhere just gives me mad attention\nLike I'm under inspection\nI always gets a ten, 'cause I'm built like that\n\n[Pre-Chorus 1]\nI go through guys like money flying out the hands\nThey try to change me, but they realize they can't\nAnd every tomorrow is a day I never plan\nIf you're gonna be my man, understand\n\n[Chorus]\nI can't be tamed, I can't be tamed\nI can't be blamed, I can't, can't\nI can't, can't be tamed\nI can't be changed, I can't be tamed\nI can't be, can't, I can't be tamed\n\n[Verse 2]\nIf there was a question about my intentions, I'll tell ya\nI'm not here to sell ya or tell you to go to hell (I'm not a brat like that)\nI'm like a puzzle, but all of my pieces are jagged\nIf you can understand this, we can make some magic\nI'm wrong like that\n\n[Pre-Chorus 2]\nI wanna fly, I wanna drive, I wanna go\nI wanna be a part of something I don't know\nAnd if you try to hold me back, I might explode\nBaby, by now you should know\n\n[Chorus]\nI can't be tamed, I can't be tamed (I can't be tamed)\nI can't be blamed, I can't, can't\nI can't, can't be tamed\nI can't be changed, I can't be tamed\nI can't be, can't, I can't be tamed\n\n[Bridge]\nWell, I'm not a trick you play\nI'm wired a different way\nI'm not a mistake, I'm not a fake, it's set in my DNA\nDon't change me, don't change me (Ooh, oh, oh)\nDon't change me, don't change me (Ooh, oh, oh)\n(I can't be tamed)\n\n[Pre-Chorus 2]\nI wanna fly, I wanna drive, I wanna go\nI wanna to be a part of something I don't know\nAnd if you try to hold me back, I might explode\nBaby, by now you should know\n\n[Chorus]\nI can't be tamed, I can't be tamed\nI can't be blamed, I can't, can't\nI can't, can't be tamed\nI can't be changed, I can't be tamed\nI can't be, can't, I can't be tamed""}"
