artist,album,track,track_id,danceability,energy,key,loudness,speechiness,acousticness,instrumentalness,liveness,valence,tempo,duration_ms,time_signature,mood,lyrics
P!nk,I'm Not Dead,Stupid Girls,5oxGaQRd6cLnEcxxbw0soP,0.683,0.886,4,-5.045,0.071,0.000738,0.00188,0.0524,0.566,100.04,197173,4,Angry,"{'title': 'October 2021 Album Release Calendar |', 'lyrics': ""10/1\nAndy Mineo - Never Land II - 14/14\nAsking Alexandria - See What's on the Inside\u2005-\u200511/11\nAsleep at the\u2005Wheel - Half a Hundred Years\u2005- 3/19\nBallout - Red Eye Music - 21/21\nBear1Boss - It's\u205fEasy\u205f-\u205f0/26\nBooka600 - LOYAL\u205f- 9/15\nBrandi Carlile\u205f- In These Silent Days - 10/10\nClient Liaison - Divine Intervention - 14/14\nDar Williams - I'll Meet You Here - 10/10\nDontSleep & Meezy SG - Wake Up! - 0/12\nDying Wish - Fragments of a Bitter Memory - 11/11\nFelix Jaehn - BREATHE - 15/15\nFinaoThaDon - Rebirth - 1/8\nHans Zimmer - No Time to Die (Original Motion Picture Soundtrack) - 21/21\nHeadie One - Too Loyal for My Own Good - 12/13\nilluminati hotties - Let Me Do One More - 12/12\nJeremy Zucker - CRUSHER - 12/12\nJoJo - trying not to think about it - 12/12\nLeah Kate - What Just Happened? - EP - 7/7\nLike Mike - Pain, Love, & What Comes After - 4/15\nLil Wayne & Rich the Kid - Trust Fund Babies - 10/10\nLily Rose - Stronger Than I Am - 7/7\nLogan Mize - Welcome to Prairieville - 1/11\nLonr. - Land of Nothing Real 2 - 8/8\nLVCRFT - The Return - 10/13\nMat Kearney - January Flower (Deluxe) - 16/16\nMeek Mill - Expensive Pain - 18/18\nMinistry - Moral Hygiene - 10/10\nMink Slide - Funk on Wheels - 2/10\nMolly Payton - Slack - 4/8\nNewsboys - Stand - 10/10\nNoodah05 -  Reborn - 1/13\nPia Mia - My Side - 5/5\nPond - 9 - 9/9\nPotter Payper - Thanks for Waiting - 18/18\nRAY BLK - Access Denied - 14/14\nRyan Trey - A 64 East Saga - 14/14\nStrand of Oaks - In Heaven - 11/11\nSugababes - One Touch (20 Year Anniversary Edition) - 41/41\nThe Doobie Brothers - Liberté - 12/12\nThe Script - Tales From The Script: Greatest Hits - 18/18\nThouxanbanfauni - TTB: STREETS CHOSE ME - 14/15\nTirzah - Colourgrade - 10/10\nTony Bennett & Lady Gaga - Love for Sale - 12/12\nTWICE - The Feels - EP - 6/6\nValley - Last Birthday - 7/7\nVarious Artists - The Daptone Super Soul Revue (Live at the Apollo) - 0/32\nWage War - Manic - 11/11\nWiki - Half God - 16/16\nYes - The Quest - 11/11\n\n10/4\nLute - Gold Mouf - 13/13\n\n10/5\naespa - Savage - 6/6\nGolden Child - DDARA - 13/13\nWOODZ - ONLY LOVERS LEFT - 6/6\nYoungjae - COLORS from Ars - 7/7\n\n10/6\nAlex Porat - MISS SICK WORLD - 9/9\nBig Thief - Change - EP - 4/4\nBLITZERS - SEAT-BELT - 6/6\nglaive & ericdoa - then i'll be happy - 8/8\nGLAY - FREEDOM ONLY - 5/12\niLoveMakonnen - DMW007 - 10/23\nRayne Johnson - Love Drunk or Lonely - EP - 6/6\nSPiCYSOL - From the C - 10/10\n\n10/7\nJulia Wolf - Girls in Purgatory - 8/8\nPIXY - TEMPTATION - 9/9\nShad da God - In God We Trust - 3/15\n\n10/8\nAJ Mitchell - SKYVIEW - 12/12\nAnita Wilson - Soul Sister - 10/10\nAnna Leone - I've Felt All These Things - 10/10\nAtmosphere - WORD? - 14/14\nBADBADNOTGOOD - Talk Memory - 8/8\nBlake Rose - A World Gone By - 7/7\nbbno$ - eat ya veggies - 12/12\nCody Johnson - Human: The Double Album - 18/18\nCurren$y - Still Stoned on Ocean - 11/11\nDonna Summer - I'm a Rainbow: Recovered & Recoloured - 1/15\nDon Toliver - Life of a DON - 16/16\nElderbrook - Innerlight - EP - 4/4\nFar Caspian - Ways to Get Out - 11/13\nFlee Lord & Roc Marciano - Delgado (Deluxe) - 3/15\nGia Woods - Heartbreak County - 4/4\nJames Blake - Friends That Break Your Heart  - 12/12\nJesse McCartney - New Stage - 10/10\nJosh Turner - King Size Manger - 3/11\nJustin Bieber - Justice (Complete Edition) - 25/25\nKESHORE - Sunset Diary - 3/9\nLadyhawke - Time Flies - 3/11\nLil Revive - Grim Peaks III - 7/7\nMadonna - Madame X - Music from the Theater Xperience (Live) - 20/20\nMagdalena Bay - Mercurial World - 14/14\nMarc E. Bassy - Little Men - 15/15\nMoaning Lisa - Something Like This But Not This - 12/12\nNatalie Hemby - Pins and Needles - 4/11\nOh Wonder - 22 Break - 11/11\nOld Dominion - Time, Tequila & Therapy - 13/13\nosquinn - i'm definitely getting sued for this (beat tape no.1) - 4/4\nPip Blom - Welcome Break - 1/11\nPOORSTACY - Party at the Cemetery - 14/14\nPorches - All Day Gentle Hold! - 11/11\nPowfu - tell me your feelings and i won't tell you mine - 5/5\nReba McEntire - Revived Remixed Revisited - 30/30\nRINI - Constellations - 12/12\nSam Fender - Seventeen Going Under - 11/11\nSleepy Hallow - Still Sleep? (Deluxe) - 25/25\nSumo Cyco - Initiation (Deluxe) - 15/15\nTech N9ne - ASIN9NE - 18/18\nThe Alchemist - This Thing of Ours, Vol. 2 - EP - 5/5\nThe Record Company - Play Loud - 4/12\nThe Wild Feathers - Alvarado - 12/12\nTrivium - In the Court of the Dragon - 10/10\nUPSAHL - Lady Jesus - 10/10\nThe Warning - MAYDAY - 6/6\nVanilla Ninja - Encore - 14/18\nVarious Artists - Broken Hearts & Dirty Windows: Songs of John Prine, Vol. 2 - 5/12\nWe Are Scientists - Huffy - 10/10\n\n10/11\nJames Blake - Friends That Break Your Heart (Bonus) - 13/13\n\n10/12\nENHYPEN - DIMENSION: DILEMMA - 8/8\nMAJ - No One Cares 2 - 10/10\nSmile Empty Soul - Black Pilled - 11/11\nTRI.BE - VENI VIDI VINCI - 7/7\n\n10/13\nBIGBABYGUCCI - Human - 20/20\nDuwap Kaine - HardHead - 11/11\nGRACEY - Fragile - EP - 4/4\nSlimelife Shawty - Better Living - 14/14\nVoda Fuji - Tourist - EP - 6/6\nYogee New Waves - WINDORGAN - 0/12\nちゃんみな (CHANMINA) - ハレンチ (Harenchi) - 16/16\n\n10/14\nLightSkinKeisha - Break the Bank - 8/8\nMar90s - Pray 4 Me 2 - 13/13\nNorah Jones - I Dream of Christmas - 13/13\n\n10/15\nAaron Cole - Two Up Two Down - 14/14\nAnson Seabra - Feeling for My Life - 9/9\nAvenue Beat - \u200bthe debut farewell album  - 12/12\nBaker Boy - Gela - 13/14\nBLACKSTARKIDS - Puppies Forever - 12/12\nBONES & cat soup - ForbiddenImage - 13/13\nCassadee Pope - Thrive - 13/13\nCharlotte OC - Here Comes Trouble - 12/12\nCheat Codes - HELLRAISERS, Part 2 - 13/13\nChelsea Cutler - When I Close My Eyes - 13/13\nCity Morgue - CITY MORGUE VOL 3: BOTTOM OF THE BARREL - 13/13\nColdplay - Music of the Spheres - 12/12\nColdplay - Music of the Spheres (Japan Exclusive) - 14/14\nDax - Pain Paints Paintings - 16/16\nDOM KENNEDY - From the Westside with Love 3 - 11/15\nEgo Ella May - FIELDNOTES - EP - 4/4\nEllise - Letting the Wolf In - 8/8\nFINNEAS - Optimist - 13/13\nGemini Syndrome - 3rd Degree (The Raising) - 13/13\nGeorge Cosby - We Stand Alone - EP - 5/5\nGrafh & DJ Shay - Stop Calling Art Content - 1/13\nGucci Mane - So Icy Boyz - 14/17\nHayden Thorpe - Moondust for My Diamond - 12/12\nICE NINE KILLS - Welcome to Horrorwood: The Silver Scream 2 - 14/14\nJazmine Flowers - adulting - EP - 5/5\nJESSIA - How Are You? - EP - 6/6\nJohn Carpenter, Cody Carpenter & Daniel Davies - Halloween Kills (Original Motion Picture Soundtrack) - 20/20\nJoy Crookes - Skin - 13/13\nJP Cooper - She - 12/24\nKacy Hill - Simple, Sweet and Smiling - 11/11\nKaren Harding - Sweet Vibrations - EP - 8/8\nKelly Clarkson - When Christmas Comes Around... - 15/15\nKIRBY - Sis, He Wasn't the One - EP - 10/10\nLutharo - Hiraeth - 10/10\nLast Days of Eden - Butterflies - 6/14\nLoski - Censored - 10/10\nLouis the Child - Euphoria - EP - 6/6\nMac Miller - Faces (Re-Release) - 25/25\nMac Powell - New Creation - 3/10\nMichelle Branch - The Spirit Room (20th Anniversary Edition) - 13/13\nMyra - Bokser & Ballerina - 12/12\nOffset Jim - Rich Off the Pack - 3/9\nPayroll Giovanni - Giovanni’s Way - 3/18\nPinkPantheress - to hell with it - 10/10\nPurple Disco Machine - Exotica - 14/14\nQveen Herby - HALLOQVEEN - EP - 7/7\nRemi Wolf - Juno - 13/13\nRyan Hurd - Pelago - 15/15\nSantana - Blessings and Miracles - 10/15\nSkillibeng - Crocodile Teeth - 3/12\nThe Agonist - Days Before the World Wept - EP - 5/5\nThe Beatles - Let It Be (Super Deluxe) - 39/57\nToby Keith - Peso in My Pocket - 10/10\nTom Morello - The Atlas Underground Fire - 11/12\nTone Stith - Still FWM - 7/7\nTwelve Foot Ninja - Vengeance - 10/10\nVarious Artists - Pokémon 25: The Album - 14/14\nWe Are Messengers - Wholehearted - 12/12\nWelcome Records - Little Comp of Horrors, Vol. 3 - 0/13\nWilderado - Wilderado - 10/10\nwolfacejoeyy - home - EP - 6/6\nYoung Thug - Punk - 20/20\nZac Brown Band - The Comeback - 15/15\nZack Fox - shut the fuck up talking to me - 9/9\n\n10/18\nLEE JINHYUK - Ctrl+V - 6/6\nMaxo Kream - WEIGHT OF THE WORLD - 16/16\nTisaKorean - pResiLLy - 0/9\n\n10/19\nMatt Citron - New World Disorder - 1/5\nNam Woo Hyun - With - 6/6\n\n10/20\nCL - ALPHA - 11/11\nCNBLUE - WANTED - 5/5\nNami - DEMOS FOR DRAKE - 6/6\nTyFontaine - Ascension (Deluxe) / Virtual World 2 - 25/25\n\n10/21\nIGNEA and ERSEDU - BESTIA - 6/6\nKINGDOM - History of Kingdom: Part III. Ivan - 7/7\nMoonroof - Dream State - 7/7\nRÜFÜS DU SOL - Surrender - 11/11\nTisaKorean - mr.siLLyfLow - 4/13\n\n10/22\n347aidan - CHASING HARMONY - 5/5\nAgnes - Magic Still Exists - 11/11\nBIA - FOR CERTAIN (Deluxe) - 14/14\nBiffy Clyro - The Myth of the Happily Ever After - 11/11\nBig Zuu - Navigate - 6/12\nBKTHERULA - LOVE BLACK - 16/16\nBrett Eldredge - Mr. Christmas - 10/11\nCatalyst Crime - Catalyst Crime - 1/12\nCirca Survive - A Dream About Love - EP - 6/6\nComethazine - Comethazine The Album - 18/18\nCradle of Filth - Existence is Futile - 14/14\nCreed Fisher - Whiskey and the Dog - 0/14\nCulture Jam - Kawhi Leonard Presents: Culture Jam (Vol. 1) - 7/7\nDemarco - Melody - 9/16\nDillon Carmichael - Son Of A - 6/14\nDon Q - Double Or Nothing - 1/10\nDream Theater - A View from the Top of the World - 7/7\nDua Saleh - CROSSOVER - EP - 7/7\nDuran Duran - FUTURE PAST - 12/12\nDVBBS - SLEEP - 15/15\nelijah\u200b woods - Look What I Made - EP\u200b - 6/6\nElton John - The Lockdown Sessions - 16/16\nEvery Time I Die - Radical - 16/16\nFelly - Young Fel 2 - 13/14\nFetty Wap - The Butterfly Effect - 17/17\n\u200bflora cash - Our Generation - 14/14\nFuel - ÅNOMÅLY - 5/11\nGabrielle - KLIPP MEG I TI OG LIM MEG SAMMEN - 12/12\nGIRLI - Damsel in Distress - EP - 5/5\nHelado Negro - Far In - 14/15\nHey Violet - Deep End - EP - 3/3\nHONNE - LET'S JUST SAY THE WORLD ENDED A WEEK FROM NOW, WHAT WOULD YOU DO? - 11/11\nHunter Hayes - Wild Blue (Complete) - 13/16\nILLENIUM - Fallen Embers (Deluxe) - 19/19\nJames Ivy - Good Grief! - 5/5\nJessie James Decker - The Woman I've Become - 7/7\nJPEGMAFIA - LP! - 18/18\nJPEGMAFIA - LP! (OFFLINE) - 20/20\nLady A - What a Song Can Do - 14/14\nLana Del Rey - Blue Banisters - 15/15\nLil Wop - Zero Gravity - 3/5\nLuh Soldier & Zaytoven - Keys To the Streets - 0/10\nMajid Jordan - Wildest Dreams - 11/11\nMazey Haze - Always Dancing - EP - 5/5\nMimi Webb - Seven Shades of Heartbreak - 7/7\nMoneybagg Yo - A Gangsta's Pain (Reloaded) - 29/29\nMoyka - The Revelations of Love - 10/10\nMy Morning Jacket - My Morning Jacket - 11/11\nNorthSideBenji - The Extravagant Collection - 13/13\nOkay Kaya - The Incompatible Okay Kaya - 9/9\nOscar and the Wolf - The Shimmer - 11/11\nParis Shadows - Two Nights In Paris - 12/12\nParquet Courts - Sympathy for Life - 11/11\nPouya - Blood Was Never Thick as Water - 11/11\nRead Southall Band - For the Birds - 10/12\nRitt Momney - Sunny Boy - 11/11\nROSIE - 20mg of Happiness - 7/7\nSASSY 009 - Heart Ego - 4/8\nSelf Esteem - Prioritise Pleasure - 13/13\nSEVENTEEN - Attacca - 7/7\nSTARSET - HORIZONS - 16/16\nSurf - Archangel - 13/13\nTenille Arts - Girl to Girl - 13/13\nWale - Folarin II - 15/15\nWet - Letter Blue - 10/10\nBig Baby Tape & kizaru — «BANDANA I» — 14/14\n\n10/24\nLil Boom - end. END. end. (the collection) - 6/6\n\n10/25\nLil Tra$h - Meme King - 11/11\nNCT 127 - Favorite - 14/14\n\n10/26\nDreamNote - Dreams Alive - 4/4\nEPEX - BIPOLAR Pt.2 : 사라의 서: Prelude of Love - 4/4\nJoey Trap - ALIEN - 10/10\n\n10/27\nAILEE - AMY - 12/12\nJordan Hawkins - Heart Won’t Stop - 7/7\nLOONA - Not Friends Special Edition - 5/5\nSahBabii - Do It for Demon - 20/20\nVarious Artists - 스트릿 우먼 파이터 (Street Woman Fighter) Special - 4/4\n\n10/28\nBLOO - MOON AND BACK - 8/8\nBuju - Sorry I'm Late - 7/7\nDC2Trill - Drank Babies 3 - 3/12\nKassy - 옛이야기 (Old story) - 4/4\nNamasenda - Unlimited Ammo - 13/13\nPARK JI HOON - HOT&COLD - 6/6\n\n10/29\nA$AP Rocky - LIVE.LOVE.A$AP (Re-Release) - 15/15\nAd Infinitum - Chapter II (Legacy) - 15/15\nAlina Baraz - Moongate - EP - 4/4\nAmaal - Milly - 7/7\nArchspire - Bleed the Future - 8/8\nAugustine - Weeks Above the Earth - 11/11\nAViVA - VOLUME II - 11/11\nBabyTron - Bin Reaper 2 - 6/27\nBad Wolves - Dear Monsters - 12/12\nBe'lakor - Coherence - 8/8\nBeast in Black - Dark Connection - 13/13\nBig Sean & Hit-Boy - What You Expect - EP - 6/6\nBlack Veil Brides - The Phantom Tomorrow - 12/12\nCHVRCHES - Screen Violence: Director’s Cut - 13/13\n\u200bcktrl - \u200bzero - EP - 3/4\nCurren$y & Harry Fraud - Regatta - 3/8\nDami Im - MY REALITY - 10/10\nDead or Alive - Fan the Flame, Pt. 2 (The Resurrection) - 10/20\nDJ Abilities - Phonograph Phoenix - 1/8\nDoodie Lo - Big Doodie Lo (Deluxe) - 16/21\nEd Sheeran - Equals - 14/14\nEmily Scott Robinson - American Siren - 10/10\nFreaky Boiz - Freak Show - 0/11\nGhostface Killah - Ironman (25th Anniversary) - 17/17\nHayes Carll - You Get It All - 1/11\nIDK - USEE4YOURSELF (Deluxe) - 26/26\nJEON SOMI - XOXO - 8/8\nJerry Cantrell - Brighten - 9/9\nJoe Bonamassa - Time Clocks - 10/10\nJohn 5 & the Creatures - Sinner - 0/10\nJohnny Cash - Bear's Sonic Journals: Live at the Carousel Ballroom, 4/24/1968 - 0/28\nJoni Mitchell - Joni Mitchell Archives, Vol. 2: The Reprise Years (1968-1971) - 0/119\nKaty B - Peace and Offerings - 2/8\nKevin Ross - Drive 2 - 2/10\nKxllswxtch - DISORDER - 11/12\nLily Rose - Stronger Than I Am (Repack) - 10/10\nLuke Wild - Shoebox - EP - 2/6\nMastodon - Hushed and Grim - 15/15\nMaude Latour - Strangers Forever - EP - 6/6\nMaximillian - Too Young - 2/11\nMegan Thee Stallion - Something for Thee Hotties - 21/21\nMeghan Trainor - A Very Trainor Christmas (Deluxe) - 21/21\nMick Jenkins - Elephant in the Room - 12/12\nMon Laferte - 1940 Carmen - 10/10\nMorgan Evans - The Country and the Coast, Side A - EP - 2/6\nNICKI NICOLE - Parte de Mí - 16/16\nOf Monsters and Men - My Head is an Animal (10th Anniversary Edition) - 14/14\nOla Runt - Henchmen Crime Family: Life of Sin - 1/13\nPlush - Plush - 13/13\nPentatonix - Evergreen - 14/14\nPixey - Sunshine State - EP - 6/6\nR.E.M. - New Adventures in Hi-Fi [25th Anniversary Deluxe Edition] - 19/27\nRansom & Rome Streetz - Coup De Grâce - 9/11\nREASON - No More, No Less: Demo 1 - 3/3\nROMderful - PLEASE RECONNECT CONTROLLER - 0/15\nscarlxrd - DeadRising - 21/21\nSematary - Screaming Forest - 10/10\nTheCrewDown - ChanceLOR - 0/11\nThe War on Drugs - I Don't Live Here Anymore - 10/10\nTom Gregory - Things I Can't Say Out Loud - 12/12\nTori Amos - Ocean to Ocean - 11/11\nUnoTheActivist - Unoverse 3 - 14/14\nVarious Artists - The Harder They Fall (Original Motion Picture Soundtrack) - 6/14\nWar of Ages - Rhema - EP - 4/4\nWhitechapel - Kin - 11/11\nWolf Alice - Blue Weekend (Tour Deluxe) - 16/16\n\n10/30\nSniper Gang - Sniper Gang Presents: Nightmare Babies - 3/11\n\n10/31\nBryson Tiller - Killer Instinct 2: The Nightmare Before - 13/13\nCHXPO - HALLOWEEN KING - 0/11\nLimp Bizkit - Still Sucks - 12/12""}"
Taylor Swift,I Knew You Were Trouble.,I Knew You Were Trouble.,4GzDUKkd1RwAtYZMMUBM3W,0.599,0.474,6,-6.794,0.0379,0.00532,2.84e-06,0.0216,0.649,154.182,222733,4,Angry,"{'title': 'Bart Baker – I Knew You Were Trouble (Parody) Lyrics', 'lyrics': '[Taylor:]\nOnce upon a time, before I was insane\nI dated this Disney guy, Joe Jonas was his name\nBut he broke up with me\n[Joe:]\nYou\'re just way too creepy, plus I found someone else, his name\'s Mickey. (HO HO)\n[Taylor:]\nSo, I wrote a song about his stupid ass\nThen, found this guy named John\nBut that was over fast\nIf you don\'t marry me, I will pull out your teeth!\n[John:]\nYou\'re totally crazy\n[Taylor:]\nNo!\n[John:]\nYes!\n[Taylor:]\nNo!\n[John:]\nYes!\n[Taylor:]\nMaybe...\nHe hit me with his guitar, and he said that ""we are through.""\nJust you wait, until I write a song about you!\nThen, I met that Jake Gyllenhal dick\nAnd was obsessed right away!\n[Jake:]\nYou\'ve sent me 1,000 messages!\nAnd that\'s just from today!!\n[Taylor:]\nOh, that\'s because I\'m having your baby!\n[Jake:]\nWhat?! But, you don\'t even put out\n[Taylor:]\nStop questioning me, Jakey\nOr I\'ll punch you 6 feet underground!!!!!!\n[Jake:]\nWHOA! WHOA!\nPsycho, psycho, psycho!\n[Taylor:]\nFine, go! It\'s good material\nNext came Kennedy, I think he was fifteen\nI bought the house next door\nTo watch you constantly, and also to make sure.. You never ever cheat!\n[Connor:]\nOMG! We are done, you are scary!\n[Taylor:]\nHarry was my last, that One Direction freak\nI taped him to my wall, so he could never leave\n[Harry:]\nSomeone call the police!\nYou\'re insane we are through!\n[Taylor:]\nYou\'re just like all the rest!\nWhat did I do to you?!\nSo I used, my stalker app\nTo track down, all of those pricks\nThe next song I write I\'ll use, their blood as my ink! Hey!\n[Jake:]\nHoly crap, that nut job just bursted in!\n[Ex-Boyfriends:]\nAhh!\n[Taylor:]\nWhat the hell is this?\n[Ex-Boyfriends:]\nIt\'s a support group for all the men\nYou wrote songs about, you bitch!\n[Taylor:]\nWhat? I have not written about Harry yet\n[Harry:]\nI am just planning ahead\n[John:]\nWhy are you even here anyway?\n[Taylor:]\nTo finish you all off with my pen!\n[Ex-Boyfriends:]\nNo, no, devil, devil, devil\n[Taylor:]\nOh, oh, It\'s true, I\'m the devil!\n[Doctor:]\nOK! that\'s enough\nYou were right, she\'s nuts\nYou are coming with us\n[Taylor:]\nWait, what?\nGet off of me, I\'m not crazy!!\nAH!\n[Ex-Boyfriends:]\nIt worked!\nThis was all a trick, we knew you would come\nSo, we hired this doctor\n[Doctor:]\nYou\'re going to an insane asylum\nBased on the behavior I observed\n[Taylor:]\nOh, oh, Let me go, you assholes!\n[Assholes:]\nNo! No!\n[Doctor:]\nWelcome to your new home\n[Mickey:]\nHaha, so you\'re crazy too, huh?'}"
The Pussycat Dolls,PCD (Revised International Version),Don't Cha,24kGngQeXHt0uhffKpq0zj,0.875,0.631,1,-3.475,0.099,0.00542,2.54e-06,0.127,0.549,120.002,272080,4,Angry,"{'title': ""The Pussycat Dolls & Busta Rhymes – Don't Cha Lyrics"", 'lyrics': ""[Intro: Busta Rhymes & Nicole Scherzinger]\nOkay (Ahh)\nYeah (Ahh)\nOh, we about to get it just a little hot and sweaty in this motherfucker (Ooh, baby)\nLadies, let's go (Uhh)\nSoldiers, let's go (Dolls)\nLet me talk to y'all and just, you know give you a little situation\nListen (Fellas)\nYou see this shit get hot, every time I come through\nWhen I step up in the spot (Are you ready?)\nMake the place sizzle like a summertime cookout\nProwl for the best chick, yes, I'm on the lookout (Let's dance)\nSlow bangin' shorty like a belly dancer wit' it\nSmell good, pretty skin, so gangsta wit' it (Ooh, baby)\nNo tricks, only diamonds under my sleeve\nGimme the number, but make sure you call before you leave\n\n[Verse 1: Nicole Scherzinger]\nI know you like me (I know you like me)\nI know you do (I know you do)\nThat's why whenever I come around, she's all over you\nAnd I know you want it (I know you want it)\nIt's easy to see (It's easy to see)\nAnd in the back of your mind\nI know you should be fuckin' with me\n[Chorus: The Pussycat Dolls]\nDon't cha wish your girlfriend was hot like me?\nDon't cha wish your girlfriend was a freak like me?\nDon't cha? Don't cha?\nDon't cha wish your girlfriend was raw like me?\nDon't cha wish your girlfriend was fun like me?\nDon't cha? (Ah-ah-ah) Don't cha?\n\n[Verse 2: Nicole Scherzinger]\nFight the feeling (Fight the feeling)\nLeave it alone (Leave it alone)\n'Cause if it ain't love\nIt just ain't enough to leave a happy home (Uh-uh, uh-uh)\nLet's keep it friendly (Let's keep it friendly)\nYou have to play fair (You have to play fair, yeah)\nSee, I don't care\nBut I know, she ain't gon' wanna share (Ah, ah-ah)\n\n[Chorus: The Pussycat Dolls & Busta Rhymes]\nDon't cha wish your girlfriend was hot like me? (Oh)\nDon't cha wish your girlfriend was a freak like me? (Like me)\nDon't cha? Don't cha, baby?\nDon't cha? Alright, sing\nDon't cha wish your girlfriend was raw like me? (Raw)\nDon't cha wish your girlfriend was fun like me? (Big fun)\nDon't cha? (Ah-ah-ah) Don't cha?\n(Okay, I see how it's goin' down\nSeem like shorty wanna little ménage pop off or somethin'\nLet's go)\n[Verse 3: Busta Rhymes]\nWell, let me get straight to it\nEvery broad wanna watch a nigga when I come through it\nIt's the God almighty, lookin' all brand new\nIf shorty wanna jump in my Aston Vanquish\nLookin' at me all like she really wanna do it\nTryna put it on me 'til my balls black and blueish\nYou wanna play with a player, girl, then play on\nStrip out the Chanel and leave the lingerie on (Ha)\nWatch me and I'ma watch you at the same time\nLookin' at you wanna break my back\nYou're the very reason why I keep a pack of the Magnum\nAnd with the wagon, hit you in the back of the Magnum\nFor the record, don't think it was something you did\nShorty all on me 'cause it's hard to resist the kid\nI got a idea that's dope for y'all\nAs y'all could get cold so I could hit the both of y'all\n\n[Verse 4: Nicole Scherzinger]\nSee, I know she loves ya (I know she loves ya)\nI understand (I understand, yeah)\nI'd probably be just as crazy about you if you were my own man\nMaybe next lifetime (Maybe next lifetime)\nPossibly (Possibly)\nUntil then, old friend, your secret is safe with me (Shh, hot)\n[Chorus: The Pussycat Dolls]\nDon't cha wish your girlfriend was hot like me? (Oh)\nDon't cha wish your girlfriend was a freak like me? (Like me)\nDon't cha? Don't cha, baby?\nDon't cha? Alright, sing\nDon't cha wish your girlfriend was raw like me? (Raw)\nDon't cha wish your girlfriend was fun like me? (Big fun)\nDon't cha? (Ah-ah-ah) Don't cha?""}"
Avril Lavigne,The Best Damn Thing,Girlfriend,5HbCnVLXRyZVxnreOPgJCK,0.56,0.959,7,-2.433,0.102,0.000738,0.000206,0.209,0.67,163.983,216600,4,Angry,"{'title': 'Avril Lavigne – Girlfriend Lyrics', 'lyrics': ""[Chorus]\nHey, hey, you, you, I don't like your girlfriend\nNo way, no way, I think you need a new one\nHey, hey, you, you, I could be your girlfriend\nHey, hey, you, you, I know that you like me\nNo way, no way, you know it's not a secret\nHey, hey, you, you, I want to be your girlfriend\n\n[Verse 1]\nYou're so fine, I want you mine, you're so delicious\nI think about you all the time, you're so addictive\nDon't you know what I can do to make you feel alright?\n(Alright, alright, alright, alright)\nDon't pretend, I think you know I'm damn precious\nAnd hell yeah, I'm the motherfuckin' princess\nI can tell you like me too and you know I'm right\n(I'm right, I'm right, I'm right, I'm right)\n\n[Pre-Chorus]\nShe's like so whatever\nYou could do so much better\nI think we should get together now\nAnd that's what everyone's talkin' about\n\n[Chorus]\nHey, hey, you, you, I don't like your girlfriend\nNo way, no way, I think you need a new one\nHey, hey, you, you, I could be your girlfriend\nHey, hey, you, you, I know that you like me\nNo way, no way, you know it's not a secret\nHey, hey, you, you, I want to be your girlfriend\n[Verse 2]\nI can see the way, I see the way you look at me\nAnd even when you look away, I know you think of me\nI know you talk about me all the time again and again\n(Again, again, again)\n(So come over here) So come over here and tell me what I wanna hear\nBetter yet, make your girlfriend disappear\nI don't wanna hear you say her name ever again\n(And again and again and again)\n\n[Pre-Chorus]\n'Cause she's like so whatever\nAnd you could do so much better\nI think we should get together now\nAnd that’s what everyone’s talkin' about\n\n[Chorus]\nHey, hey, you, you, I don't like your girlfriend\nNo way, no way, I think you need a new one\nHey, hey, you, you, I could be your girlfriend\nHey, hey, you, you, I know that you like me\nNo way, no way, you know it's not a secret\nHey, hey, you, you, I want to be your girlfriend\n\n[Bridge]\n(Uh) In a second, you'll be wrapped around my finger\n'Cause I can, 'cause I can do it better\nThere's no other, so when's it gonna sink in?\nShe's so stupid, what the hell were you thinkin'?\n(Uh) In a second, you'll be wrapped around my finger\n'Cause I can, 'cause I can do it better\nThere's no other, so when's it gonna sink in?\nShe's so stupid, what the hell were you thinkin'?\n[Chorus]\nHey, hey, you, you (Hey, hey), I don't like your girlfriend\nNo way, no way (No way), I think you need a new one\nHey, hey, you, you (Hey, hey), I could be your girlfriend\n(No way, no way)\nHey, hey, you, you (Hey, hey), I know that you like me\nNo way, no way (No way), you know it's not a secret\nHey, hey, you, you (Hey, hey), I want to be your girlfriend\n(No way, no way)\n\n[Chorus]\nHey, hey, you, you, I don’t like your girlfriend\nNo way, no way, I think you need a new one\nHey, hey, you, you, I could be your girlfriend\n(No way, no way)\nHey, hey, you, you (Hey, hey), I know that you like me\nNo way, no way (No way), you know it's not a secret\nHey, hey, you, you (Hey, hey), I want to be your girlfriend\nNo way, no way, hey, hey!""}"
