artist,album,track,track_id,danceability,energy,key,loudness,speechiness,acousticness,instrumentalness,liveness,valence,tempo,duration_ms,time_signature,mood,lyrics
Kanye West,Yeezus,New Slaves,4cAgkb0ifwn0FSHGXnr4F6,0.506,0.59,1,-4.322,0.076,0.165,1.09e-05,0.096,0.359,141.099,256093,4,Angry,"{'title': 'Kanye West – New Slaves Lyrics', 'lyrics': '[Intro: Swizz Beatz]\nChill, chill, chill, chill, chill, chill\nChill, chill, chill, chill, chill, chill\n\n[Verse 1: Kanye West]\nMy mama was raised in the era when\nClean water was only served to the fairer skin\nDoin\' clothes, you woulda thought I had help\nBut they wasn\'t satisfied unless I picked the cotton myself\nYou see it\'s broke nigga racism\nThat\'s that ""Don\'t touch anything in the store""\nAnd it\'s rich nigga racism\nThat\'s that ""Come in, please buy more""\n""What you want, a Bentley? Fur coat? A diamond chain?\nAll you blacks want all the same things""\nUsed to only be niggas, now everybody playin\'\nSpendin\' everything on Alexander Wang\nNew slaves\n\n[Refrain: Kanye West]\nYou see it\'s leaders and it\'s followers\nBut I\'d rather be a dick than a swallower\nYou see it\'s leaders and it\'s followers\nBut I\'d rather be a dick than a swallower\n\n[Verse 2: Kanye West]\nI throw these Maybach keys, I wear my heart on the sleeve\nI know that we the new slaves, I see the blood on the leaves\nI see the blood on the leaves, I see the blood on the leaves\nI know that we the new slaves, I see the blood on the leaves\nThey throwin\' hate at me, want me to stay at ease\nFuck you and your corporation, y\'all niggas can\'t control me\nI know that we the new slaves, I know that we the new slaves\nI\'m \'bout to wild the fuck out, I\'m goin\' Bobby Boucher\nI know that pussy ain\'t free, you niggas pussy, ain\'t me\nY\'all throwin\' contracts at me, you know that niggas can\'t read\nThrow on some Maybach keys, fuck it, c\'est la vie\nI know that we the new slaves, y\'all niggas can\'t fuck with me\nY\'all niggas can\'t fuck with Ye, y\'all niggas can\'t fuck with Ye\nI\'ll move my family out the country so you can\'t see where I stay\nSo go and grab the reporters, so I can smash their recorders\nSee, they\'ll confuse us with some bullshit like the New World Order\nMeanwhile the DEA teamed up with the CCA\nThey tryna lock niggas up, they tryna make new slaves\nSee, that\'s that privately owned prison, get your peace today\nThey prolly all in the Hamptons, braggin\' \'bout what they made\nFuck you and your Hampton house, I\'ll fuck your Hampton spouse\nCame on her Hampton blouse and in her Hampton mouth\nY\'all \'bout to turn shit up, I\'m \'bout to tear shit down\nI\'m \'bout to air shit out, now what the fuck they gon\' say now?\n[Bridge]\nNothing bad, nothing bad, noth-\nNoth-Noth-, -ing bad, noth-noth-\nBad, nothing bad, nothing\n\n[Outro: Kanye West, Frank Ocean & Kóbor János]\nI won\'t end this high, not this time again\nSo long, so long, so long, you cannot survive\nAnd I\'m not dyin\', and I can\'t lose\nI can\'t lose, no, I can\'t lose\n\'Cause I can\'t leave it to you\nSo let\'s get too high, get too high again\nToo high again, too high, ooh hoo-hoo-hoo, woo\nYeah, h-h-h-high, h-high-high, high-high high-igh-high-high\nH-high-igh, yeah, high, high-igh\nEgyszer a Nap úgy elfáradt (mhm-igh)\nElaludt mély zöld tó ölén\nAz embereknek fájt a sötét\nŐ megsajnált, eljött közénk\n\n[Produced by Che Pope, Sham Joseph, Ben Bronfman, Noah Goldstein, Travis Scott, Mike Dean & Kanye West]'}"
JAY-Z,Watch The Throne (Deluxe),No Church In The Wild,3Osd3Yf8K73aj4ySn6LrvK,0.654,0.75,8,-7.509,0.105,0.246,0.0178,0.167,0.557,92.78,272507,4,Angry,"{'title': 'JAY-Z & Kanye West – No Church in the Wild Lyrics', 'lyrics': '[Produced By 88 Keys, Kanye West & Mike Dean]\n\n[Chorus: Frank Ocean]\nHuman beings in a mob\nWhat\'s a mob to a king?\nWhat\'s a king to a god?\nWhat\'s a god to a non-believer\nWho don\'t believe in anything?\nWill he make it out alive?\nAlright, alright\nNo church in the wild\n\n[Verse 1: Jay Z]\nTears on the mausoleum floor\nBlood stains the Colosseum doors\nLies on the lips of a priest\nThanksgiving disguised as a feast\nRolling in the Rolls-Royce Corniche\nOnly the doctors got this, I\'m hiding from police\nCocaine seats\nAll white like I got the whole thing bleached\nDrug dealer chic\nI\'m wondering if a thug\'s prayers reach\nIs Pius pious \'cause God loves pious?\nSocrates asked whose bias do y\'all seek?\nAll for Plato, screech\nI\'m out here balling, I know y\'all hear my sneaks\nJesus was a carpenter, Yeezy laid beats\nHova flow the Holy Ghost, get the hell up out your seats\nPreach\n[Chorus: Frank Ocean]\nHuman beings in a mob\nWhat\'s a mob to a king?\nWhat\'s a king to a god?\nWhat\'s a god to a non-believer\nWho don\'t believe in anything?\nWill he make it out alive?\nAlright, alright\nNo church in the wild\n\n[Bridge: The-Dream]\nI live by you, desire\nI stand by you, walk through the fire\nYour love is my scripture\nLet me in through your encryption\nYeah, yeah\n\n[Verse 2: Kanye West]\nCoke on her Black skin made it stripe like a zebra\nI call that jungle fever\nYou will not control the threesome\nJust roll the weed up until I get me some\nWe formed a new religion\nNo sins as long as there\'s permission\nAnd deception is the only felony\nSo never fuck nobody without telling me\nSunglasses and Advil\nLast night was mad real\nSun coming up, 5 a.m.\nI wonder if they got cabs still\nThinking \'bout the girl in all leopard\nWho was rubbing the wood like Kiki Shepard\nTwo tattoos, one read, ""No apologies""\nThe other said, ""Love is cursed by monogamy""\nThat\'s something that the pastor don\'t preach\nThat\'s something that a teacher can\'t teach\nWhen we die, the money, we can\'t keep\nBut we\'ll probably spend it all \'cause the pain ain\'t cheap\nPreach\n[Chorus: Frank Ocean]\nHuman beings in a mob\nWhat\'s a mob to a king?\nWhat\'s a king to a god?\nWhat\'s a god to a non-believer\nWho don\'t believe in anything?\nWill he make it out alive?\nAlright, alright\nNo church in the wild\n\n[Outro: Frank Ocean]\nNo church in the wild\nNo church in the wild\nNo church in the wild'}"
David Banner,The Greatest Story Ever Told,9MM,2K6FYgz38Kzih6BGJzfD0H,0.772,0.713,6,-5.267,0.302,0.00773,0.0,0.382,0.579,83.022,247453,4,Angry,"{'title': 'David Banner – 9MM (Speaker) Lyrics', 'lyrics': ""[Intro: Akon, Lil Wayne, & Snoop Dogg]\nKonvict, Konvict\nSnoop Dogg, Dogg (alright)\nKonvict Music\nAkon and David Banner\nIf niggas (get it) wanna ride tonight\nBest believe we 'bout to ride tonight, yeah (Ha-haa)\nRide\nYoung Money, Cash Money\nC'mon Akon, let's go\n\n[Chorus: Akon & Lil Wayne]\nI got a 9 millimeter (ya dig?)\nReady to go off any minute so you feel it (bop-bop)\nBecause of the law, I had to conceal it\nIf you fuck around you gon' make me reveal it, aye (bop-bop)\nI got a 9 millimeter (ya dig?)\nReady to go off any minute so you feel it (bop-bop)\nBecause of the law, I had to conceal it (I go by Wheezy, baby)\nIf you fuck around you gon' make me reveal it (Tell y’all something bout me mane, ahem)\n\n[Verse 1: Lil Wayne]\nTool on deck, why would I lie?\nNigga, you a pussy, hope you got nine lives\nI can hit a nigga with the 9 nine times\nCountry-ass boy, country like LeAnn Rimes\nMississippi D-Banner and Lil Weezyana\nEverybody got tools, so you will need a hammer\nI'm a pill-poppin' animal, syrup-sippin' nigga\nI'm so high you couldn't reach me with a fuckin' antenna\nYou fuckin' with this man, you can be this man's dinner\nThe 9 give me brains, but the AK add liver\nThe rapper is insane, flowin' like a mad river\nMake yo' ass quiver like you naked at winter\nHollygrove honcho, hard time giver\nI'm a shark in the water, you just Long John Silver\nI got a girl, you wanna meet her?\nHer name is 9 millimeter\n[Chorus: Akon & David Banner]\nI got a 9 millimeter\nReady to go off any minute so you feel it\nBecause of the law, I had to conceal it\nIf you fuck around you gon' make me reveal it\nI got a 9 millimeter (yeah)\nReady to go off any minute so you feel it (yeah)\nBecause of the law, I had to conceal it (yeah)\nIf you fuck around you gon' make me reveal it\n\n[Verse 2: David Banner]\nIf I got nine slugs, nine bullets gon' fly\nIf I got a red beam, nine people gon' die\nNine mamas gon' cry, nine spirits in the sky\nNine preachers preachin' nine sermons, tellin' nine lies\n'Cause each and every one of y'all nine niggas wasn't shit\nI would've rather kept the nine Ruger's in the Ruger clip\nThe index finger slipped, the nine let nine spit\nI lick 'em all like eighteen tits on nine chicks\nI'm a suicide risk, nine slits on each wrist\nIf I die nine times the next go-around's a bitch\nAnd if I come back I'll throw 99 shows\nAnd shove nine inches of dick in 99 hoes yall (Yeah)\n\n[Chorus: Akon]\nI got a 9 millimeter\nReady to go off any minute so you feel it\nBecause of the law, I had to conceal it\nIf you fuck around you gon' make me reveal it\nI got a 9 millimeter\nReady to go off any minute so you feel it\nBecause of the law, I had to conceal it\nIf you fuck around you gon' make me reveal it\n[Verse 3: Snoop Dogg]\nI'm a West Coast original, black John Wayne\nNigga, where we from we like to pop that thang\nYou better stop that, mang\nFat mouth to Dogg and I'ma pop-pop-bang\nPigs wanna bust me, hoes wanna suck me\nNiggas wanna touch me, none of that, trust me\nI'm too slick, too sly, never snitch, I let it ride\nI set aside all my feelings when I'm killin' like a villain\nMove quick like a cheetah, I'm a killa, I ain't here to lock up\nI flash the heater, then lock yo' whole block up\nDip-dop-deeter Banner, turn the beat up!\nIlla-fo-reala my nilla deal another card\nYou niggas always actin' hard\nI keep a 9 millimeter in my waist and got two more in the car\nYeah, you're all about to get it\nSo quit it, tryin' to conceal it\nYou'll fuck around and make me reveal it, so kill it skillet\n\n[Chorus: Akon]\nI got a 9 millimeter\nReady to go off any minute so you feel it\nBecause of the law, I had to conceal it\nIf you fuck around you gon' make me reveal it\nI got a 9 millimeter\nReady to go off any minute so you feel it\nBecause of the law, I had to conceal it\nIf you fuck around you gon' make me reveal it""}"
Waka Flocka Flame,Flockaveli,Hard in Da Paint,3XQY8kDjI8LARMIC9xkxQk,0.611,0.66,11,-5.883,0.0839,0.198,0.0,0.365,0.583,71.544,246387,4,Angry,"{'title': 'Waka Flocka Flame – Hard in da Paint Lyrics', 'lyrics': '[Intro]\nLex Luger\nThat nigga Lex Luger\nFlocka!\n\n[Chorus]\nI go hard in the motherfucking paint, nigga\nLeave you stinking, nigga, what the fuck you thinking, nigga?\nI won\'t die for this shit or what the fuck I say\nFront yard, broad day with the SK\nSee Gucci, that\'s my motherfucking nigga\nI hang in the \'Dale with them Hit Squad killers\nWaka Flocka Flame, one hood-ass nigga\nRiding real slow, bending corners, my nigga (Flocka!)\n\n[Verse 1]\nGot a main bitch (And?) got a mistress (What else?)\nA couple girlfriends, I\'m so hood-rich\nKeep my dick hard (Yeah) and keep me smoking\nYou\'ll get bills free, shawty, no joking (Real talk)\nAnd what I stand for? (Flocka!) Brick Squad (Brick Squad)\nI\'ma die for this shawty, man, I swear to God\nIn the trap with some killers and some hood niggas\nWhere you at? Where you trap? You ain\'t hood, nigga (Bow!)\nKeep this shit 300, put that shit on my hood (Flocka)\nCrips fucking with me, G\'s and the Vice Lords (Brrrrrrr)\nEsé and amigos freestyle off the dome\nBrick Squad, Waka Flocka Flame is fucking home (Flocka!)\n\n[Chorus]\nI go hard in the motherfucking paint, nigga\nLeave you stinking, nigga, what the fuck you thinking, nigga?\nI won\'t die for this shit or what the fuck I say (Brick Squad)\nFront yard, broad day with the SK\nSee, Gucci, that\'s my motherfucking nigga\nI hang in the \'Dale with them Hit Squad killers\nWaka Flocka Flame, one hood-ass nigga\nRiding real slow, bending corners, my nigga\n\n[Verse 2]\nWhat\'s up, pussy nigga? (What\'s up?)\nWhat\'s up, punk nigga? (What\'s up?)\nThey got on that nigga\nMake your momma\'s momma miss you\nHope you got your killers with you\nHope you got your niggas with you\nHope your goons riding with you\nThey gon\' fucking miss you, nigga\nNigga with a attitude like Eaze and Cube\nWhen my little brother died, I said: ""Fuck school!""\nI picked the burner up, then I grabbed some marijuana\nTwo years later, screaming: ""Now I\'m here, your honor!""\nGlock 9, the SK, if you want the beef\nShawty, point blank range, I\'ll put your ass to sleep\nShawty, talk is cheap, so watch what you say\nBroad day in the air like this shit legal (Flocka!)\n\n[Chorus]\nI go hard in the motherfucking paint, nigga\nLeave you stinking, nigga, what the fuck you thinking, nigga?\nI won\'t die for this shit or what the fuck I say (Brick Squad)\nFront yard, broad day with the SK (Bop-bop-bop-bop-bow!)\nSee Gucci, that\'s my motherfucking nigga\nI hang in the \'Dale with them Hit Squad killers\nWaka Flocka Flame one hood-ass nigga\nRiding real slow, bending corners, my nigga\n\n[Break]\nFlocka, Waka\nWaka, Waka, Waka (Flocka)\nWaka, Waka, Waka (Flocka)\nFlocka, Flocka, Flocka (Waka)\nWaka, Waka, Waka (Flocka)\nWaka Flocka, Flocka, (Waka)\nWaka Flocka Flame, Brick Squad\nYuh, yuh, yuh\nYuh, yuh, Brick Squad\nYuh, yuh, yuh, yuh\nYuh, yuh, Brick Squad\nYuh\n\n[Chorus]\nI go hard in the motherfucking paint, nigga\nLeave you stinking, nigga, what the fuck you thinking, nigga?\nI won\'t die for this shit or what the fuck I say (Brick Squad)\nFront yard, broad day with the SK (Bop-bop-bop-bop-bop-bow!)\nSee Gucci, that\'s my motherfucking nigga\nI hang in the \'Dale with them Hit Squad killers\nWaka Flocka Flame, one hood-ass nigga\nRiding real slow, bending corners, my nigga (Flocka!)'}"
Only The Family,"Lil Durk Presents: Only the Family Involved, Vol. 2",Crazy Story,5i0eJv1DzuyhaYnro4wTKg,0.833,0.496,11,-8.827,0.436,0.00999,1.99e-05,0.126,0.148,156.932,146752,4,Angry,"{'title': 'King Von – Crazy Story Lyrics', 'lyrics': '[Intro]\nAnd I\'ma let that MAC fly just like my nigga Durk (Bow)\nI’ma let this MAC fly with this, hold on\nI said I\'ma let that\u2060—\nAlright, come on (Von), alright (Von)\n\n[Verse]\nGot a drop on this flexin\' nigga, he from Tennessee\nI had a thot, she be with the shit, she told me where he be\nI said for sure, baby let me know if you wanna eat\nShe like, ""Von, you already know, just put your girl on fleek""\nI’m like, ""Cool, I can do that, boo, what you want, some shoes?""\n""Jimmy Choo? With a handbag, too? Red or baby blue?""\nShe get to smilin\', she ain\'t used to this \'cause she ain\'t used to shit\nI\'m just laughin\', coulda been a pimp the way I move my lips\nI be speedin\', coulda been a driver the way I push the whip\nYou a ho, coulda been a bitch the way you throw a fit\nBut fuck that, right back to the script ’cause this a major lick\nHe got bricks, plus his neck is icy and it match his wrist\nNow it’s like six, told her hit his phone, meet her in The Wic\nBut he ain\'t go, but he ain’t that slow, say meet \'em at the store\nI\'m like cool, let \'em front his move, do what he gon’ do\n\'Cause this the plot, put \'em in the pot, let it cook like stew\nI grab my Glock, it been through a lot, but it still shoot like new\nWe at the top, yeah we lost a lot\u200b, but that just how it go\nBut check the score, if y\'all lose one more, that\'s 6-24\nLet me focus, can\'t be zoning out, he pullin\' up now\nHe double parked, he ain\'t getting out, he in that push to start\nThat new Porsche, it\'s built like a horse, colors like the fourth\nHe got a ring, I guess he ain\'t divorced, wife probably a whore\nNow she walk up, she struttin\' her stuff, this bitch thick as fuck\nGot in the truck, kissed him on his lip, he cuppin\' her butt\nNow I sneak up, crouching like a tiger, like Snoop off The Wire\nBlock on fire, so I take precaution, mask on, Michael Myers\nI\'m on his ass, he finna be mad, he gon\' beat her ass\nBut this what happen, I got to the door, I thought I was cappin\'\nI was lacking, \'cause there go the opps, yellin\' out, ""What\'s crackin\'?""\nI\'m like, ""What?"" I\'m like, ""Nigga who?"" I was born to shoot\nI got aim, I\'m like Johnny Dang when it comes\u200b to chains\nSo I rise, hit one in his arm, hit one in his thigh, this no lie\nBitch it\'s do or die, you said you gon\' slide\nYou got some nerve, your shit on the curb, boy we put in work\nFrom 64th, and from 65th, we not from 63rd\n\n[Outro]\nBitch we not from 63rd\nBitch that\'s gang, put in work'}"
Jasiah,Art of War (feat. Denzel Curry & Rico Nasty),Art of War (feat. Denzel Curry & Rico Nasty),75tFBhZ34HNOiPder8VFYt,0.782,0.794,1,-5.789,0.291,0.0416,0.0,0.199,0.755,138.965,186473,4,Angry,"{'title': 'Jasiah – Art of War Lyrics', 'lyrics': ""[Intro: Denzel Curry & Jasiah]\nYo, this the type of shit to make you curb stomp a newborn baby\nGoddamn, Jasiah, you on this bih like a crazy washing machine (Yuh, ayy, ayy)\nGoddamn (What? What? What? Yuh)\nWhen the beat gon' drop?\n\n[Chorus: Jasiah]\nThis a art of war, all fair in the hailstorm (Yeah, yeah)\nGet your bag, boy, this that shit that keep your head strong (Boom, boom, boom, boom)\nThis a bad noise, this that shit that keep your head strong (Grra)\nGet you're mad, boy, this that shit that keep your head strong (Pa-pa-pa-pa)\nThis a art of war, all fair in the hailstorm (Yeah, yeah, yeah, yeah)\nGet your bag, boy, this that shit that keep your head strong (Yeah, yeah, yeah, yeah, boom, boom, boom, boom)\nThis a bad noise, this that shit that keep your head strong (Yeah, yeah, yeah, yeah)\nGet you're mad, boy, this that shit that keep your head strong (Yeah, yeah, yeah, yeah)\n\n[Verse 1: Denzel Curry]\nI keep the piece like them peoples in Canada\nThrowin' up guns but I ain't talkin' ugala\nI get the paper, same color arugula\nIf it's a battle, I'm crashing your nebula\nAngel of Death, better known as the messenger\nI kill your favorite rapper and his manager\nI grab the mic and I'll damage ya\nSuper Saiyan stamina, my clip is long like et cetera\nI don't play with niggas like a racist gamer\nIf my name on the feature then you endangered\nGo the hardest in war with my face painted\nSum me up in two words, insane and famous\nBeen a decade and I'm still bangin'\nNiggas throwin' out shots and I'm still aimin'\nAll these rappers that's pussy be false claimin'\nYou a lame nigga in the terms layman\n\n[Pre-Chorus: Jasiah]\nI'm makin' paper, I'm watchin' my neighbors\nI don't know who envy me, envy me\nI keep the cable business, ain't no fable\nI'm close to my friend but closer to my enemies (What?)\nIn my head, bitch, there's like ten of me (Ten of me)\nDon't give a fuck you're not feeling me (Fuck 'em)\nMurkin' you, that's in my fantasy (Blatt)\nKnockin' that boy out his denim jeans (Grra)\n\n[Chorus: Jasiah & Rico Nasty]\nThis a art of war, all fair in the hailstorm (Yeah, yeah)\nGet your bag, boy, this that shit that keep your head strong (Boom, boom, boom, boom)\nThis a bad noise, this that shit that keep your head strong (Grra)\nGet you're mad, boy, this that shit that keep your head strong (Pa-pa-pa-pa)\nThis a art of war, all fair in the hailstorm (Yeah, yeah, yeah, yeah)\nGet your bag, boy, this that shit that keep your head strong (Yeah, yeah, yeah, yeah, boom, boom, boom, boom)\nThis a bad noise, this that shit that keep your head strong (Yeah, yeah, yeah, yeah)\nGet you're mad, boy, this that shit that keep your head strong (Yeah, yeah, yeah, yeah)\n\n[Verse 2: Rico Nasty]\nFuck up a bitch if she was on some petty shit\nBitches be talkin' shit just to be relevant\nI smoke it strong out the pound for the hell of it\nShe got a problem but she ain't addressin' shit\nI pop a one-of-one, I'm always dressin'\nShe clear as fuck, I hope they get the message\nSit down lil' ho, you ain't steppin'\nI'ma do that shit, if you know, it's reckless\nBitch wanna fight me? She don't like me?\nPut that lil' bitch on a mothafuckin' white tee\nI met your wifey, don't gotta wife me\nBut you gotta private jet-fly me\nThink they had dentures, these bitches biting\nWaste of my time, these bitches trifling\nI got my Rollie on, that's perfect timing\nYeah, yeah, lil' bitch (Haha)\n\n[Pre-Chorus: Jasiah]\nI'm makin' paper, I'm watchin' my neighbors\nI don't know who envy me, envy me\nI keep the cable business, ain't no fable\nI'm close to my friend but closer to my enemies (What?)\nIn my head, bitch, there's like ten of me (Ten of me)\nDon't give a fuck you're not feeling me (Fuck 'em)\nMurkin' you, that's in my fantasy (Blatt)\nKnockin' that boy out his denim jeans (Grra)\n\n[Chorus: Jasiah]\nThis a art of war, all fair in the hailstorm\nGet your bag, boy, this that shit that keep your head strong (Boom, boom, boom, boom)\nThis a bad noise, this that shit that keep your head strong (Grra)\nGet you're mad, boy, this that shit that keep your head strong (Pa-pa-pa-pa)\nThis a art of war, all fair in the hailstorm (Yeah, yeah, yeah, yeah)\nGet your bag, boy, this that shit that keep your head strong (Yeah, yeah, yeah, yeah, boom, boom, boom, boom)\nThis a bad noise, this that shit that keep your head strong (Yeah, yeah, yeah, yeah)\nGet you're mad, boy, this that shit that keep your head strong (Yeah, yeah, yeah, yeah)""}"
Bobby Shmurda,Bobby Bitch,Bobby Bitch,6j8lAie0mdUNreql5d5Ejz,0.921,0.525,11,-8.186,0.413,0.0136,0.0,0.313,0.794,130.747,160383,4,Angry,"{'title': 'Bobby Shmurda – Bobby Bitch Lyrics', 'lyrics': ""[Produced By DONDRE]\n\n[Intro]\nBobby, bitch, oh, you ain't know?\nBobby, bitch, Bobby, bitch\n\n[Pre-Chorus]\nBodies bitch, make that body flip\nYou know I don't know karate, bitch\nWe choppin' bodies, bitch\nThey say shootin' is my hobby, bitch\nAnd I'm a problem, kid\nWalk up on him with revolvers\nI ain't with that talkin' shit, shhh...\n\n[Chorus]\nBobby, bitch, oh, yeah, I'm Bobby, bitch\nOh, you ain't know? They call me\nBobby, bitch, oh, yeah, I'm Bobby, bitch\nOh, you ain't know? They call me\nBobby, bitch, oh, yeah, I'm Bobby, bitch\nOh, you ain't know? They call me\nBobby, bitch, Bobby, bitch\n\n[Verse 1]\nAnd I'm down to catch a body, bitches, hit that hommy switch\nAnd I bet that all these hollow tips gon' make his body twitch\nBut if I hit you with the shotty, bitch, I bet that body flip\nRasha caught him with them zombie tips and made his body spin\nYou niggas leap, you feelin' froggy, bitch, my niggas doggies, bitch\nRun up on him with that forty, bitch and go retarded, bitch\nFuck ya feelings, ain't no sorries, bitch, no sorries, bitch\nShoot that nigga and his shorty, bitch, shorty, bitch\n\n[Pre-Chorus]\nBodies bitch, make that body flip\nYou know I don't know karate, bitch\nWe droppin' bodies, bitch\nThey say shootin' is my hobby, bitch\nAnd I'm a problem, kid\nWalk up on him with revolvers\nI ain't with that talkin' shit, shhh\nBodies bitch, make that body flip\nYou know I don't know karate, bitch\nWe droppin' bodies, bitch\nThey say shootin' is my hobby, bitch\nAnd I'm a problem, kid\nWalk up on him with revolvers\nI ain't with that talkin' shit, shhh\n\n[Chorus]\nBobby, bitch, oh, yeah, I'm Bobby, bitch\nOh, you ain't know? They call me\nBobby, bitch, oh, yeah, I'm Bobby, bitch\nOh, you ain't know? They call me\nBobby, bitch, oh, yeah, I'm Bobby, bitch\nOh, you ain't know? They call me\nBobby, bitch, Bobby, bitch\n\n[Verse 2]\nAnd I'm shootin' niggas left to right if they ain't steppin' right\nMy lil nigga keep that weapon tight, he'll leave you dead on sight\nLook lil nigga, we the flexin' type, you feel like flexin', aight?\nPut a bullet in ya head tonight, we leave you dead tonight\nTell that bitch I need some head tonight, I got my cheddar right\nShe said, how much you tryna spend tonight? I got the better price\nI said, I can't even spend the night, I gotta catch a flight\nBut I still touch it down like Jerry Rice, Jerry Rice, touchdown\n\n[Pre-Chorus]\nBodies bitch, make that body flip\nYou know I don't know karate, bitch\nWe droppin' bodies, bitch\nThey say shootin' is my hobby, bitch\nAnd I'm a problem, kid\nWalk up on him with revolvers\nI ain't with that talkin' shit, shhh...\n\n[Outro]\nYou already know who you speakin' to man\nIt's like the Vinny, A.K.A. Trigga the hot nigga, man\nI'll be home soon, man, real, real soon, man\nYo, Bobby Shmurda talk that hot shit, nigga\nAh ah ah, what up, brody?\nAin't shit man you know I'm chillin' how I'm chillin' and all that\nBobby, bitch, Bobby, bitch""}"
