artist,album,track,track_id,danceability,energy,key,loudness,speechiness,acousticness,instrumentalness,liveness,valence,tempo,duration_ms,time_signature,mood,lyrics
FINNEAS,Blood Harmony (Deluxe),Break My Heart Again,7gGBgh0bVxHPgZjA505bo9,0.402,0.151,4,-14.228,0.04,0.907,0.0,0.0941,0.489,144.069,238013,4,Sad,"{'title': 'FINNEAS – Break My Heart Again Lyrics', 'lyrics': '[Verse 1]\nHey, you\nI\'m just now leaving\nCan I come around later on this evening?\nOr do you need time?\nYes, of course, that\'s fine\n\n[Verse 2]\nHey, you\nGood morning\nI\'m sure you\'re busy now, why else would you ignore me?\nOr do you need space?\nYou can\'t help it if your mind has changed\n\n[Chorus]\nSo go ahead and break my heart again\nLeave me wonderin\' why the hell I ever let you in\nAre you the definition of insanity?\nOr am I?\nOh, it must be nice\nTo love someone who lets you break them twice\n\n[Verse 3]\nYou\'re so blue\nAre you still breathing?\nWon\'t you tell me if you found that deeper meaning\nDo you think I\'ve gone blind?\nI know it\'s not the truth when you say, ""I\'m fine""\n[Chorus]\nSo go ahead and break my heart again\nLeave me wonderin\' why the hell I ever let you in\nAre you the definition of insanity?\nOr am I?\nOh, it must be nice\nTo love someone who lets you break them twice\n\n[Bridge]\nDon\'t pretend that I\'m the instigator\nYou were the one, but you were born to say goodbye\nKissed me half (Kissed me half) a decade later\nThat same perfume, those same sad eyes\n\n[Chorus]\nGo ahead and break my heart again\nLeave me wonderin\' why the hell I ever let you in\nAre you the definition of insanity?\nOr am I?\nOr am I?\nIt must be nice\nTo love someone who lets you break them twice'}"
lofi.sad,coffee for your head (w rain) [slowed n reverb version],coffee for your head (w rain) - slowed n reverb version,0sAvpzUBIuU1x3OdZM0HkK,0.337,0.18,6,-22.923,0.0373,0.972,0.974,0.114,0.403,91.881,165124,4,Sad,"{'title': 'Powfu & beabadoobee – \u200b\u200bdeath bed (coffee for your ', 'lyrics': ""[Intro: beabadoobee]\nDon't stay awake for too long, don't go to bed\nI'll make a cup of coffee for your head\nIt'll get you up and going out of bed\n\n[Verse 1: Powfu]\nYeah, I don't wanna fall asleep, I don't wanna pass away\nI been thinking of our future 'cause I'll never see those days\nI don't know why this has happened, but I probably deserve it\nI tried to do my best, but you know that I'm not perfect\nI been praying for forgiveness, you've been praying for my health\nWhen I leave this earth, hopin' you'll find someone else\n'Cause yeah, we still young, there's so much we haven't done\nGetting married, start a family, watch your husband with his son\nI wish it could be me, but I won't make it out this bed\nI hope I go to heaven so I see you once again\nMy life was kinda short, but I got so many blessings\nHappy you were mine, it sucks that it's all ending\n\n[Chorus: beabadoobee, Powfu, beabadoobee & Powfu]\nDon't stay awake for too long, don't go to bed\nI'll make a cup of coffee for your head\nIt'll get you up and going out of bed (Yeah, ayy)\nDon't stay awake for too long, don't go to bed\nI'll make a cup of coffee for your head\nIt'll get you up and going out of bed (Ayy, yeah)\n\n[Verse 2: Powfu]\nI'm happy that you here with me, I'm sorry if I tear up\nWhen me and you were younger, you would always make me cheer up\nTaking goofy videos and walking through the park\nYou would jump into my arms every time you heard a bark\nCuddle in your sheets, sing me sound asleep\nAnd sneak out through your kitchen at exactly 1:03\nSundays, went to church, on Mondays, watched a movie\nSoon you'll be alone, sorry that you have to lose me\n\n[Chorus: beabadoobee, Powfu, beabadoobee & Powfu]\nDon't stay awake for too long, don't go to bed\nI'll make a cup of coffee for your head\nIt'll get you up and going out of bed\nDon't stay awake for too long, don't go to bed\nI'll make a cup of coffee for your head\nIt'll get you up and going out of bed\nDon't stay awake for too long, don't go to bed\nI'll make a cup of coffee for your head\nIt'll get you up and going out of bed\nDon't stay awake for too long, don't go to bed\nI'll make a cup of coffee for your head\nIt'll get you up and going out of bed\n\n[Outro: beabadoobee]\nDon't stay awake for too long, don't go to bed\nI'll make a cup of coffee for your head\nIt'll get you up and going out of bed""}"
Otterboy,unstable,unstable,0FrJdYGZyWrfYYLuVSXvqC,0.805,0.398,10,-13.726,0.246,0.74,9.22e-05,0.103,0.121,63.549,97313,4,Sad,"{'title': 'Jay Brannan – Unstable Boy Lyrics', 'lyrics': 'Staring down the barrel of another holiday\nForce fed a Christmas carol\nAnother time, another place, another way\nWhat child is this who, who laid to rest?\nMary\'s love is sleeping\nWhat child is this who, who feels so blessed?\nIt cannot keep from weeping\nI should be tending to the horses who intend to cart my joy\nFrom now until forever, I\'m just a lowly unstable boy\nI\'m a failure on a journey but my strength is gathering\nIt\'s only fair that I\'ll make it there, yeah, I\'m on my way to mattering\nBut all the way, on the way, I couldn\'t contain my fear\nMy lips only look rosy \'cause my skin looks so white in here\nShred up my fingers on this bottle cap that won\'t twist off\nAching for the syrup that could cure me of this hacking cough\nAsk me how I\'m feeling and I\'ll say I\'m okay\nThough my mind is wreathing, can\'t think of anything better to say\nIs that what you get for running a yellow light?\nA fistful of regret and a fix that doesn\'t last\nI\'m a super califragile piece of fucked up\nAll I need a spoon full of something fast\nI should be tending to the horses who intend to cart my joy\nFrom now until forever, I\'m just a lowly unstable boy\nI\'m a failure on a journey but my strength is gathering\nIt\'s only fair that I\'ll make it there, yeah, I\'m on my way to mattering\nBut all the way, on the way, I couldn\'t contain my fear\nMy lips only look rosy \'cause my skin looks so white in here\nShred up my fingers on this bottle cap that won\'t twist off\nAching for the syrup that could cure me of this hacking cough\nStupid fucking world of mine\nYou keep moving the fucking finish line\nYou trick me over here, you hide it over there\nYou start another game when you see me starting to care\nWell, I don\'t expect you to hear me say\n""I\'m gonna chew my way out of your lab rat cage someday""\nBut all the way, on the way, I couldn\'t contain my fear\nMy lips only look rosy \'cause my skin looks so white in here\nShred up my fingers on this bottle cap that won\'t twist off\nAching for the syrup that could cure me of this hacking cough'}"
Hayd,Superhero,Superhero,4NXROG27qc3PGsf6IK5MOD,0.626,0.125,9,-18.968,0.0517,0.877,0.0,0.352,0.144,119.907,241500,4,Sad,"{'title': 'Hayd – Superhero Lyrics', 'lyrics': ""[Verse 1]\nSuperman will never save you\nSpiderman will never catch you\nThe Flash will never run to you\nLike I would, When I was with you\n\n[Chorus]\nYou know you've reaped what you have sown\nYou know you’re the reason you're alone\nYou said I was your superhero\nBut sometimes superheroes cannot save everyone\n\n[Verse 2]\nIron Man will never heal you\nThe Hulk will never hold you\nAnother man will never love you\nLike I did. Like I still do\n\n[Chorus]\nYou know you've reaped what you have sown\nYou know you’re the reason you're alone\nYou said I was your superhero\nBut sometimes superheroes cannot save everyone\n\n[Bridge]\nI had to let go\nAnd watch you fall\nAnd I could've saved you\nBut you didn't want me to\nSo I let you go\nAnd I watched you fall\nAnd I could've saved you\nBut you didn't want me to\nSo I let you go\nAnd I watched you fall\nAnd I could've saved you\nBut you didn't want me to\n[Chorus]\nYou know you’ve reaped what you have sown\nYou know you’re the reason you're alone\nYou said I was your superhero\nBut sometimes superheroes cannot save everyone""}"
SadBoyProlific,Dead and Cold,Dead and Cold,1A43TfohQt3H6K5zg28ExD,0.793,0.441,2,-10.297,0.579,0.867,0.0,0.111,0.753,74.746,89652,4,Sad,"{'title': 'SadBoyProlific – Dead and Cold Lyrics', 'lyrics': ""Wake up every day and it just feels repetitive\nThink I need to chill, I think I need a sedative\nI think depression's hittin' me I think it's finally setting in\nDrifting to my feet and settling just like sediment\n\nCoastin' and walking down this road called life blindly\nFoolishly hoping for purpose to come and find me\nIn the depths of depression is where I've been residing\nThat or in my room under my covers just hiding\n\nPut me in the grave today\nBlack suit, red bouquet\nToo scared to leave, but too tired to stay\nBullet in the chamber will stop all of the pain\nBlood on the wall drips, just like red rain\n\nFeel my soul seep out with each line from the blade\nNo one sings along to the songs that I have made\nDeep in thought like Socrates\nI am not your property\nTreated like a mockery\nGlad no one is stopping me\nNot one you should idolize, this is my final goodbye\nBut if I ever hurt you, I truly apologize""}"
Conan Gray,Kid Krow,Heather,4xqrdfXkTW4T0RauPLv3WA,0.357,0.425,5,-7.301,0.0333,0.584,0.0,0.322,0.27,102.078,198040,3,Sad,"{'title': 'Conan Gray – Heather Lyrics', 'lyrics': ""[Verse 1]\nI still remember, third of December, me in your sweater\nYou said it looked better on\u2005me\u2005than it did\u2005you\nOnly if you knew, how much\u2005I liked you\nBut I watch your eyes as she\n\n[Pre-Chorus]\nWalks by\nWhat a sight for sore eyes, brighter than a blue sky\nShe's got you mesmerized while I die\n\n[Chorus]\nWhy would you ever kiss me?\nI'm not even half as pretty\nYou gave her your sweater, it's just polyester\nBut you like her better\n(Wish I were Heather)\n\n[Verse 2]\nWatch as she stands with her, holding your hand\nPut your arm 'round her shoulder, now I'm getting colder\nBut how could I hate her? She's such an angel\nBut then again, kinda wish she were dead as she\n\n[Pre-Chorus]\nWalks by\nWhat a sight for sore eyes, brighter than a blue sky\nShe's got you mesmerized while I die\n[Chorus]\nWhy would you ever kiss me?\nI'm not even half as pretty\nYou gave her your sweater, it's just polyester\nBut you like her better\n(I wish I were Heather)\n\n[Bridge]\n(Oh) Wish I were Heather\n(Oh, oh) Wish I were Heather\n\n[Chorus]\nWhy would you ever kiss me?\nI'm not even half as pretty\nYou gave her your sweater, it's just polyester\nBut you like her better\nWish I were""}"
Teqkoi,Please Come Back,Please Come Back,7zlGyAsvNMOdhTU068f79f,0.737,0.241,9,-16.034,0.0882,0.51,0.00572,0.108,0.345,100.0,121522,4,Sad,"{'title': 'Ondi Vil – Please Come Back Lyrics', 'lyrics': ""[Skit]\nYou know what I'm not sorry, I don’t take it back\n(Oh I woke up today)\nI thought we were just gonna be friends\nI can't handle it\nI can't keep my feelings all bottled up for you\nCan you honestly tell me that you feel nothing for me?\n(To see you if you called)\nI have feelings for you Sebastian\nThen, what’s wrong?\n\n[Sample]\nAnd this beating in my chest won't start back up\nIt just stalls and stalls and stalls and stalls (please come back)\nOh I woke up today\nJust to see if you called\nAnd this beating in my chest won't start back up\nIt just stalls and stalls and stalls and stalls (please come back)\n\n[Skit]\nIt's not like you have a husband, that's married to Jesus\n(Oh I woke up today)\nThat's not fair\n(Just to see if you called)\nWhy can't we be together?\nYou really want to know why?\nYes, I want to know why\n[Sample]\nAnd this beating in my chest won't start back up\nIt just stalls and stalls and stalls and stalls\n\n[Outro]\nCause’ I don’t trust myself with you""}"
Lofi Cloud,eyes blue x heather (Slowed),eyes blue x heather - Slowed,3D2HQSwjfHQU6NqwjFJJX7,0.777,0.456,7,-15.598,0.271,0.95,0.491,0.186,0.643,129.587,200176,4,Sad,"{'title': 'Fran Vasilić – Heather X Eyes Blue (Rewrite) Lyrics', 'lyrics': ""[Chorus]\nEyes blue or brown, can't remember\nLot of time has passed, since third of december\nEyes green or grey, can't remember\nBut I bet you know the colour of Heather's\n\n[Verse]\nGetting cold, but I have my own sweater\nFuck your polyester, 'cause cotton's way better\nYou were playing Jack and Rose\nWhen you sunk, only you froze, cause you gave her your sweater\nYou're lost in Atlantic, trying not to panic\nBut now it's to late to come back\nMovеd on and I'm better\nKnow my worth, I'm Heathеr\nNot taken for granted\n\n[Chorus]\nEyes blue or brown, can't remember\nLot of time has passed, since third of december\nEyes green or grey, can't remember\nBut I bet you know the colour of Heather's""}"
Rnla,Try to Be Better (Again),Try to Be Better (Again),6uPSExSu4Xt7HrtJRR1a2P,0.619,0.358,11,-12.621,0.0465,0.956,0.642,0.101,0.129,126.119,140982,4,Sad,"{'title': 'Rnla & yaeow – Try to Be Better (Again) Lyrics', 'lyrics': ""[Intro]\nI try to be better than I was before\nI try to work on everything and\u2005my\u2005flaws\n\n[Chorus]\n'Cause I got\u2005everything right here\nIf I just open\u2005my eyes\nAll the love surrounding me\nWhy can't I take it in?\nYeah, I know that you love me\nBut it's hard to love myself\nYeah, I want to be better\nBut somehow I keep falling apart again\n\n[Bridge]\nI keep falling apart again, apart again\nI keep falling apart again\n\n[Verse]\nI just wish you knew how, how hard I try\nIt never gets easier to work things out\nAll I want is to find the peace inside\nYeah, all I want is you to feel alright\n\n[Chorus]\n'Cause I got everything right here\nIf I just open my eyes\nAll the love surrounding me\nWhy can't I take it in?\nYeah, I know that you love me\nBut it's hard to love myself\nYeah, I want to be better\nBut somehow I keep falling apart again""}"
awfultune,MINE,MINE,51fMzpQpLMmeRP9qpekMRR,0.693,0.0693,1,-20.707,0.0492,0.845,1.14e-06,0.142,0.217,67.448,175354,3,Sad,"{'title': '\u200bawfultune – Mine Lyrics', 'lyrics': ""[Intro]\nToo many guys think I'm a concept or I complete them or I'm going to make them alive, but I'm just a fucked up girl who is looking for my own peace of mind. Don't assign me yours\n\nCalled her yesterday i hope shes doing fine\nI want to call her all the goddamn time\nGod knows i love her, god knows i try\nBut i'm gonna make her mine\nSat with her and hugged her while she cried\nCuddled her about a hundred fucking times\nShe gave me her time and i gave her mine\nI miss being between her thighs, yeah\n\nGod knows exactly what i'm doing\nGod knows exactly what i'm doing\nGod knows i don't have a clue all the time\nBut i'm gonna make her mine,yeah\n\nOoh, ooh, ooh, ooh\n\nGod knows exactly what i'm feeling\nGod knows i don't have any feelings\nGod knows i don't have a clue all the time\nBut i'm gonna make her mine,yeah\n\nI'm gonna make her mine, yeah\nI'm gonna make her, make her, make her\nMake her mine""}"
lofi.sad,this is home (slowed n reverb),this is home - slowed n reverb,2eUGvyITqVfhKYqEAdVS2V,0.44,0.219,3,-15.445,0.0354,0.945,0.000123,0.118,0.106,117.862,266606,3,Sad,"{'title': 'Cavetown – This Is Home Lyrics', 'lyrics': ""[Verse 1]\nOften, I am upset\nThat I cannot fall in love, but I guess\nThis avoids the stress of falling out of it\nAre you tired of me yet?\nI'm a little sick right now but I swear\nWhen I'm ready I will fly us out of here\n\n[Chorus]\n(Ooh-ooh-ooh-ooh-ooh)\nI'll cut my hair\n(Ooh-ooh-ooh-ooh-ooh)\nTo make you stare\n(Ooh-ooh-ooh-ooh-ooh)\nI'll hide my chest\nAnd I'll figure out a way to get us out of here\nOoh-ooh-ooh-ooh-ooh\nOoh-ooh-ooh-ooh-ooh\nOoh-ooh-ooh-ooh-ooh\nOoh-ooh-ooh-ooh-ooh\n\n[Verse 2]\nTurn off your porcelain face\nI can't really think right now and this place\nHas too many colors, enough to drive all of us insane\nAre you dead? Sometimes I think I'm dead\n'Cause I can feel ghosts and ghouls wrapping my head\nBut I don't wanna fall asleep just yet\n\n[Chorus]\n(Ooh-ooh-ooh-ooh-ooh)\nMy eyes went dark\n(Ooh-ooh-ooh-ooh-ooh)\nI don't know where\n(Ooh-ooh-ooh-ooh-ooh)\nMy pupils are\nBut I'll figure out a way to get us out of here\n\n[Bridge]\nGet a load of this monster\nHe doesn't know how to communicate\nHis mind is in a different place\nWill everybody please give him a little bit of space?\nGet a load of this train wreck\nHis hair's a mess and he doesn't know who he is yet\nBut little do we know, the stars\nWelcome him with open arms\nOh\n\n[Outro]\n(Ooh-ooh-ooh-ooh-ooh)\nTime is\n(Ooh-ooh-ooh-ooh-ooh)\nSlowly\n(Ooh-ooh-ooh-ooh-ooh)\nTracing his face\nBut strangely he feels at home in this place""}"
Powfu,I Know You're Not Happy,I Know You're Not Happy,0gx7MU31U0qNuG9poUqfa2,0.546,0.381,6,-14.594,0.0367,0.909,0.00167,0.119,0.39,139.621,197616,4,Sad,"{'title': ""Powfu – \u200bi know you're not happy Lyrics"", 'lyrics': ""[Intro: Sampled]\nGirl: I don't love you anymore\nBoy: Since when?\nGirl: Now. Just now. I don't wanna lie, can't tell the truth. It's over\nBoy: Doesn't matter. I love you, none of it matters\nGirl: Too late. Goodbye\n\n[Chorus]\nBaby, come walk with me\nI'll show you just what love can be\nNothing Like you've seen, before\nI can promise he's not the one (He's not the one)\nI can show you there's more to life than this\n(There's so much more)\nIf you decide to stay with me\nI've been noticing the things you say (You say)\nI've been noticing you walked away from him\nAnd you say you're happy\nI don't understand what you mean (What you mean)\nI don't understand why you've been with him\n(I don't understand)\n'Cause I know you're not happy (Happy)\n\n[Bridge: Sampled]\nBoy: I'm sorry, you misunderstand. I didn't mean to\nGirl: Yes, you did!\nBoy: I love you!\nGirl: Where?!\nBoy: What?\nGirl: Show me! Where is this love? I, I can't see it, I can't touch it\nI can't feel it. I can hear it, I can hear some words, but I can't do anything with your easy words, whatever you say, it's too late\n[Chorus]\nBaby, come walk with me (With me)\nI'll show you just what love can be (What it can be)\nNothing like you've seen, before (Before)\nI can promise he's not the one (He's not the one)\nI can show you there's more to life than this\n(There's so much more)\nIf you decide to stay with me (With me)\nI've been noticing the things you say (You say)\nI've been noticing you walked away from him\nAnd you say you're happy\nI don't understand what you mean (What you mean)\nI don't understand why you've been with him\n'Cause I know you're not happy (Happy)\n\n[Outro]\nBaby, come walk with me\nI'll show you just what love can be\nNothing Like you've seen, before\nI can promise he's not the one\nI can show you there's more to life than this\nIf you decide to stay with me""}"
nilöwh.,stay with me,stay with me,4wAA41xlqHTgiTc9da7xtP,0.664,0.258,3,-10.975,0.0485,0.935,0.479,0.108,0.358,86.997,97586,4,Sad,"{'title': 'Miki Matsubara 松原みき - Stay With Me 真夜中', 'lyrics': ""[Intro]\nTo you\nYes, my love to you\nYes, my love to you, you\nTo you\n\n[Verse 1]\nI am only me, you are only you\nI said that last night and still feel the same way\nYou in your gray jacket with that familiar coffee stain\nJust as you always are\nOur reflection in the display window\n\n[Chorus]\nStay with me\nKnocking on midnight's door\nBegging you not to go home (Ooh)\nThat season when I cried right in front of your eyes\nStay with me\nSaying our favourite words\nHolding on to our little moment (Ooh)\nI'll never forget it as long as I live\n\n[Verse 2]\nThey say love and affection are two different things\nYou told me last night\nSometimes I think so too\nWinter comes again and your heart has gone away\nIf I look back I see\nThat I could always feel you by my sidе\n[Chorus]\nStay with me\nKnocking on midnight's door\nThere's a holе in my heart (Ooh)\nThat season when I cried right in front of your eyes\nStay with me\nDistracted by my loneliness\nThe needle on my record player (Ooh)\nWas stuck on a repeating melody\n\n[Saxophone Solo]\n\n[Chorus]\nStay with me\nKnocking on midnight's door\nBegging you not to go home (Ooh)\nThat season when I cried right in front of your eyes\nStay with me\nSaying our favourite words\nHolding on to our little moment (Ooh)\nI'll never forget how warm it felt\n\n[Chorus]\nStay with me\nKnocking on midnight's door\nBegging you not to go home (Ooh)\nThat season when I cried right in front of your eyes\nStay with me\nSaying our favourite words\nHolding on to our little moment (Ooh)\nI'll never forget how warm it felt\n[Outro]\nStay with me\nKnocking on midnight's door\nBegging you not to go home (Ooh)\nThat season when I cried right in front of your eyes\nStay with me\n\n(Ooh, I'll never forget how warm it felt)""}"
yaeow,Worn Out Heart,Do You Ever Think of Me?,3UsCeel9NuKKmpls5B4osK,0.771,0.253,1,-13.368,0.182,0.7,0.0,0.0627,0.662,129.944,125538,4,Sad,"{'title': '\u200byaeow – Do You Ever Think of Me? Lyrics', 'lyrics': ""[Intro: yaeow]\nIt's been a long time since you drove away\nIt's been a long time since you\u2005called\u2005my name\nAnd I\u2005wonder, do you ever think of\u2005me?\n\n[Chorus: yaeow]\nIt's been a long time since you drove away\nIt's been\u205fa\u205flong\u205ftime since you\u205fcalled my name\nAnd\u205fI wonder, do you ever think of me?\nI try to stay strong but my heart is blue\nSomething always seem to bring me back to you\n'Cause I wonder, do you ever think of me?\n\n[Verse: Rxseboy]\nYeah, I be thinking 'bout you every second\nEvery day, I guess it's all the time, huh?\nI gave you attention, lit up like fluorescent\nI just wanted you to shine, huh\nI did it all for you, respected the solitude\nInvested in bonds and stocks, so I could go ball for you\nKnow I would fall for you\nBut I stumbled right into your bad side\nYeah, the side that was hurt but would act fine\nYeah, the side that was so into that guy\nYeah, the side in the parking lot last night\nYeah, the side that told me I was different\nConvinced me that I had it all figured out\nBelieved every word from your mouth\nCall me and you're at his house\nWhat is that about?\n[Chorus: yaeow]\nIt's been a long time since you drove away\nIt's been a long time since you called my name\nAnd I wonder, do you ever think of me?\nI try to stay strong but my heart is blue\nSomething always seem to bring me back to you\n'Cause I wonder, do you ever think of me?\n\n[Outro: yaeow]\nIt's been a long time since I last saw you\nAnd I hope you're fine, I really hope you're fine\nAnd it's okay if you don't think about me too""}"
