artist,album,track,track_id,danceability,energy,key,loudness,speechiness,acousticness,instrumentalness,liveness,valence,tempo,duration_ms,time_signature,mood,lyrics
Swik,disconnected,good things don’t last,09lRx1uMYnTqg3Cr3RHwNW,0.275,0.314,4,-12.634,0.0336,0.664,0.168,0.116,0.139,80.477,254477,4,Sad,"{'title': ""Swik – Good things don't last Lyrics"", 'lyrics': ""Good things don't last, but we want them like heaven...\nDeep fears from the past will catch us forever\nAnd I know I will go through the storm for you\nAnd I know I will follow you, in your darkness\nAnd I know I will go through the storm for you, and I know that…\n\nI will feel your pain but still take your hand\nI will share your hell even when I’m mad\nBaby hide my soul, deep into your arms\n‘cause good things don't last (good things don't last)\n\nI will feel your pain but still take your hand\nI will share your hell even when I’m mad\nBaby hide my soul, deep into your arms\n‘cause good things don't last (good things don't last)\n\nGood things don't last, but we want them like heaven...\nDeep fears from the past will catch us forever\nAnd I know I will go through the storm for you\nAnd I know I will follow you, in your darkness\nAnd I know I will go through the storm for you, and I know that…\n\nI will feel your pain but still take your hand\nI will share your hell even when I'm mad\nBaby hide my soul, deep into your arms\n‘cause good things don't last (good things don't last)\nI will feel your pain but still take your hand\nI will share your hell even when I'm mad\nBaby hide my soul, deep into your arms\n‘cause good things don’t last (good things don’t last)""}"
Sarcastic Sounds,I Don't Sleep,I Don't Sleep,0f0gfm6wHjhqrBMHBn9Ajr,0.774,0.352,6,-13.13,0.214,0.105,0.741,0.348,0.258,80.51,105143,4,Sad,"{'title': ""Sarcastic Sounds – I Don't Sleep Lyrics"", 'lyrics': ""[Spoken intro]\nHey what's the matter, honey?\n\n[Hook]\nI don't sleep 'cause when I do\nAll I dream are dreams of you\nAnd in yours, you say your teeth are falling out, oh\nI don't sleep 'cause when I do\nAll I dream are dreams of you\nAnd in yours, you say your teeth are falling out, oh\n\n[Instrumental]\n\n[Hook]\nI don't sleep 'cause when I do\nAll I dream are dreams of you\nAnd in yours, you say your teeth are falling out, oh\nI don't sleep 'cause when I do\nAll I dream are dreams of you\nAnd in yours, you say your teeth are falling out, oh""}"
Gracie Abrams,"I miss you, I’m sorry","I miss you, I’m sorry",1tF7RL54zjHSy0N2qEQLDY,0.617,0.451,7,-6.096,0.0481,0.734,1.56e-06,0.128,0.161,109.757,167538,4,Sad,"{'title': ""Gracie Abrams – I miss you, I'm sorry Lyrics"", 'lyrics': '[Verse 1]\nDo you remember happy together?\nI do, don\'t you?\nThen all of a sudden, you\'re sick to\u2005your\u2005stomach\nIs that still\u2005true?\n\n[Chorus]\nYou said, ""forever,"" in the end\u2005I fought it\nPlease be honest, are we better for it?\nThought\u205fyou\'d\u205fhate\u205fme, but instead\u205fyou called\nAnd said,\u205f""I miss you""\nI caught it\n\n[Verse 2]\nGood to each other, give it the summer\nI knew, you too\nBut I only saw you once in December\nI\'m still confused\n\n[Chorus]\nYou said, ""forever,"" and I almost bought it\nI miss fighting in your old apartment\nBreaking dishes when you\'re disappointed\nI still love you, I promise\nNothing happened in the way I wanted\nEvery corner of this house is haunted\nAnd I know you said that we\'re not talking\nBut I miss you, I\'m sorry\n[Outro]\nI don\'t wanna go, think I\'ll make it worse\nEverything I know brings me back to us\nI don\'t wanna go, we\'ve been here before\nEverywhere I go leads me back to you (You said, ""forever,"" and I almost bought it)\nI don\'t wanna go, think I\'ll make it worse (I miss fighting in your old apartment)\nEverything I know brings me back to us (Breaking dishes when you\'re disappointed)\nI don\'t wanna go, we\'ve been here before (I still love you, I promise)\nEverywhere I go leads me back to you (Nothing happened in the way I wanted)\nI don\'t wanna go, think I\'ll make it worse (Every corner of this house is haunted)\nEverything I know brings me back to us (And I know you said that we\'re not talking)\nI don\'t wanna go, we\'ve been here before (But I miss you)\nEverywhere I go leads me back to you\nI don\'t wanna go, think I\'ll make it worse\nEverything I know brings me back to us\nI don\'t wanna go, we\'ve been here before\nEverywhere I go leads me back to you'}"
yaeow,When I'm No Longer Here,When I'm No Longer Here,091BHawNKMMYOPh1W2N4jr,0.779,0.288,1,-12.991,0.447,0.613,0.00443,0.105,0.517,124.897,159360,4,Sad,"{'title': ""\u200byaeow – When I'm No Longer Here Lyrics"", 'lyrics': ""[Intro]\nWho will love you when I'm no longer here?\nWho will be there when you're broken\u2005down?\n'Cause\u2005I can't promise\u2005that I'll be here forever\nYeah, I\u2005can't promise that I'll be here to the end\n\n[Chorus]\nSo who\u205fwill\u205flove\u205fyou when I'm\u205fno longer here?\nWho\u205fwill be there when you're broken down?\n'Cause I can't promise that I'll be here forever\nYeah, I can't promise that I'll be here to the end\n\n[Verse]\nI'm just scared that one day I won't be here anymore\nAnd I wanna make sure that you're doing alright\n'Cause you are all I care about\nAnd I don't wanna say goodbye, want to be forever\nYeah, I want to know how you feel inside\n'Cause I know that one day I might be gone\n\n[Chorus]\nSo who will love you when I'm no longer here?\nWho will be there when you're broken down?\n'Cause I can't promise that I'll be here forever\nYeah, I can't promise that I'll be here to the end\n\n[Outro]\nWho will love you when I'm no longer here?\nWho will be there when you're broken down?\n'Cause I can't promise that I'll be here forever\nYeah, I can't promise that I'll be here to the end""}"
lofi.sad,what about me (slowed n reverb),what about me - slowed n reverb,6cUTdOO4du4c11VrvyNdXt,0.369,0.41,1,-10.903,0.0303,0.677,0.0,0.281,0.391,133.291,181159,4,Sad,"{'title': ""Timmies – Tell Me Why I'm Waiting Lyrics"", 'lyrics': ""[Intro: Shiloh Dynasty]\nTell me why I'm waiting for someone\nThat couldn't give a fuck about me\nNo, I wouldn't-\n\n[Chorus: Shiloh Dynasty]\nTell me why I'm waiting for someone\nThat couldn't give a fuck about me\nNo, I wouldn't-\nTell me why I'm waiting for someone\nThat couldn't give a fuck about me\nNo, I wouldn't-\nTell me why I'm waiting for someone\nThat couldn't give a fuck about me\nNo, I wouldn't-\nTell me why I'm waiting for someone\nThat couldn't give a fuck about me\nNo, I wouldn't-\n\n[Outro: Shiloh Dynasty]\nTell me why I'm waiting for someone\nThat couldn't give a fuck about me\nNo, I wouldn't-\nTell me why I'm waiting for someone\nThat couldn't give a fuck about me\nNo, I wouldn't-\nTell me why I'm waiting for someone\nThat couldn't give a fuck about me\nNo, I wouldn't-""}"
Post Malone,Hollywood's Bleeding,Goodbyes (feat. Young Thug),0t3ZvGKlmYmVsDzBJAXK8C,0.548,0.653,5,-3.875,0.081,0.456,0.0,0.103,0.163,150.068,174853,4,Sad,"{'title': 'Post Malone – Goodbyes Lyrics', 'lyrics': ""[Verse 1: Post Malone]\nMe and Kurt feel the same, too much pleasure is pain\nMy girl spites me in vain, all I do is complain\nShe needs something to change, need to take off the e-e-edge\nSo fuck it all tonight\nAnd don't tell me to shut up\nWhen you know you talk too much\nBut you don't got shit to say (Say)\n\n[Chorus: Post Malone]\nI want you out of my head\nI want you out of my bedroom tonight (Bedroom)\nThere's no way I could save you (Save you)\n'Cause I need to be saved too\nI'm no good at goodbyes\n\n[Verse 2: Post Malone]\nWe're both actin' insane, but too stubborn to change\nNow I'm drinkin' again, 80 proof in my veins\nAnd my fingertips stained, looking over the e-e-edge\nDon't fuck with me tonight\nSay you needed this heart, then you got it (Got it)\nTurns out that it wasn't what you wanted (Wanted)\nAnd we wouldn't let go and we lost it\nNow I'm a goner\n\n[Chorus: Post Malone]\nI want you out of my head (Head)\nI want you out of my bedroom tonight (Bedroom)\nThere's no way I could save you (Save you)\n'Cause I need to be saved too (Saved too)\nI'm no good at goodbyes\n\n[Verse 3: Young Thug]\nI want you out of my life\nI want you back here tonight\nI'm tryna cut you, no knife\nI wanna slice you and dice you\nMy argue possessive, it got you precise\nCan you not turn off the TV? I'm watchin' the fight\nI flood the garage, blue diamond, no shark\nYou're Barbie life doll, it's Nicki Minaj\nYou don't need a key to drive, your car on the charger\nI just wanna see the side, the one that's unbothered (Yeah)\nAnd I don't want ya to never go outside (Outside)\nI promise if they play, my niggas slidin' (Slidin')\nI'm fuckin' her, and the tour bus still ridin' (Ridin')\nYeah, yeah, yeah, yeah, yeah\n\n[Chorus: Post Malone]\nI want you out of my head (Head)\nI want you out of my bedroom tonight (Bedroom)\nThere's no way I could save you (Save you)\n'Cause I need to be saved too (Saved too)\nI'm no good at goodbyes\n\n[Outro: Post Malone & Young Thug]\nGoodbye, goodbye, goodbye (Bye, bye)\nGoodbye, goodbye, goodbye (Bye, bye)\n(Yeah, yeah, yeah, yeah, yeah)\nGoodbye, goodbye, goodbye (Bye, bye, bye)\nI'm no good at goodbyes\nGoodbye, goodbye, goodbye (Bye, bye)\nGoodbye, goodbye, goodbye (Bye, bye)\nGoodbye, goodbye, goodbye (Bye, bye)\nI'm no good at goodbyes""}"
Anson Seabra,Songs I Wrote in My Bedroom,That's Us,7sTDqaGUr9NM8NHQ5SNHi1,0.621,0.108,10,-15.399,0.0493,0.968,1.67e-05,0.137,0.204,129.285,270462,4,Sad,"{'title': ""Anson Seabra – That's Us Lyrics"", 'lyrics': ""[Verse 1]\nI shoulda known it wouldn't happen 'cause it wasn't right\nI shoulda known it 'cause it happens every goddamned time\nAlmost thought we could've been something\nAlmost thought we could have tried, but\nIt didn't happen so I need you to get out my life\n\n[Pre-Chorus]\nBut the other night I had you in my head, called you on the phone\nWant you stealing my time even though I said I wanna be alone\nOh, and I should know this could never work\nOh, this could never end well\nKnow it's only human but I never learn, I want you for myself\n\n[Chorus]\nI can take the fall, the pain, the pleasure\nAnd you can take it all, for worse, or better\nBut oh, what if we're wrong?\nWhat if we're not all that we thought?\nThen we won't make it along\nBut hey, I guess that's us\n\n[Verse 2]\nWe couldn't help it but you know that doesn't make it right\nYou say I'm selfish but I know you felt the same inside\nEverybody says it's all okay, everybody says we're fine but\nGuess someone else is what you need to make you feel alright\n\n[Pre-Chorus]\nBut tomorrow night I'll probably call a cab, show up at your door\nLove you in the night time, leave you in your bed, cold and wanting more\nOh, and I should know this could never work\nOh, this could never end well\nKnow it's only human, but I never learn, I need you for myself\n\n[Chorus]\nI can take the fall, the pain, the pleasure\nAnd you can take it all, for worse, or better\nBut oh, what if we're wrong?\nWhat if we're not all that we thought?\nThen we won't make it along\nBut hey, I guess that's us\nI can take the fall, the pain, the pleasure\nAnd you can take it all, for worse, or better\nBut oh, what if we're wrong?\nWhat if we're not all that we thought?\nThen we won't make it along\nBut hey, I guess that's love""}"
yaeow,One More Time,One More Time,6SOjqqblrBD2PprPuav43M,0.623,0.242,10,-15.055,0.0698,0.877,0.000745,0.208,0.191,129.907,151385,4,Sad,"{'title': '\u200byaeow & Roiael – One More Time Lyrics', 'lyrics': ""[Pre-Chorus: yaeow]\nDon't say you miss me one more time\n'Cause I can't get you off my mind\nAnd\u2005my\u2005heart can't take\u2005the fall\nI know that you're sorry\u2005but I'm scared\nIf we mess it up, I swear\nWe won't\u205ftalk\u205fagain\n\n[Chorus: yaeow & Roiael]\nDon't\u205fsay you miss\u205fme one more\u205ftime\n'Cause I can't get you off my mind\nAnd my heart can't take the fall\nI know that you're sorry but I'm scared\nIf we mess it up, I swear\nWe won't talk again\n\n[Verse: Roiael]\nI don't know if I can take it\nWere you faking just to see I'm not alright?\nI don't need, need your sympathy\nWhen I told you I loved you\nBefore you just took it out on me\n\n[Chorus: yaeow & Roiael]\nDon't say you miss me one more time\n'Cause I can't get you off my mind\nAnd my heart can't take the fall\nI know that you're sorry but I'm scared\nIf we mess it up, I swear\nWe won't talk again\n\n[Outro: Roiael]\nDon't say you miss me one more time\n'Cause I can't get you off my mind\nAnd my heart can't take the fall\n(I don't need, need your sympathy\nWhen I told you I loved you\nBefore you just took it out on me)\nI know that you're sorry but I'm scared\nIf we mess it up, I swear\nWe won't talk again""}"
Anson Seabra,Walked Through Hell,Walked Through Hell,6c7N5N7amAOpeMykjlovjI,0.508,0.404,10,-11.092,0.0788,0.664,0.0,0.104,0.129,81.713,216865,4,Sad,"{'title': 'Anson Seabra – Walked Through Hell Lyrics', 'lyrics': '[Verse 1]\nI guess all the mountains that I moved just weren\'t enough\nAnd all those nights I\u2005walked\u2005you home\nFrom crowded\u2005bars when you were drunk\nWell, they\u2005meant nothing \'cause you up and walked away\nAnd I just\u205fwonder\u205fwhat\u205fit\'d take to\u205fmake you stay\n\n[Pre-Chorus]\n\'Cause\u205fwhen you said, ""Jump"", I said, ""How high?""\nBut when I jumped, you said, ""Goodbye""\n\n[Chorus]\nI woulda walked through hell\nTo find another way\nI woulda laid me down\nIf I knew that you would stay\nI woulda crossed the stars\nTo keep you in my life\nBut now I\'m falling hard\nWithout you here tonight\nWithout you here tonight\n\n[Verse 2]\nWhat did you do with all that love you couldn\'t give?\nAnd do you need someone to help you?\nTell you what to do with it?\nIt must be nice to love someone who puts you first\nThen walk away when they expect it in return\n\n[Pre-Chorus]\n\'Cause when you said, ""Jump"", I said, ""How high?""\nBut when I jumped, you said, ""Goodbye""\n\n[Chorus]\nI woulda walked through hell\nTo find another way\nI woulda laid me down\nIf I knew that you would stay\nI woulda crossed the stars\nTo keep you in my life\nBut now I\'m falling hard\nWithout you here tonight\nWithout you here tonight\n\n[Bridge]\nYou don\'t want me\nNothing I can do, \'cause\nYou don\'t wanna try\n\n[Chorus]\nI woulda walked through hell\nTo find another way\nI woulda laid me down\nIf I knew that you would stay\nI woulda crossed the stars\nTo keep you in my life\nBut now I\'m falling hard\nWithout you here tonight\nWithout you here tonight\n\n[Outro]\nWithout you here tonight\nWithout you here tonight'}"
Kurt Hugo Schneider,Kurt & Company Vol 2,Sweater Weather,0kn9QwZW8Ow9eTuZgxVEz8,0.606,0.328,10,-7.824,0.0305,0.876,0.0,0.138,0.393,124.041,228387,4,Sad,"{'title': 'Kurt Hugo Schneider – Sweater Weather Lyrics', 'lyrics': ""[Intro: MAX & Alyson Stoner]\n'Cause it's too cold for you here, now\nSo let me hold both your hands\nIn the holes of my sweater\n\n[Verse 1: MAX & Alyson Stoner]\nAll I am is a man\nI want the world in my hands\nI hate the beach, but I stand\nIn California with my toes in the sand\nUse the sleeves of my sweater, let's have an adventure\nHead in the clouds, but my gravity's centered\nTouch my neck, and I'll touch yours\nMe in my little high-waisted shorts, oh\n\n[Pre-Chorus: MAX & Alyson Stoner]\nYou know what I think about\nAnd what I think about\nOne love, two mouths\nOne love, one house\nNo shirt, no blouse\nJust us, you find out\nNothing that I wouldn't wanna tell you about, no\n\n[Chorus: MAX & Alyson Stoner]\n'Cause it's too cold for you here\nAnd now, so let me hold\nBoth your hands in the holes of my sweater\n[Verse 2: Alyson Stoner & MAX]\nAnd if I may just take your breath away\nI don't mind if there's not much to say\nSometimes the silence guides our mind\nSo move to a place so far away, yeah\n\nThe goosebumps start to raise\nThe minute that my left hand meets your waist\nAnd then I watch your face\nPut my finger on your tongue\n'Cause you love the taste, yeah\n\nThese hearts adore\nEveryone the other beats hardest for\nInside this place is warm\nOutside it starts to pour\n\n[Pre-Chorus: MAX & Alyson Stoner]\nComin' down\nOne love, two mouths\nOne love, one house\nNo shirt, no blouse\nJust us, you find out\nNothing that I wouldn't wanna tell you about\nNo, no, no\n[Chorus: MAX & Alyson Stoner]\n'Cause it's too cold for you here\nAnd now, so let me hold\nBoth your hands in the holes of my sweater\n'Cause it's too cold for you here\nAnd now, so let me hold\nBoth your hands in the holes of my sweater\n\n[Bridge: MAX & Alyson Stoner]\nWoah, woah\nWoah, woah\nWoah, woah, woah (The holes of my sweater)\nWoah, woah, woah, woah (The holes of my sweater)\n\n[Chorus: MAX & Alyson Stoner]\n'Cause it's too cold for you here\nAnd now, so let me hold\nBoth your hands in the holes of my sweater\n'Cause it's too cold for you here\nAnd now, so let me hold\nBoth your hands in the holes of my sweater""}"
the bootleg boy,the day i died,the day i died,50HURWGNsCiJw4qFDQu40X,0.59,0.443,11,-11.408,0.0466,0.726,6.11e-06,0.387,0.198,120.025,134021,4,Sad,"{'title': 'THE BOOTLEG BOY – \u200bthe day i died Lyrics', 'lyrics': ""[Chorus: Powfu]\nYeah, I crashed my car, sorry that I can't be there\nAll those pictures on your\u2005wall,\u2005will you keep\u2005them?\nFeels like yesterday when I dropped\u2005you off at home\nBut the flowers by my grave are\u205fgetting\u205fold\nYeah,\u205fI crashed my\u205fcar, sorry that\u205fI'm not breathing\nVoice shaking, asking God if you can see me\nThe pain will fade away, and you'll find another guy\nSoon will come the day I don't cross your mind\n\n[Verse 1: Rxseboy]\nParamedics at the scene screamin'\nSaying that they couldn't stop the bleedin'\nTook a lot of trauma to the head\nMoments later said that I was dead\nDark outside just like my windows tinted\nHit the wall, was numb within an instant\nIf I could've swerved it would be different\nSorry that I couldn't go the distance\nCan’t help but think of you\nAll alone in your room when you drinkin' too\nPassed out in your bed, skipping work in the morning\nWeight on your shoulders is getting enormous\nAnd honestly, this was my fault\nI cannot be there to catch you whenever you fall\nI scream out to you when you call\nBut you'll never hear me, I'm sorry I ruined it all\n\n[Chorus: Powfu]\nYeah, I crashed my car, sorry that I can't be there\nAll those pictures on your wall, will you keep them?\nFeels like yesterday when I dropped you off at home\nBut the flowers by my grave are getting old\nYeah, I crashed my car, sorry that I'm not breathing\nVoice shaking, asking God if you can see me\nThe pain will fade away, and you'll find another guy\nSoon will come the day I don't cross your mind\n\n[Outro: Rxseboy]\nYeah, I crashed my car, sorry that I'm not breathin'\nVoice shaking, asking God if you can see me\nThe pain will fade away, and you'll find another guy\nSoon will come the day I don't cross your mind""}"
MASN,How To Kill A Rockstar,Hate Me!,6jmf4OxSGzdgthZruXtcqu,0.683,0.628,6,-6.512,0.123,0.659,0.0,0.106,0.356,142.06,154757,4,Sad,"{'title': 'MASN – Hate Me! Lyrics', 'lyrics': ""[Verse 1]\nWalk with the flowers, talk with me for hours\nTell me all that brings you grace\nTell\u2005me\u2005'bout your powers,\u2005I'll give you all my power\nSomething\u2005to rewind today\nLet's walk with the flowers, talk with me\u205ffor\u205fhours\nTell\u205fme all that\u205fbrings you grace\nTell\u205fme 'bout your powers, I'll give you all my power\nSomething to rewind today\n'Cause you could say you hate me\nAnd I would say I love you\nYou could fucking hate me (Hate me)\nAnd I would say I love you\n\n[Chorus]\n'Cause you could fucking hate me, and I would say I love you\nYou could act just like that, I'm right here\nYou could fucking hate me, and I would say I love you\nYou could act just like that, I'm not scared\nYou could fucking hate me, and I would say I love you\nYou could act just like that, I'm right here\nYou can try to break me, and I would say I love you\nI know I'm fucking broken, I'm right here, oh\n\n[Verse 2]\nWalk with the flowers, talk with me for hours\nYou could make me walk through flames\nTell me when it's over, swear we're never sober\nSun is burning on my face\nI'll tell you 'til we're older, I'm never getting over\nThe way you made me feel that day\nThis will make you hate me\nBut you could never break me\n\n[Chorus]\n'Cause you could fucking hate me, and I would say I love you\nYou could act just like that, I'm right here\nYou could fucking hate me, and I would say I love you\nYou could act just like that, I'm not scared\nYou could fucking hate me, and I would say I love you\nYou could act just like that, I'm right here\nYou can try to break me, and I would say I love you\nI know I'm fucking broken, I'm right here, oh\n\n[Outro]\nWalking with flowers, talking for hours\nTell me what brings you grace\nTelling my powers, giving my powers\nRewinding today""}"
Roderick Porter,Ghost (feat. Ivri),Ghost (feat. Ivri),6VyUWfImAgTrYAnYWonuhM,0.673,0.376,11,-14.029,0.0407,0.688,0.548,0.45,0.336,118.033,166625,4,Sad,"{'title': 'Roderick Porter – Ghost Lyrics', 'lyrics': ""[Chorus: ivri]\nI'm ready to self destruct\nWill you hold me, please\nI don't wanna do this, but\nI'm taking you with me\n\n[Verse: Roderick Porter]\nYou keep playing with my heart\nYou're tearing me apart\nSaw it coming from the start, the start, the start, the start\nAnd I, keep trying to run away\nKnow you need me to stay\nDon't look at me, don't look at me, don't look at me that way\n\n[Chorus: ivri]\nI'm ready to self destruct\nWill you hold me, please\nI don't wanna do this, but\nI'm taking you with me\nI'm ready to self destruct\nWill you hold me, please\nI don't wanna do this, but\nI'm taking you with me\n\n[Verse: Roderick Porter]\nYou keep playing with my heart\nYou're tearing me apart\nSaw it coming from the start, the start, the start, the start\nAnd I, keep trying to run away\nKnow  you need me to stay\nDon't look at me, don't look at me, don't look at me that way\n\n[Chorus: ivri]\nI'm ready to self destruct\nWill you hold me, please\nI don't wanna do this, but\nI'm taking you with me""}"
Troye Sivan,could cry just thinkin about you (Full Version),could cry just thinkin about you,3H7oAhHxkEkSf9iomv2mbG,0.515,0.323,6,-11.05,0.0429,0.318,0.0,0.106,0.188,147.972,158001,4,Sad,"{'title': 'Troye Sivan – \u200bcould cry just thinkin about you (Full Ver', 'lyrics': ""[Verse 1]\nWe wrote a life all by ourselves\nWish I could put it back on the shelf\nBut there's a dazzling wave that keeps me at bay with you, my love\nI ride this one all by myself\n\n[Chorus]\nI could cry just thinking about you\nEvery line I write is something about you\nEvery guy I want looks something just like you\nEvery book I read, I only read for you\nEvery art piece is just to remind you\nI don't know who I am, with or without you\nBut I guess I'm 'bout to find out, yeah\nYeah, I guess I'm 'bout to find out\n\n[Verse 2]\nWe took a trip and made the best\nWe laughed and played, then laid to rest\nBut life's a blackening wave drifting us further than we are\nAnd now we're knee-deep in this mess\n\n[Chorus]\nI could cry just thinking about you\nEvery line I write is something about you\nEvery guy I want looks something just like you\nEvery book I read, I only read for you\nEvery art piece is just to remind you\nI don't know who I am, with or without you\nBut I guess I'm 'bout to find out\nI, I, I""}"
Avery Grey,Smoking for the Aesthetic,Smoking for the Aesthetic,7HrWPQ6ISUcLNxhmdGB7bu,0.792,0.394,2,-12.917,0.435,0.949,0.0,0.107,0.474,164.081,181300,4,Sad,"{'title': 'Avery Grey – Smoking for the Aesthetic Lyrics', 'lyrics': '[Verse #1]\nThey say ""it all gets better""\nBut why does my heart still hurt\nSo bad still\nSo bad\nLet\'s just die together\nLet\'s make all of our heads hurt\nBut we\'re used to the pain, oh\n\n[Chorus]\nSmoking for the aesthetic\nPray to god I\'ll go to heaven\nNobody telling me to stop\nSmoking just to past the time\nDon\'t got a thing on my mind\nSmoking for the aesthetic\n\n[Verse #2]\nWoke up feeling woozy\nTried to numb anything\nI tried, oh\n\n[Chorus]\nSmoking for the aesthetic\nPray to god I\'ll go to heaven\nNobody tell me to stop\nSmoking just to past the time\nDon\'t got a thing on my mind\nSmoking for the aesthetic\nFor the aesthetic, oh\nSmoking for the aesthetic\nPray to god I\'ll go to heaven\nNobody tell me to stop\nSmoking just to past the time\nDon\'t got a thing on my mind\nSmoking for the aesthetic\nFor the aesthetic\nThe aesthetic'}"
