artist,album,track,track_id,danceability,energy,key,loudness,speechiness,acousticness,instrumentalness,liveness,valence,tempo,duration_ms,time_signature,mood,lyrics
Kina,Can We Kiss Forever?,Can We Kiss Forever?,58wyJLv6yH1La9NIZPl3ne,0.522,0.128,4,-18.717,0.0357,0.894,0.026,0.0941,0.124,109.986,187932,4,Sad,"{'title': 'Kina – Can We Kiss Forever? Lyrics', 'lyrics': ""[Verse 1]\nI tried to reach you, I can't hide\nHow strong's the feeling when we dive\nI crossed the ocean of my mind\nMy wounds are healing with the salt\nAll my senses intensified\nWhenever you and I, we dive\nI crossed the ocean of my mind\nBut in the end, I drown\nYou pushed me down, down\n(You pushed me down, down)\n(You pushed me down, down)\n\n[Instrumental]\n\n[Verse 2]\nAll the shame\nWhen you called my name\nI felt pain\nWhen you came\n\n[Instrumental]""}"
SYML,SYML,Where's My Love,2NeM9rfWo70KQej9GxeaoL,0.608,0.358,0,-10.018,0.0253,0.854,0.0186,0.113,0.365,103.94,202010,4,Sad,"{'title': ""SYML – Where's My Love Lyrics"", 'lyrics': ""[Verse 1]\nCold bones, yeah, that's my love\nShe hides away, like a ghost\n\n[Refrain]\nOoh, does she know that we bleed the same?\nOoh, don't wanna cry but I break that way\n\n[Verse 2]\nCold sheets, oh, where's my love?\nI am searching high, I'm searching low in the night\n\n[Refrain]\nOoh, does she know that we bleed the same?\nOoh, don't wanna cry but I break that way\n\n[Chorus]\nDid she run away? Did she run away? I don't know\nIf she ran away, if she ran away, come back home\nJust come home\n\n[Verse 3]\nI got a fear, oh, in my blood\nShe was carried up into the clouds high above\n\n[Refrain]\nOoh, If you bled, I bleed the same\nOoh, If you're scared, I'm on my way\n[Chorus]\nDid you run away? Did you run away? I don't need to know\nBut if you ran away, if you ran away, come back home\nJust come home""}"
luca.,someone who'll care,someone who'll care,3qpq58IwLwMtsZ667ch7BP,0.434,0.299,10,-12.924,0.0288,0.615,0.00121,0.0682,0.147,109.904,164500,4,Sad,"{'title': 'Suzanne Vega – Luka Lyrics', 'lyrics': ""[Verse 1]\nMy name is Luka\nI live on the second floor\nI live upstairs from you\nYes, I think you've seen me before\n\n[Chorus 1]\nIf you hear something late at night\nSome kind of trouble, some kind of fight\nJust don't ask me what it was\nJust don't ask me what it was\nJust don't ask me what it was\n\n[Verse 2]\nI think it's 'cause I'm clumsy\nI try not to talk too loud\nMaybe it's because I'm crazy\nI try not to act too proud\n\n[Chorus 2]\nThey only hit until you cry\nAnd after that, you don't ask why\nYou just don't argue anymore\nYou just don't argue anymore\nYou just don't argue anymore\n[Verse 3]\nYes, I think I'm okay\nWalked into the door again\nWell, if you ask, that's what I'll say\nAnd it's not your business anyway\n\n[Chorus 3]\nI guess I'd like to be alone\nWith nothing broken, nothing thrown\nJust don't ask me how I am\nJust don't ask me how I am\nJust don't ask me how I am\n\n[Verse 1]\nMy name is Luka\nI live on the second floor\nI live upstairs from you\nYes, I think you've seen me before\n\n[Chorus 1]\nIf you hear something late at night\nSome kind of trouble, some kind of fight\nJust don't ask me what it was\nJust don't ask me what it was\nJust don't ask me what it was\n[Chorus 2]\nThey only hit until you cry\nAnd after that you don't ask why\nYou just don't argue anymore\nYou just don't argue anymore\nYou just don't argue anymore""}"
Billie Eilish,"WHEN WE ALL FALL ASLEEP, WHERE DO WE GO?",listen before i go,0tMSssfxAL2oV8Vri0mFHE,0.319,0.0561,0,-23.023,0.045,0.935,0.00384,0.388,0.082,79.764,242652,3,Sad,"{'title': 'Billie Eilish – \u200blisten before i go Lyrics', 'lyrics': ""[Verse 1]\nTake me to the rooftop\nI wanna see the world when I stop breathing\nTurnin' blue\nTell me love is endless, don't be so pretentious\nLeave me like you do (Like you do)\n\n[Pre-Chorus]\nIf you need me, wanna see me\nBetter hurry 'cause I'm leavin' soon\n\n[Chorus]\nSorry can't save me now\nSorry I don't know how\nSorry there's no way out (Sorry)\nBut down\nHmm, down\n\n[Verse 2]\nTaste me, the salty tears on my cheek\nThat's what a year-long headache does to you\nI'm not okay, I feel so scattered\nDon't say I'm all that matters\nLeave me, déjà vu (Hmm)\n\n[Pre-Chorus]\nIf you need me, wanna see me\nYou better hurry, I'm leavin' soon\n[Chorus]\nSorry can't save me now (Sorry)\nSorry I don't know how (Sorry)\nSorry there's no way out (Sorry)\nBut down\nHmm, down\n\n[Outro]\nCall my friends and tell them that I love them\nAnd I'll miss them\nBut I'm not sorry\nCall my friends and tell them that I love them\nAnd I'll miss them\nSorry""}"
Kodaline,In A Perfect World (Expanded Edition),All I Want,0NlGoUyOJSuSHmngoibVAs,0.188,0.411,0,-9.733,0.0484,0.174,0.153,0.0843,0.159,187.376,305747,3,Sad,"{'title': 'Kodaline – All I Want Lyrics', 'lyrics': ""[Verse 1]\nAll I want is nothing more\nTo hear you knocking at my door\n'Cause if I could see your face once more\nI could die a happy man, I'm sure\nWhen you said your last goodbye\nI died a little bit inside\nI lay in tears in bed all night\nAlone without you by my side\n\n[Chorus]\nBut if you loved me, why'd you leave me?\nTake my body, take my body\nAll I want is, and all I need is\nTo find somebody, I'll find somebody\nLike you, oh, oh, oh\nLike you, like you\n\n[Verse 2]\nSo you brought out the best in me\nA part of me I'd never seen\nYou took my soul and wiped it clean\nOur love was made for movie screens\n\n[Chorus]\nBut if you loved me, why'd you leave me?\nTake my body, take my body\nAll I want is, and all I need is\nTo find somebody, I'll find somebody\nOh, oh, oh, oh\nOh, oh, oh, oh\nOh, oh, oh, oh, oh, oh\n[Chorus]\nIf you loved me, why'd you leave me?\nTake my body, take my body\nAll I want is, and all I need is\nTo find somebody, I'll find somebody\nLike you""}"
Valera,WANT U BAD,WANT U BAD,1w9yRUuQjZSG5rONZjJE6z,0.702,0.425,5,-12.442,0.09,0.266,0.243,0.135,0.376,135.001,133370,4,Sad,"{'title': 'Rubberbandits – Double Dropping Yokes with Eamon ', 'lyrics': 'I been a good boy, I said my prayers\nI brushed my teeth and I went upstairs\nI asked ""Lord God won\'t you bless my soul\nI want hole, foal, rock and roll\nWhen I grow up I wanna be\nThe baddest motherfucker what you ever done seen""\nBut Christ looked down, he said\n""My son, what you ask of me cannot be done\nThe position you require, it has been filled\nBy a bad motherfucker with a bag of pills\nA three-piece suit, snakeskin boots\nA rhinestone smile and an attitude\nHe\'ll rob you poor, he\'ll fuck your buerre\nHis name is written all across the toilet door\nHe\'ll get the holy ghost, he\'ll spread it on toast\nIt\'s fuckin\' Eamon de Valera and he\'s double-dropping yokes\n\nWe\'re double-dropping yokes, we\'re double-dropping yokes\nWe\'re fuckin\' double-dropping yokes with Eamon de Valera'}"
Kina,Baby You're Worth It,Baby You're Worth It,6vJ6FR4WtlKSxe8lmh3F1C,0.695,0.253,2,-15.884,0.0461,0.685,0.14,0.105,0.264,120.033,130926,4,Sad,"{'title': ""Kina – \u200bbaby you're worth it Lyrics"", 'lyrics': ""I'm not so perfect\nBaby yeah, you worth it\nCome right here\nCome right\n\nI'm not so perfect\nBaby yeah, you worth it\nCome right here\nCome right\n\nI'm not so perfect\nBaby yeah, you worth it\nCome right here\nCome right\n\nI'm not so perfect\nBaby yeah, you worth it\nCome right here\nCome right\n\nI'm not so perfect\nBaby yeah, you worth it\nCome right here\nCome right\n\nI'm not so perfect\nBaby yeah, you worth it\nCome right here\nCome right\nI'm not so perfect\nBaby yeah, you worth it\nCome right here\nCome right\n\nI'm not so perfect\nBaby yeah, you worth it\nCome right here\nCome right\n\nI'm not so perfect\nBaby yeah, you worth it\nCome right here\nCome right\n\nI'm not so perfect\nBaby yeah, you worth it\nCome right here\nCome right\n\nI'm not so perfect\nBaby yeah, you worth it\nCome right here\nCome right\n\nI'm not so perfect\nBaby yeah, you worth it\nCome right here\nCome right\nI'm not so perfect\nBaby yeah, you worth it\nCome right here\nCome right\n\nI'm not so perfect\nBaby yeah, you worth it\nCome right here\nCome right\n\nI'm not so perfect\nBaby yeah, you worth it\nCome right here\nCome right""}"
Anson Seabra,Songs I Wrote in My Bedroom,Broken,2AHKsVXN6BjBO8SEVX6cBC,0.481,0.0759,6,-14.2,0.0601,0.956,0.0,0.154,0.234,98.979,305676,4,Sad,"{'title': 'Anson Seabra – Broken Lyrics', 'lyrics': ""[Verse 1]\nIf you see the boy I used to be\nCould you tell him that I'd like to find him?\nAnd if you see the shell that's left of me\nCould you spare him a little kindness?\n\n[Pre-Chorus]\n'Cause I've been high and I've been low\nI've spent a thousand nights alone, tryna hold on tight\nFeelings come but they won't go\nPlease, won't someone take me home before I lose my mind?\n\n[Chorus]\nAm I broken? Am I flawed?\nDo I deserve a shred of worth or am I just another fake, fucked up lost cause?\nAnd am I human? Or am I something else?\n'Cause I'm so scared and there's no one there\nTo save me from the nightmare that I call myself\n\n[Verse 2]\nI've tried everything and anything\nBut nothing seems to work quite like it should\nBetween the madness and the apathy\nSeems there's nothing left inside of me that's good\n\n[Pre-Chorus]\n'Cause I've been high and I've been low\nI've spent a thousand nights alone, tryna hold on tight\nAnd feelings come but they won't go\nPlease, won't someone take me home before I lose my mind?\n[Chorus]\nAm I broken? Am I flawed?\nDo I deserve a shred of worth or am I just another fake, fucked up lost cause?\nAnd am I human? Or am I something else?\n'Cause I'm so scared and there's no one there\nTo save me from the nightmare that I call myself\n\n[Chorus]\nAm I broken? Am I flawed?\nDo I deserve a shred of worth or am I just another fake, fucked up lost cause?\nAnd am I human? Or am I something else?\n'Cause I'm so scared and there's no one there\nTo save me from the nightmare that I call myself""}"
ORYL,Better Now,Better Now,5OV8NQLC9eWzMN3jeKs3MJ,0.428,0.418,9,-10.602,0.0449,0.814,0.0354,0.124,0.177,139.307,130646,3,Sad,"{'title': 'Post Malone – Better Now Lyrics', 'lyrics': ""[Chorus]\nYou prolly think that you are better now, better now\nYou only say that 'cause I'm not around, not around\nYou know I never meant to let you down, let you down\nWoulda gave you anything, woulda gave you everything\nYou know I say that I am better now, better now\nI only say that 'cause you're not around, not around\nYou know I never meant to let you down, let you down\nWoulda gave you anything, woulda gave you everything\nOh-oh\n\n[Verse 1]\nI did not believe that it would end, no\nEverything came second to the Benzo\nYou're not even speakin' to my friends, no\nYou knew all my uncles and my aunts though\nTwenty candles, blow 'em out and open your eyes\nWe were lookin' forward to the rest of our lives\nUsed to keep my picture posted by your bedside\nNow it's in your dresser with the socks you don't like\nAnd I'm rollin', rollin', rollin', rollin'\nWith my brothers like it's Jonas, Jonas\nDrinkin' Henny and I'm tryna forget\nBut I can't get this shit outta my head\n\n[Chorus]\nYou prolly think that you are better now, better now\nYou only say that 'cause I'm not around, not around\nYou know I never meant to let you down, let you down\nWoulda gave you anything, woulda gave you everything\nYou know I say that I am better now, better now\nI only say that 'cause you're not around, not around\nYou know I never meant to let you down, let you down\nWoulda gave you anything, woulda gave you everything\nOh-oh\n\n[Verse 2]\nI seen you with your other dude\nHe seemed like he was pretty cool\nI was so broken over you\nLife, it goes on, what can you do?\nI just wonder what it's gonna take (What's it gonna take?)\nAnother foreign or a bigger chain (Bigger chain)\nBecause no matter how my life has changed\nI keep on looking back on better days\n\n[Chorus]\nYou prolly think that you are better now, better now\nYou only say that 'cause I'm not around, not around\nYou know I never meant to let you down, let you down\nWoulda gave you anything, woulda gave you everything\nYou know I say that I am better now, better now\nI only say that 'cause you're not around, not around\nYou know I never meant to let you down, let you down\nWoulda gave you anything, woulda gave you everything\nOh-oh\n\n[Bridge]\nI promise\nI swear to you, I'll be okay\nYou're only the love of my life (Love of my life)\n\n[Chorus]\nYou prolly think that you are better now, better now\nYou only say that 'cause I'm not around, not around\nYou know I never meant to let you down, let you down\nWoulda gave you anything, woulda gave you everything\nYou know I say that I am better now, better now\nI only say that 'cause you're not around, not around\nYou know I never meant to let you down, let you down\nWoulda gave you anything, woulda gave you everything\nOh-oh""}"
yaeow,Worn Out Heart,I Need U,6tmZRSTEAW90RI8nXsly1f,0.402,0.405,9,-12.486,0.0713,0.513,0.0167,0.155,0.072,84.873,142588,4,Sad,"{'title': '\u200byaeow – I Need U Lyrics', 'lyrics': ""[Verse 1]\nI'm the boy in the movie scene\nWho just wants to leave\nAnd never come back\nAnd you're\u2005the\u2005perfect company\nYou got\u2005dreams like me\nPlease can you take\u2005me away?\n\n[Chorus]\nSo let me ri-, ri-, ri-, ri-, ride away\u205fwith\u205fyou\nInto\u205fthe dark, into\u205fmy heart, I'll\u205ffollow you\nLet me ri-, ri-, ri-, ri-, ride away with you\n'Cause all of my scars are broken inside and I need you\n\n[Post-Chorus]\nI need you, need you, need you\nI need you, need you, need you\n\n[Verse 2]\nI see myself in you, the same shape of blue\nBut I'm not as strong\nYeah, I see the pain you carry\nAnd I wanna be there for you, oh\n\n[Chorus]\nSo let me ri-, ri-, ri-, ri-, ride away with you\nInto the dark, into my heart, I'll follow you\nLet me ri-, ri-, ri-, ri-, ride away with you\n'Cause all of my scars are broken inside and I need you\n[Post-Chorus]\nI need you, need you, need you\nI need you, need you, need you\n\n[Outro]\nSo let me ri-, ri-, ri-, ri-, ride away with you\nInto the dark, into my heart, I'll follow you\nLet me ri-, ri-, ri-, ri-, ride away with you\n'Cause all of my scars are broken inside and I need you""}"
Joji,BALLADS 1,SLOW DANCING IN THE DARK,0rKtyWc8bvkriBthvHKY8d,0.515,0.479,3,-7.458,0.0261,0.544,0.00598,0.191,0.284,88.964,209274,4,Sad,"{'title': 'Joji – SLOW DANCING IN THE DARK Lyrics', 'lyrics': ""[Verse 1]\nI don't want a friend (Just one more night)\nI want my life in two (My life in two)\nPlease one more night\nWaiting to get there\nWaiting for you (Waiting for you)\nJust one more night\nI'm done fighting all night\n\n[Pre-Chorus 1]\nWhen I'm around slow dancing in the dark\nDon't follow me, you'll end up in my arms\nYou done made up your mind\nI don't need no more signs\nCan you?\nCan you?\n\n[Chorus]\nGive me reasons we should be complete\nYou should be with him, I can't compete\nYou looked at me like I was someone else, oh well\nCan't you see? (Can't you see?)\nI don't wanna slow dance (I don't wanna slow dance)\nIn the dark, dark\n\n[Verse 2]\nWhen you gotta run\nJust hear my voice in you (My voice in you)\nShutting me out you (Shutting me out)\nDoing so great (So great, so great)\nYou\n\n[Pre-Chorus 2]\nUsed to be the one to hold you when you fall\nYeah, yeah, yeah (When you fall, when you fall)\nI don't fuck with your tone (I don't fuck with your tone)\nI don't wanna go home (I don't wanna go home)\nCan it be one night?\nCan you?\nCan you?\n\n[Chorus]\nGive me reasons we should be complete\nYou should be with him, I can't compete\nYou looked at me like I was someone else, oh well\nCan't you see?\nI don't wanna slow dance (I don't wanna slow dance)\nIn the dark, dark\nIn the dark, dark""}"
Hayd,Changes,Changes,2v8GT5HHcqFaTXS2xijw4r,0.648,0.115,6,-17.133,0.0445,0.939,3.88e-05,0.11,0.29,119.967,214815,4,Sad,"{'title': 'Hayd – Changes Lyrics', 'lyrics': ""[Verse 1]\nI've been going through the motions\nLearning how to pretend\nThat everything is perfect\nAnd I've been sinking in an ocean\nDrowning but I'm silent\nYet everyone thinks I'm afloat\n\n[Pre-Chorus]\nI'm running through mazes, mazes\nMaybe it's just a phase but regardless\nI'm flipping the pages, pages\n\n[Chorus]\nI'm going through changes\nBut I swear I'm the same\nCould you show me some patience\nAlong the way?\nI'm going through changes\nBut I swear I'm the same\nCould you show me some mercy\nIf I start to stray?\n\n[Verse 2]\nI've been chasing aftеr feelings\nMost of which are fleeting\nI still feel empty\nAnd I've been trying hard to fit in\nBut how comе I'm so different\nFrom everyone I see?\n\n[Pre-Chorus]\nI'm running through mazes, mazes\nMaybe it's just a phase but regardless\nI'm flipping the pages, pages\n\n[Chorus]\nI'm going through changes\nBut I swear I'm the same\nCould you show me some patience\nAlong the way?\nI'm going through changes\nBut I swear I'm the same\nCould you show me some mercy\nIf I start to stray?\n\n[Outro]\nTrying to fight the seasons\nTrying to find my meaning\nMaybe there's a reason\nWhy I'm going through these changes""}"
Monty Datta,Say Goodbye,Say Goodbye,3xNIVmBIe839tAsoGe3A4b,0.706,0.297,3,-13.652,0.132,0.468,0.0,0.0725,0.123,104.049,150415,4,Sad,"{'title': 'Monty Datta & Snøw – Say Goodbye Lyrics', 'lyrics': '[Verse]\nI do so much shit for you\nBut yet all you do is call out my wrongs\nI’m always there for you but yet all you do is call out when I’m gone\nJust make up your mind, I don’t wanna waste my time\nStop saying that you love me when you don’t even try\nI been up since the AM\nBottling up my emotions cause\nWhen I say, ""What’s wrong"" that’s another fucking wrong\n\n[Chorus]\nSo I\'m done, say goodbye\nGo ahead and cry, yeah\nYou had all this time\nSo I\'m done, say goodbye\nGo ahead and cry, yeah\nYou had all this time\n\n[Pre-Chorus]\nAnd I\'ve learned you can\'t do this like I can you did me dark god, damn\nAnd I\'ve learned you can\'t do this like I can you did me dark god, damn\n\n[Chorus]\nSo I\'m done, say goodbye\nGo ahead and cry, yeah\nYou had all this time\nSo I\'m done, say goodbye\nWhat\'s the point of trying now\nWhen you had all this time\nWhat\'s the point of trying now\nWhen you had all this time'}"
Cigarettes After Sex,Cigarettes After Sex,Apocalypse,7McZS9J6h0SKoZBR6cfcFe,0.369,0.465,5,-9.017,0.0277,0.0211,0.6,0.109,0.177,94.435,290617,4,Sad,"{'title': 'Cigarettes After Sex – Apocalypse Lyrics', 'lyrics': ""[Verse 1]\nYou leapt from crumbling bridges watching cityscapes turn to dust\nFilming helicopters crashing in the ocean from way above\n\n[Chorus]\nGot the music in you, baby, tell me why\nGot the music in you, baby, tell me why\nYou've been locked in here forever and you just can't say goodbye\n\n[Verse 2]\nKisses on the foreheads of the lovers wrapped in your arms\nYou've been hiding them in hollowed out pianos left in the dark\n\n[Chorus]\nGot the music in you, baby, tell me why\nGot the music in you, baby, tell me why\nYou've been locked in here forever and you just can't say goodbye\n\n[Bridge]\nYour lips, my lips\nApocalypse\nYour lips, my lips\nApocalypse\nGo and sneak us through the rivers\nFlood is rising up on your knees\nOh, please\nCome out and haunt me, I know you want me\nCome out and haunt me\n\n[Verse 3]\nSharing all your secrets with each other since you were kids\nSleeping soundly with the locket that she gave you clutched in your fist\n\n[Chorus]\nGot the music in you, baby, tell me why\nGot the music in you, baby, tell me why\nYou've been locked in here forever and you just can't say goodbye\nYou've been locked in here forever and you just can't say goodbye\n\n[Outro]\nOh, when you're all alone\nI will reach for you\nWhen you're feeling low\nI will be there too""}"
Ondi Vil,Drowning,Drowning,6fee735D9oJHuz9k3tp215,0.67,0.462,6,-8.3,0.274,0.722,8.52e-06,0.0785,0.218,94.753,100895,4,Sad,"{'title': 'Ondi Vil – Drowning Lyrics', 'lyrics': ""[Intro]\nYou pick me up\nAnd spin me around\nAnd dress me up\nAnd leave me on the ground, Again\nWell, I'm a prima ballerina\nSpin me around\nYou can watch me drown, Again\n\n[Verse]\nYou pick me up\nAnd spin me around\nAnd dress me up\nAnd leave me on the ground, Again\nWell, I'm a prima ballerina\nSpin me around\nYou can watch me drown, Again\nYou pick me up\nAnd spin me around\nAnd dress me up\nAnd leave me on the ground, Again\nWell, I'm a prima ballerina\nSpin me around\nYou can watch me drown, Again\nYou pick me up\nAnd spin me around\nAnd dress me up\nAnd leave me on the ground, Again\nWell, I'm a prima ballerina\nSpin me around\nYou can watch me drown, Again\n\n[Outro]\nYou said I look like the moon behind the clouds""}"
Kina,Nobody Cares,Nobody Cares,4CALLtGlZBwdpfQvMQvhH2,0.657,0.159,4,-15.618,0.0395,0.725,0.73,0.279,0.0833,100.018,175229,4,Sad,"{'title': 'Kina – \u200bnobody cares Lyrics', 'lyrics': ""[Intro]\nTell me why I'm waiting for someone\nThat couldn't give a fuck about me\nOh, oh you wouldn't\nTell me why I'm waiting for someone\nThat couldn't give a fuck about me\nOh, oh you wouldn't\n\n[Chorus]\nTell me why\nI'm waiting\nFor some-\nFor someone\nThat couldn't give a fuck about me\nOh,oh\nTell me why\nI'm waiting\nFor some-\nFor someone\nThat couldn't give a fuck about me\nOh,oh\n\n[Hook]\nTell me why I'm waiting for someone\nThat couldn't give a fuck about me\nOh, oh you wouldn't\nTell me why I'm waiting for someone\nThat couldn't give a fuck about me\nOh, oh you wouldn't\n[Chorus]\nTell me why I'm waiting for someone\nThat couldn't give a fuck about me\nOh, oh you wouldn't\nTell me why I'm waiting for someone\nThat couldn't give a fuck about me\nOh, oh you wouldn't\nTell me\nTell\nFor\nFor someone\nThat couldn't give a fuck about me""}"
Teqkoi,You Broke My Heart Again,You Broke My Heart Again,3jZDWsoxRHzzp3DYV8qeXE,0.55,0.143,3,-15.685,0.241,0.956,0.0,0.195,0.224,74.918,103400,4,Sad,"{'title': 'Teqkoi – You Broke My Heart Again Lyrics', 'lyrics': ""[Intro]\nI think you broke my heart again\nPlease don't leave and take my hand\nDrowning inside these walls of fear\nTake my hand and stay with me my dear\n\n[Verse]\nI think you broke my heart again\nPlease don’t leave and take my hand\nDrowning inside these walls of fear\nTake my hand and stay with me my dear\nI think you broke my heart again\nPlease don't leave and take my hand\nDrowning inside these walls of fear\nTake my hand and stay with me my dear\n\n[Outro]\nI think you broke my heart again\nPlease don't leave and take my hand\nDrowning inside these walls of fear\n(You knew before I did)\n(Why’re you crying?)\nTake my hand and stay...\n(Don't you know?)\n(Yes, I know exactly)""}"
Ollie MN,Songs from the Swamp,Please Never Fall in Love Again,42H6GeQfrBkT3vTUTdpB1M,0.646,0.0828,10,-16.205,0.0435,0.838,1.2e-05,0.0934,0.293,108.826,154000,4,Sad,"{'title': 'Ollie MN – Please Never Fall in Lov', 'lyrics': ""[Verse 1]\nCould've been one lonely night\nJust like the others\nBut you lit up my life\nThis is what it's like to be lovers\n\n[Pre-Chorus]\nYou and me need never be\nLonely again\nSpin with me endlessly\nOr at least until the end\n\n[Chorus]\nPlease never fall in love again\nOh, please never fall in love again\n\n[Verse 2]\nAnd if some other guy catches your eye\nPlease just text me your goodbye\nYou know I don't look pretty when I cry\n\n[Pre-Chorus]\nAnd I don't want that to be your final glimpse of me, baby\nBut if you could please return my Shrek DVDs maybe\n\n[Chorus]\nPlease never fall in love again\nOh, please never fall in love again\n[Outro]\nPlease""}"
Beach House,Depression Cherry,Space Song,1ujxjsoNvh4XgS2fUNwkZ2,0.509,0.79,0,-7.105,0.0293,0.218,0.125,0.144,0.625,147.073,320467,4,Sad,"{'title': 'Beach House – Space Song Lyrics', 'lyrics': ""[Verse 1]\nIt was late at night\nYou held on tight\nFrom an empty seat\nA flash of light\nIt will take a while\nTo make you smile\nSomewhere in these eyes\nI'm on your side\nYou wide-eyed girls\nYou get it right\n\n[Chorus]\nFall back into place\nFall back into place\n\n[Verse 2]\nTender is the night\nFor a broken heart\nWho will dry your eyes\nWhen it falls apart?\nWhat makes this fragile world go 'round?\nWere you ever lost?\nWas she ever found?\nSomewhere in these eyes\n[Chorus]\nFall back into place\nFall back into place\nFall back into place\nFall back into place\nFall back into place\nFall back into place\nFall back into place\nFall back into place\nFall back into place\nFall back into place\nFall back into place\nFall back into place\nFall back into place\nFall back in""}"
Beowülf,savior,savior,1vQaOx0V3jIeBepn5GPtTP,0.824,0.185,11,-21.059,0.0637,0.848,0.0638,0.119,0.18,106.004,110943,4,Sad,"{'title': 'Beowulf – Savoir (cover.oceans) Lyrics', 'lyrics': ""Login\nSee who's singing “Beowulf Savior - Instrumental Cover”\nSee All\nLyrics: Beo…\nLX2278\nLX2278\nInstrumental Cover\nBy LX2278 & DJ Tricks\nPlease\u2005Enjoy\n\nSpirit\u2005lead me\nWhere my\u2005trust Is without borders\nLet me walk\u2005upon the waters\nWherever you would call me\nTake me deeper than my feet\nCould ever wander\nAnd my faith will be made stronger\nIn the presence of my Savior\n\nSpirit lead me where my trust\nIs without borders\nLet me walk upon the waters\nWherever you would call me\nTake me deeper than my feet\nCould ever wander\nAnd my faith will be made stronger\nIn the presence of my Savior\nSpirit lead me where my trust\nIs without borders\nLet me walk upon the waters\nWherever you would call me\nTake me deeper than my feet\nCould ever wander\nAnd my faith will be made stronger\nIn the presence of my Savior""}"
